APPLICATION_ID,ACTIVITY,ADMINISTERING_IC,APPLICATION_TYPE,ARRA_FUNDED,AWARD_NOTICE_DATE,BUDGET_START,BUDGET_END,CFDA_CODE,CORE_PROJECT_NUM,ED_INST_TYPE,FOA_NUMBER,FULL_PROJECT_NUM,FUNDING_ICs,FUNDING_MECHANISM,FY,IC_NAME,NIH_SPENDING_CATS,ORG_CITY,ORG_COUNTRY,ORG_DEPT,ORG_DISTRICT,ORG_DUNS,ORG_FIPS,ORG_IPF_CODE,ORG_NAME,ORG_STATE,ORG_ZIPCODE,PHR,PI_IDS,PI_NAMEs,PROGRAM_OFFICER_NAME,PROJECT_START,PROJECT_END,PROJECT_TERMS,PROJECT_TITLE,SERIAL_NUMBER,STUDY_SECTION,STUDY_SECTION_NAME,SUBPROJECT_ID,SUFFIX,SUPPORT_YEAR,DIRECT_COST_AMT,INDIRECT_COST_AMT,TOTAL_COST,TOTAL_COST_SUB_PROJECT
9445335,I01,VA,2,N,2/16/2018,1/1/2018,12/31/2018,999,I01CX000230,,RFA-CX-17-001,2I01CX000230-06A1,,Non-SBIR/STTR RPGs,2018,Veterans Affairs,,LOS ANGELES,UNITED STATES,,33,66689118,US,481012,VA GREATER LOS ANGELS HEALTHCARE SYSTEM,CA,900731003,"Schizophrenia is a serious and debilitating psychiatric disorder, and it is a major public health concern for the Veterans Health Administration. Large gaps in our knowledge leave important questions unanswered, such as why the functional disability of schizophrenia is so severe, and why levels of functional impairment for patients have changed little over the past century, despite the availability of antipsychotic medications. Individuals with schizophrenia have marked impairments in processing social information (called social cognition), which result in misinterpretations of the intent of others, social withdrawal, and impaired daily social functioning. A challenge with developing new treatments for schizophrenia is that we do not understand the neural basis of social cognitive impairments. This study aims to address this issue by providing insights about the neural regions and the connections among them that underlie these social deficits.",1893429; ,"GREEN, MICHAEL F.;",,10/1/2010,12/31/2021,Address; Affect; analytical method; Anatomy; Anterior; Antipsychotic Agents; Area; base; Base of the Brain; Brain; cingulate cortex; Clinical assessments; Cognition; cost; Diffusion Magnetic Resonance Imaging; disability; Dorsal; Emotional; emotional experience; Emotions; Empathy; Employment; Evaluation; functional disability; Functional Magnetic Resonance Imaging; Goals; Grant; graph theory; health administration; Image; Impaired cognition; Impairment; indexing; Individual; insight; Insula of Reil; interest; Intervention; Knowledge; Lead; Matched Group; Measures; Medial; Mental disorders; Modeling; Monitor; Moods; Pain; Painless; Participant; Pathway Analysis; Patients; Pattern; Perception; Performance; Persons; Pharmaceutical Preparations; Population; Prefrontal Cortex; Process; Psyche structure; Psychotic Disorders; Public Health; Published Comment; Publishing; Recovery; Regulation; relating to nervous system; Retrieval; Schizophrenia; Seeds; segregation; social; social cognition; Social Functioning; social group; social neuroscience; Stimulus; System; Veterans; Withdrawal; Work; ,Social Processing Systems in Veterans with Schizophrenia: Identifying Deficits in Brain Activation and Network Organization,230,MHBB,Mental Health and Behavioral Science B ,,A1,6,,,,
9445504,R42,NS,5,N,2/15/2018,2/1/2018,1/31/2019,853,R42NS074576,,PA-14-072,5R42NS074576-05,NINDS:976739\,SBIR-STTR RPGs,2018,NATIONAL INSTITUTE OF NEUROLOGICAL DISORDERS AND STROKE,,LOS ANGELES,UNITED STATES,,33,24185420,US,10022306,"NEUROSIGMA, INC.",CA,900243812,"PUBLIC HEALTH RELEVANCE: Unruptured intracranial aneurysms are present in approximately 3% of the general population and rupture can be devastating with a high morbidity and mortality. The purpose of this project to complete preclinical testing of a new minimally invasive, flow diverting stent for treating intracranial aneurysms. This device may have significant advantages over current devices, and could help improve outcomes for the millions of patients with intracranial aneurysms worldwide.",3093920; 10391575 (contact); ,"KALLMES, DAVID F; KEALEY, COLIN PATRICK (contact);","FERTIG, STEPHANIE",8/15/2011,1/31/2019,Address; Aneurysm; Animal Model; Animals; Arteries; base; Biocompatible Materials; Biological; Blood; Blood Vessels; Clinic; Coagulation Process; commercialization; density; Devices; Dimensions; Feedback; Film; follow-up; General Population; Generations; Giant Intracranial Aneurysms; Goals; Growth; Head; healing; Human; human study; Implant; implantation; improved; improved outcome; In Vitro; Industrialization; Industry Standard; Intracranial Aneurysm; Investigation; meetings; Metals; Methods; minimally invasive; Morbidity - disease rate; mortality; Neck; neurovascular; next generation; nitinol; novel; Parents; Patients; Performance; Phase; preclinical development; Preclinical Testing; prevent; Process; Program Development; prototype; public health relevance; reconstruction; repaired; Risk; Rupture; scaffold; Silicon; Small Business Technology Transfer Research; Stents; success; Tail; Technology; Testing; Thinness; Time; Tissues; Tubular formation; uptake; ,Preclinical Testing of a Novel Flow Diverting Stent for Treating Intracranial Aneurysms,74576,ZRG1,Special Emphasis Panel ,,,5,,,976739,
9445635,R01,CA,1,N,2/12/2018,2/13/2018,1/31/2019,393,R01CA207196,SCHOOLS OF MEDICINE,PA-16-160,1R01CA207196-01A1,NCI:536920\,Non-SBIR/STTR RPGs,2018,NATIONAL CANCER INSTITUTE,,PITTSBURGH,UNITED STATES,PEDIATRICS,14,4514360,US,2059802,UNIVERSITY OF PITTSBURGH AT PITTSBURGH,PA,152132303,"PROJECT NARRATIVE: Lymphoma is the sixth most common form of cancer in the United States, affecting an estimated 23 per 100,000 people. This proposal will advance our knowledge of the molecular mechanisms that underlie the pathogenesis of specific subtypes of lymphoma. As such, these studies will facilitate the movement of basic laboratory discoveries to clinical application in the development of new treatment strategies.",1885037; 6805197 (contact); ,"LUCAS, PETER C; MCALLISTER-LUCAS, LINDA M (contact);","JHAPPAN, CHAMELLI",2/13/2018,1/31/2023,"actionable mutation; adaptive immune response; Affect; Antigen Receptors; Antigens; antitumor effect; B-Cell Lymphomas; B-Lymphocytes; Binding; Biochemical; Biology; cell type; Cells; Cleaved cell; Clinical; clinical application; Complex; Coupled; curative treatments; Cytoplasmic Protein; design; Development; Diagnosis; Evaluation; Event; G protein coupled receptor kinase; G-substrate; gain of function; gain of function mutation; genetic analysis; Goals; Growth; GTP-Binding Protein Regulators; Human; immune health; Immunologic Deficiency Syndromes; improved; In Vitro; in vivo; inhibitor/antagonist; innovation; insight; Intervention; Investigation; Knowledge; Laboratories; large cell Diffuse non-Hodgkin's lymphoma; Lead; Lymphocyte; Lymphocyte Activation; Lymphoma; Lymphomagenesis; Maintenance; Malignant - descriptor; Malignant lymphoid neoplasm; Malignant Neoplasms; Mantle Cell Lymphoma; Mediating; mimetics; Molecular; Movement; Mucosa- associated lymphoid tissue lymphoma translocation protein-1; mucosa-associated lymphoid tissue; mucosa-associated lymphoid tissue lymphoma; Mus; mutant; Mutation; N-terminal; novel; novel strategies; novel therapeutic intervention; Oncoproteins; Outcome; Pathogenesis; Pathogenicity; Pathway interactions; Patients; Peptide Hydrolases; Pharmacologic Substance; Phenotype; Phosphotransferases; Plant Roots; Play; prognostic; protein protein interaction; Protein Region; Proteins; receptor; Receptors, Antigen, B-Cell; Recruitment Activity; Recurrence; Regulation; Role; scaffold; Series; Signal Pathway; Signal Transduction; Signaling Protein; small molecule; Specimen; Study models; Therapeutic; therapeutic protein; transcription factor; treatment strategy; tumor; Tumor Suppressor Proteins; United States; Xenograft Model; ",New mechanisms for modulating the MALT1 oncoprotein,207196,TCB,Tumor Cell Biology Study Section ,,A1,1,348506,188414,536920,
9447095,R44,AA,5,N,2/13/2018,2/1/2018,1/31/2019,273,R44AA024349,,PA-14-071,5R44AA024349-03,NIAAA:440541\,SBIR-STTR RPGs,2018,NATIONAL INSTITUTE ON ALCOHOL ABUSE AND ALCOHOLISM,,ALEXANDRIA,UNITED STATES,,8,145470290,US,3340302,"ISA ASSOCIATES, INC.",VA,223142650,"PUBLIC HEALTH RELEVANCE: Unsafe alcohol consumption puts older adults at particular risk for multiple health problems, accidents, and hazardous interactions with medications requiring increased services and health care costs. While a number of intervention of have been shown to be effective in reducing at-risk drinking among older adults, the vast majority have been in-person interventions implemented by health professionals. The goal of this Fast-Track project is the development and test of an innovative, web-based alcohol misuse prevention intervention imbedded into a more general health promotion program for older adults that will provide a mechanism for broad dissemination of an efficacious and cost-effective intervention for Continuing Care Retirement Communities and other organizations that provide services to older adults. The ultimate goal of the project is to reduce at-risk drinking so that older adults cn live more healthful and engaged lives.",6909833; ,"DEITZ, DIANE K.;","BRESLOW, ROSALIND",6/10/2016,1/31/2019,Accidents; Address; Adult; Age; Age-Years; Aging-Related Process; Agreement; alcohol abuse prevention; Alcohol consumption; alcohol misuse; alcohol misuse prevention; alcohol screening and brief intervention; Alcoholic beverage heavy drinker; Alcohols; base; Benchmarking; brief intervention; Caring; Chronic Disease; Cognitive; Communities; Community Outreach; Comorbidity; comparative; Computers; cost effective; Data; design; Development; drinking; effective intervention; Effectiveness; Elderly; Elements; experience; falls; field study; Focus Groups; Goals; Health; Health behavior; Health behavior change; Health Care Costs; Health Professional; Health Promotion; Healthy Eating; Heavy Drinking; high risk drinking; improved; Individual; innovation; interest; Internet; Intervention; Letters; Marketing; Mathematics; Measures; Modeling; Online Systems; open data; outreach program; Participant; Persons; Pharmaceutical Preparations; Phase; Physical activity; Physicians' Offices; Population; Population Intervention; Predisposition; Preparation; Prevalence; Prevention; Prevention program; Preventive Intervention; Primary Care Physician; programs; prototype; public health relevance; Randomized; Randomized Controlled Trials; randomized trial; Recruitment Activity; Reporting; Research; residence; Resources; Retirement; Risk; Running; Sampling; Science; Series; Services; Site; social; social stigma; Specific qualifier value; Stress; stress management; Substance Abuse Detection; Tablets; Testing; touchscreen; user-friendly; Waiting Lists; Work; young adult; ,Web-Based Alcohol Misuse Prevention Intervention for the Elderly,24349,ZRG1,Special Emphasis Panel ,,,3,,,440541,
9447683,I01,VA,1,N,2/16/2018,1/1/2018,12/31/2018,999,I01CX001504,,RFA-CX-17-001,1I01CX001504-01A2,,Non-SBIR/STTR RPGs,2018,Veterans Affairs,,ANN ARBOR,UNITED STATES,,12,96318480,US,481045,VETERANS HEALTH ADMINISTRATION,MI,481052303,"Project Narrative Headache imaging is common, costly, and increasing over time despite guidelines that recommend against these studies. New approaches are needed to improve the care of the many veterans with headaches. We currently do not know the correct MRI images needed for patients with headaches. We also do not know the benefits or harms of headache scans. Furthermore, we do not know the main reasons that physicians and patients want to order these studies despite the evidence in the guidelines. Our project attempts to address these problems. We will compare a one sequence MRI test to the typical MRI that veterans with headaches receive as part of their routine care. We will also determine how common abnormal findings are seen that do not help patients and the harms that result from these findings. We will also determine which patient factors predict finding an important finding on MRI. Finally, we will discover the reasons that physician and patient want these tests despite the guidelines that suggest that we should order them only rarely.",9805574; ,"CALLAGHAN, BRIAN CHRISTOPHER;",,1/1/2018,12/31/2021,Address; adjudication; administrative database; Affect; Anatomy; Automobile Driving; base; Behavior; behavior change; Benefits and Risks; Brain; Brain Neoplasms; Caring; Characteristics; Chronic Headaches; Classification; Clinical; Clinical Data; Clinical Management; clinical practice; clinical risk; clinically actionable; Consensus; Consultations; cost; Data; design; Diagnosis; Diagnostic Imaging; Diagnostic tests; evidence base; Future; Guidelines; Headache; Health; high risk; Image; improved; Incidence; innovation; Intervention; Knowledge; Lead; Lesion; Magnetic Resonance Imaging; MRI Scans; neuroimaging; Neurologic; Neurologist; novel strategies; Outcome; Outpatients; Patient risk; Patients; Pattern; Phenotype; Physicians; Population; population survey; Predictive Factor; Primary Health Care; Procedures; Protocols documentation; Provider; radiologist; Recruitment Activity; Reporting; response; Retrospective Studies; routine care; Scanning; Solid; support tools; Surveys; Symptoms; System; Testing; theories; Time; Translating; Veterans; Work; ,Optimizing the approach to headache neuroimaging,1504,EPID,Epidemiology ,,A2,1,,,,
9448732,R01,HL,1,N,1/27/2018,2/15/2018,1/31/2019,837,R01HL134956,SCHOOLS OF MEDICINE,PA-15-347,1R01HL134956-01A1,NHLBI:421237\,Non-SBIR/STTR RPGs,2018,"NATIONAL HEART, LUNG, AND BLOOD INSTITUTE",,NEW YORK,UNITED STATES,ANATOMY/CELL BIOLOGY,13,78861598,US,3839801,ICAHN SCHOOL OF MEDICINE AT MOUNT SINAI,NY,100296574,"PROJECT NARRATIVE Congenital heart defects are the most common type of birth defects, and a better understanding of how the heart develops will be critical to determine the cause of these defects. We have discovered a novel ventricular- specific progenitor population that can be distinguished during gastrulation. By following the developmental trajectory of these prospective ventricular cells and by determining their specification mechanisms over time, we will provide new insights into how the four-chambered heart is built and instruct novel translational strategies to generate defined cell types from human pluripotent stem cells.",11923927; ,"DUBOIS, NICOLE ;","SCHRAMM, CHARLENE A",2/15/2018,1/31/2022,Affect; Antibodies; base; Biological Models; Cardiac; Cardiac development; Cardiac Myocytes; cardiogenesis; Cardiovascular system; Cell Differentiation process; cell fate specification; Cell Line; Cell surface; cell type; Cells; Communication; Comprehension; Congenital Abnormality; Congenital Heart Defects; congenital heart disorder; Data; Defect; Development; Disease model; EGF gene; Endothelium; Epicardium; Epidermal Growth Factor Receptor; Event; forkhead protein; Future; gastrulation; Generations; genetic signature; Goals; Heart; Heart Atrium; Heart Diseases; Human; human pluripotent stem cell; improved; In Vitro; in vivo; insight; Knowledge; Laboratories; Lead; men; Mesoderm; Methods; Modeling; Molecular; Molecular Analysis; Molecular Profiling; Monitor; mortality; mouse development; Myocardial; Myocardial Infarction; Myocardial tissue; Myocardium; Nature; Newborn Infant; Nodal; novel; Pathway interactions; Population; presenilin-1; prevent; progenitor; prospective; Proteins; Protocols documentation; Publishing; Recovery; regenerative; regenerative therapy; Regulator Genes; Replacement Therapy; Reporter; Role; screening; Signal Pathway; Signal Transduction; Signaling Protein; small molecule; Smooth Muscle Myocytes; spatiotemporal; Stem cells; System; Technology; Testing; Therapeutic; Time; transcriptome; Translating; translational approach; translational impact; United States; Ventricular; Woman; Work; ,Defining the spatio-temporal mechanisms of ventricular cell specification and differentiation,134956,CDD,Cardiovascular Differentiation and Development Study Section ,,A1,1,250000,171237,421237,
9449855,I01,VA,1,N,2/16/2018,10/1/2017,9/30/2018,999,I01CX001617,,RFA-CX-17-001,1I01CX001617-01A1,,Non-SBIR/STTR RPGs,2018,Veterans Affairs,,PHILADELPHIA,UNITED STATES,,2,71609291,US,481078,PHILADELPHIA VA MEDICAL CENTER,PA,191044551,"We discovered an unexpected role for taste receptors in the human nose: they detect and respond to the chemical signals produced by bacteria. In this project we will test the idea that people with inborn differences in taste receptor function have different microbial signatures and different susceptibilities to chronic rhinosinusitis. This ?bitterome? research could explain, at least in part, how bacterial virulence arises in specific individuals and perhaps how best to personalize treatment.",8098814; ,"COHEN, NOAM A;",,10/1/2017,9/30/2021,Affect; Age; Antibiotics; Asia; Bacteria; bactericide; base; biodefense; Bioinformatics; Biological Assay; Biological Process; case control; Cells; Chemicals; chronic rhinosinusitis; Clinical; Collection; Data; Development; Diagnostic tests; Disease; disorder risk; Enrollment; Ensure; Environment; Epithelium; Event; experimental study; Exposure to; fighting; Functional disorder; Funding; Future; Gene Family; Generations; Genetic; Genetic Predisposition to Disease; Genetic Variation; Genomic DNA; Genomics; Genotype; Goals; Gram-Negative Bacteria; Health Personnel; Home environment; Human; Human Genetics; Human Genome; Human Microbiome; Immune response; Individual; Iraq; knock-down; Laboratories; Lead; Length; Ligands; Measures; Medical; Microbe; microbial; Microbial Biofilms; microbial community; Microbiology; microbiome; microbiota; Mucosal Immunity; National Institute on Deafness and Other Communication Disorders; neglect; new technology; Nose; novel; operation; Operative Surgical Procedures; oral sensory; Outcome; outcome forecast; Pathology; Patients; Pattern; personalized medicine; Persons; Phase; Phenotype; Physiological; Predisposition; productivity loss; Pseudomonas aeruginosa; Publishing; quorum sensing; Race; ranpirnase; Reaction; receptor; receptor expression; receptor function; Receptor Gene; Reporting; Research; Research Institute; Research Personnel; Resolution; Respiration Disorders; response; rhinosinusitis; Risk; Role; rRNA Genes; Sampling; Science; Scientist; Sensory; sex; Shapes; Signal Pathway; Signal Transduction; Sinusitis; Site; skills; Small Interfering RNA; Smell Perception; Surgeon; Surveys; Swab; Symptoms; System; Taste Buds; Taste Perception; Taxonomy; Technology; Testing; Therapeutic; Tissues; Tongue; Variant; Vestibule; Veterans; Virulence; Visit; Work; ,"Taste Receptor Genetics, The Sinonasal Microbiome and Chronic Rhinosinusitis",1617,INFB,Infectious Diseases B ,,A1,1,,,,
9453382,K99,CA,1,N,2/8/2018,2/12/2018,1/31/2019,398,K99CA215301,,PA-16-193,1K99CA215301-01A1,NCI:179280\,OTHER RESEARCH-RELATED,2018,NATIONAL CANCER INSTITUTE,,BOSTON,UNITED STATES,,8,73130411,US,4907701,MASSACHUSETTS GENERAL HOSPITAL,MA,21142696,"PROJECT NARRATIVE Despite tremendous strides in the advancement of synthetic methodologies for generating sophisticated ligand-directed nanoparticles, targeted nanotherapeutics often yield inconsistent results when translocating as an extension from in vitro success to a complex in vivo environment. This is largely due to difficulties in defining molecular selectivity at the cellular level in vivo, irrespective of global tumor uptake that can oftentimes be skewed by the dominating pharmacokinetics and the enhanced permeability and retention (EPR) effect within the tumor. In this proposal, quantitative dual-tracer molecular binding imaging will be used as the primary criterion for defining in vivo molecular selectivity of modular nanoconjugates at the cellular level, and will thus accurately direct their tailored bioengineering to enhance outcomes of heterogeneously-targeted head and neck cancer phototherapies.",12212817; ,"OBAID, GIRGIS ;","RADAEV, SERGEI",2/12/2018,1/31/2020,Affinity; Alanine; Anatomy; Antibody-drug conjugates; Attenuated; attenuation; base; Binding; Binding Sites; Biodistribution; Biomedical Engineering; cancer cell; Carboplatin; Cells; cellular targeting; Cetuximab; Chemicals; Chemistry; cohesion; Complement; Complex; Custom; cytotoxicity; density; design; Disease; Drug Carriers; Drug Kinetics; Engineering; Environment; Epidermal Growth Factor Receptor; Equilibrium; ERBB2 gene; Esthetics; Event; Failure; fluorescence imaging; Functional disorder; Future; Head and Neck Cancer; Head and Neck Squamous Cell Carcinoma; Heterogeneity; Human; Image; improved; improved outcome; In Vitro; in vivo; innovation; insight; Ligands; Light; Liposomes; Malignant Epithelial Cell; Malignant Neoplasms; Measures; member; Mentors; Mentorship; Methodology; Modality; Modeling; Molecular; molecular imaging; Molecular Profiling; Molecular Target; Mus; Mutagenesis; Nanoconjugate; nanomedicine; nanoparticle; nanoscience; Nanotechnology; nanotherapeutic; novel; Operative Surgical Procedures; Otolaryngologist; Outcome; Penetration; Permeability; Phase; Photosensitization; Photosensitizing Agents; Phototherapy; Physiology; Platinum; programs; Protein Engineering; PUVA Photochemotherapy; Radiation therapy; receptor; Recombinants; Research; Research Infrastructure; response; Scanning; Seeds; spatiotemporal; Specialist; Specificity; Spectrum Analysis; success; Surface; Surface Plasmon Resonance; synergism; targeted treatment; Tracer; Training; Trastuzumab; Treatment Efficacy; Treatment outcome; treatment response; tumor; Tumor Biology; tumor heterogeneity; tumor microenvironment; uptake; ,Molecular imaging-directed bioengineering of nanoconjugates as adaptable tumor targeting platforms,215301,ZCA1,Special Emphasis Panel ,,A1,1,166000,13280,179280,
9459992,R01,MH,5,N,2/13/2018,2/13/2018,1/31/2019,242,R01MH082833,SCHOOLS OF ARTS AND SCIENCES,PA-16-160,5R01MH082833-06,NIMH:310612\,Non-SBIR/STTR RPGs,2018,NATIONAL INSTITUTE OF MENTAL HEALTH,,ATLANTA,UNITED STATES,PSYCHOLOGY,5,66469933,US,2384501,EMORY UNIVERSITY,GA,303224250,"Public Health Relevance Statement The PI will take advantage an animal model uniquely suited to connect genetic variation with individual differences in behavior. Tracing the causal chain of events from a change in gene sequence to a change in behavioral phenotype is expected to increase understanding of the relationship between human genome variation and mental health. The project is relevant to NIH?s mission to (1) examine gene regulatory mechanisms in model organisms that help clarify genetic and epigenetic components of brain function, and (2) investigate the interactions among neural, gene, behavioral and endocrine systems in the control of complex social behaviors.",1928876; ,"MANEY, DONNA L;","ARGUELLO, ALEXANDER",4/15/2010,1/31/2022,"Affect; Aggressive behavior; Alleles; American; Amino Acid Sequence; Animal Behavior; Animal Model; Animals; base; Behavior; Behavioral; Biological; Biological Assay; Birds; Brain; brain tissue; Chromosomal Rearrangement; Chromosomes, Human, Pair 2; Collaborations; comparative; comparative genomics; Complex; Data; differential expression; Differentiated Gene; Endocrine system; Epigenetic Process; epigenetic profiling; Event; Evolution; Funding; Gene Expression; Genes; Genetic; Genetic Drift; Genetic Polymorphism; Genetic Transcription; genetic variant; Genetic Variation; Genome; genome sequencing; genome-wide; genomic tools; Genomics; Genotype; Glutamate Receptor; Goals; Habitats; Haplotypes; Heritability; Heterozygote; Human; Human Genome; In Vitro; in vivo; Individual; Individual Differences; innovation; interdisciplinary collaboration; knock-down; life history; Link; Mental Health; Messenger RNA; Mission; Modeling; Modernization; Molecular; Mutation; Neuropeptides; novel; Oligonucleotides; Pharyngeal structure; Phenotype; Physiological; Production; programs; promoter; protein expression; Protein Isoforms; Proteins; Proteomics; public health relevance; Publishing; Regulator Genes; relating to nervous system; Reporter; Research; Research Personnel; Resources; Role; Secure; serotonin receptor; sex; social; Social Behavior; Songbirds; Sparrows; Study models; success; Territoriality; Testing; Tissue-Specific Gene Expression; tool; United States National Institutes of Health; Variant; Vertebrates; Work; ",A Unique Natural Model for Studying the Mechanisms Underlying Social Behavior,82833,NNRS,"Neuroendocrinology, Neuroimmunology, Rhythms and Sleep Study Section ",,,6,237879,72733,310612,
