"APPLICATION_ID","ABSTRACT_TEXT"
"9497754","Core A - Core Summary:  This application constitutes a request for continuation of a Tropical Medicine Research Center  that was awarded to Banaras Hindu University in Varanasi, India in 2007 and 2012.  Participating investigators form a multi-national network of collaborating scientists studying  critical aspects of the fatal disease, visceral leishmaniasis, in Bihar State, India. This region has  the highest endemic rate of visceral leishmaniasis in India, and one of the highest rates of  visceral leishmaniasis worldwide. The renewed program will build on the substantial foundation  set up in the first TMRC program, including entry of 111,999 subjects from the state of Bihar into  a substantial epidemiological survey. The considerable progress made in understanding the  epidemiologic, genetic and immune risks for visceral leishmaniasis have formed the hypotheses  upon which this renewed application is built. The program will include one scientific core, a  Health Demographic Surveillance System. Three projects are proposed: (1) Human  epidemiology in the context of the VL elimination initiative, (2) Vector Biological Studies, (3)  Immune regulation in human VL. The program will be coordinated at Banaras Hindu University,  through the efforts of the Administrative Core and the Data Management and Biostatistics Core.  Specific aims of the program are:  1. To provide administrative coordination of the one scientific core, the three research projects   and the Data Management & Biostatistics core of the TMRC program. This will include   communication with collaborating investigators at institutions within and outside of India,   communication with NIH personnel, and assurance of compliance with NIH requirements.  2. To provide financial accounting and oversight of finances at BHU, KAMRC in Muzaffarpur,   Institute of Tropical Medicine, Belgium, QIMR Berghofer Medical Research Institute,   Herston, Australia and the University of Iowa, USA. This will include distribution of funds,   payment of salaries and overall accounting of expenses.  3. To perform the day to day management of the projects. This will involve purchase and   distribution of equipment and research supplies, management of personnel, coordination of   publications, and arranging communication between investigators on specific projects.  4. To coordinate meetings and training activities. Key activities are (A) the annual TMRC  meeting in Varanasi, India, which is attended by participating TMRC scientists and  administrators from BHU and Muzaffarpur, and by collaborating investigators from other  universities in India, the USA, Australia and Belgium; (B) travel and housing for Indian  investigators to participate in scientific meetings, short courses, or short term training  experiences in labs at collaborating universities."
"9462895","?    DESCRIPTION (provided by applicant): The objective of this application is to support the career development of Linnea Polgreen, PhD. Her long-term goal is to become an independent investigator with a research program focused on developing methods for determining the best treatment options based on observational data. She has assembled a team of experienced mentors, including both clinical and quantitative researchers. These mentors not only bring diverse and complementary areas of expertise, but also, all of them have been successful mentors of students and young faculty. With this team of mentors, she will gain insight into what clinical questions she should attempt to answer using quantitative methods, and how to answer them.         Although randomized controlled trials (RCTs) are the gold standard for determining treatment effectiveness, RCTs are difficult to perform: they are expensive and slow. In the absence of findings from RCTs, observational data are often used to inform treatment decisions. There are a number of strategies available to analyze treatment outcomes using observational data, but exactly which strategy is likely to be most accurate is currently unclear. Her objective in this application is to develop a general framework using methods from economics, epidemiology and computer science and outcome-based observational data to determine treatment effectiveness for medical interventions in general. Specifically, she will use Medicare Part A, B and D data from a cohort of acute myocardial infarction (AMI) patients treated with angiotensin-converting enzyme (ACE) inhibitors or angiotensin II receptor blockers (ARB) to prevent subsequent AMIs, followed 1 year prior to, and up to 4 years post, the index AMI. For Aim 1, she will identify the approach that most accurately reflects ACE inhibitor/ARB outcomes as given by previous RCTs. For Aim 2, she will identify the approach that most accurately estimates treatment effectiveness for patients not generally eligible for RCTs.         Upon successful completion of these aims, she expects to have developed a framework for identifying the advantages and disadvantages of different methods for estimating treatment effectiveness using observational data for a broad range of cardiac and pulmonary diseases."
"9459843","There is a critical need for improved human tissue models to study infectious diseases. Animal models often  fail to reproduce human physiology, and are similarly poor predictors of drug efficacy when translated to  humans. This proposal describes the MIT Center for Human Tissue Models for Infectious Diseases  (MIT.HTMID), which will focus on two dimensional human neural cells and three dimensional human cerebral  organoids to study virus infections. The project is sited entirely at The Massachusetts Institute of Technology.  The three investigators are: Lee Gehrke (Virology and Infectious Diseases), Rudolf Jaenisch (Tissue  Engineering, Cell Biology, and Stem Cells) and David Sabatini (Genetics and Screening Technologies). The  Center will also include three Cores? that is, Administrative, Virology, and Human Cells and Tissues. The  themes of the two interrelated Research Projects of this U19 proposal are: ?Project 1: ?Human tissue models to  study infectious diseases: Human 2D and 3D neural cultures for studying virus tropism and infection  phenotypes, and ?Project 2: ?Use of 2D cultures and 3D organoids to identify candidate antiviral compounds? to  use genetic approaches to identify and validate host genes that promote or protect against flavivirus infection?.  The experimental use of organoids is significant because the three dimensional architecture and differentiation  from embryonic stem (ES) cells and induced pluripotent stem (iPS) cells provide near­physiological functions in  tissue organization, tissue renewal, and responses to pathogen infections. Indeed, human organoids have  been generated for a wide range of tissues and uses in studying development and diseases, including virus  infections. The project will compare the infections of five different neural or microglial cell types (neuronal  progenitors, neurons, oligodendrocytes, astrocytes, microglia) with three flaviviruses (Zika Virus, West Nile  Virus, or Dengue virus). The research goals of MIT.HTMID address the Zika virus global health crisis, toward  understanding how related flaviviruses can cause very different diseases, including microcephaly and Guillain  Barre Syndrome. The virus work will be extended beyond flaviviruses to include other neurotropic viruses? that  is, pseudotyped vesicular stomatitis viruses (VSV) that carry the envelopes of select agent encephalitic viruses  (Eastern Equine Encephalitis, Western Equine Encephalitis, and Venezuelan Equine Encephalitis).  We will  use cell and molecular methods to define and compare the infection phenotypes of the cells and viruses.  Tissue engineering and genetics will be combined by performing CRISPR­Cas9 screens to identify genes that  regulate or are regulated by virus infection, and then generating ?knockout? organoids to test function in a  three­dimensional tissue. The organoid human tissue model will also be used to evaluate a number of antiviral  compounds to validate its potential use as a drug testing platform. If successful, this Center will yield significant  new data and be an integral component of a network of Human Tissue Models for Infectious Diseases.    "
"9497756","Summary HDSS Core The Muzaffarpur HDSS is the only demographic surveillance site in the INDEPTH network that is located in an area endemic for VL was established in established in 2012 during the current NIH grant (1st August 2012 to 31st July 2017). Now it covers an area of 145sq km with 50 clusters ( geographically contiguous area) of Kanti block &16 villages from other blocks of district Muzaffarpur, Bihar. Last census was conducted in 2015. A total 111,999 from 16301 households were screened and information on current family size, new births and deaths, in/out migration, new cases of Kala-azar . All new 53 Kala-azar cases occurred since last survey (6th in 2013) was confirmed by document verification and rk39 test. It provides an excellent platform for conducting sentinel surveillance of the incidence of VL and PKDL at population level in the heartland of the VL epidemic in Bihar. We will investigate whether the declining trend in numbers of reported VL cases in Bihar State is also reflected in decreasing sero prevalence rates. All field based studies in all TMRC projects will be conducted through same plat form. The HDSS also offers the possibility of studying interaction of VL with other prevalent neglected topical diseases and effect of social and environmental factors known to be associated with VL. PKDL in itself is probably of low priority for the HDSS population but if screening for PKDL is combined with screening for other skin disorders followed by treatment of common treatable conditions, this would probably be very much welcomed. To further explore the apparent discrepancy between tuberculosis case notification figures for India and those for Bihar, the population based approach will allow us to identify all tuberculosis cases, also those treated by private practitioners and possibly not notified. In next TMRC it is decided that all information from the field ( including verbal autopsies) will be collected on tablets."
"9474609","DESCRIPTION (provided by applicant): This proposal is for The OSU College of Optometry Clinic Site to conduct the Soft Bifocal Contact Lens Myopia Control Study, a randomized clinical trial designed to address whether and by what mechanism commercially available soft bifocal contact lenses may slow eye growth in myopic children. Experimental animal data and numerous but scientifically limited human clinical evaluations suggest that contact lenses that alter peripheral defocus may slow the progression of myopia. The first aim is to conduct a rigorous prospective randomized clinical trial 'to determine if bifocal contact lenses that supply peripheral retinal myopic defocus slow myopia progression in children in a dose-dependent manner as a function of add power. The second aim is to evaluate whether peripheral myopia is a visual signal for eye growth by determining whether the rate of progression follows a dose-dependent response to peripheral myopic retinal defocus. The final aim is to determine the structural correlates of any slowing of myopia progression: is any slowing of eye growth local and peripheral, foveal, global, or confined to one more ocular quadrants. Analyses related to the second and third aims will determine how soft bifocal contact lenses affect growth of the eye and, ultimately, to optimization of the visual signals that slow myopia progression in children. In this trial, 294 children aged 7 to 11 years with myopia will be randomly assigned to wear soft bifocal contact lenses (Biofinity Multifocal with +1.50 add or +2.50 add; Cooper Vision, Fairfield, NY) or single vision contact lenses (Biofinity; Cooper Vision, Fairfield, NY). The primary outcome measure is change in cycloplegic spherical equivalent auto refraction over three years. Secondary outcomes are central and peripheral eye length. Covariates include the amount of peripheral defocus at distance and near while wearing a contact lens, distance peripheral refractive error without a contact lens, high and low contrast visual acuity at distance, high contrast near visual acuity, accommodative lag, pupil size, family refractive error history, a myopia risk factor survey, vision-specific quality of life, and contact lens wear compliance."
"9472876","This Project focuses on the mechanisms by which beta amyloid (Aß) accumulation and inflammation  (specifically interieukin 1 beta; IL-1ß) impair plasticity and neuronal health. We propose that these molecules  interfere with endosomal trafficking of brain-derived neurotrophic factor (BDNF) and its receptor TrkB,  leading to impaired neuronal health, function and synaptic plasticity. Our data reveal that IL-1 ß and Aß both  interfere with retrograde axonal flow of BDNF-TrkB and impair events downstream from BDNF-TrkB  signaling, including nuclear gene transcription. In addition, we found that IL-1ß impairs the stabilization of  BDNF-dependent long-term potentiation (LTP) by preventing actin polymerization in spines. These data  indicate that Aß and IL-iß deteriorate synapses by targeting both pre and post-synaptic components,  impairing signal transduction and synaptic plasticity and placing neurons at risk for degeneration. We  propose that impairment of endosomal trafficking is a common mechanism by which Aß and IL-1ß impair  retrograde signaling and spine plasticity. Supporting the hypothesis that dysfunctional endosomal trafficking  is an important contributor to AD pathogenesis, several recently identified genetic risk factors for AD impact  function of endocytotic pathways (e.g., PICALM, BINI, CD2AP). In this proposal, we will evaluate how Aß  and IL-1ß impair endosomal trafficking, focusing on BDNF-TrkB trafficking, and investigate how signaling  events downstream of BDNF-TrkB are impacted. Specifically, in Aim 1, we will evaluate mechanisms by  which Aß and IL-1ß interfere with endosomal trafficking and axonal retrograde transport of BDNF-TrkB.In  Aim 2, we will determine if IL-1ß impairs postsynaptic activity-dependent BDNF-TrkB trafficking and plasticity  in dendritic spines. We also will eviaute how PICALM can modulate BDNF TrkB trafficking.. Aim 3 will  translate the in-vitro data to an in-vivo paradigm, to investigate if IL-1ß impairs hippocampal-dependent  learning and if select intervention strategies can protect against the detrimental effects of IL-1ß on  endosomal trafficking, and learning. Our project incorporates data sharing and multiple collaborations with  the team: e.g., Glabe (effects of Aß oligomeric species on BDNF-TrkB trafficking), LaFeria (IL-1ß, Aß and  endocytic dysfunction). Tenner (Clq protection from IL-1ß evoked impairments of BDNF-TrkB F signaling),  and Cribbs (impairment of endosomal function by IL-1ß and Aß in endothelial cells)."
"9460987","Summary The older population will more than double from 35 million in 2000 to 72 million in 2030 and comprise almost 20% of the U.S. population. To help avert the disability challenges these individuals will face, the University of Florida (UF) Older Americans Independence Center (OAIC) Research Education Core (REC) promotes the development of independent investigators in interdisciplinary research on aging related to older Americans' mobility. This core emphasizes the competency-based development of research and leadership skills for translating basic findings into clinical research and clinical findings into basic research. Key to this approach is our partnerships with UF's NIH-funded Clinical and Translational Science Institute (CTSI) and the Veterans Affairs (VA) Geriatric Research Education and Clinical Center (GRECC). Core resources are integrated with other internal and external sources for career support, including UF support; NIH and non-NIH career- development awards, minority supplements, research awards, and fellowships; and CTSI and VA support. The REC supports the research training of Junior Scholars who span the spectrum from beginning trainees not yet funded to advanced trainees who have competed successfully for career-development awards or grants that provide substantial salary support. Beginning Junior Scholars receive direct salary support from the REC to protect their time for career development and research. Advanced Junior Scholars may already have sufficient salary support but are eligible for REC mentorship, staff, Core support and travel resources, and REC training activities. In our first year, we propose eight Junior Scholars from four different UF Colleges (Nursing, Liberal Arts and Sciences, Public Health and Health Professions, and Medicine). Three Junior Scholars have clinical degrees and responsibilities; one is of Hispanic ethnicity; four are women and several have co-funding from key partners, their home departments, and/or extramural career development funding. The REC's overarching goal is to recruit, select, and train talented Junior Scholars committed to translational science and to integrating clinical insights of health/disease and independence/disability in older adults. Using their knowledge of advances in the basic sciences, these Junior Scholars will strive to improve clinical interventions that help the elderly avert mobility loss and maintain independence. We emphasize an interdisciplinary career-development plan that generates combined knowledge from a diverse cadre of scientists (basic, translational, social, behavioral, epidemiological, and clinical). Tailored career-development plans for each proposed REC-supported Junior Scholar, include, but are not limited to: a) a research project integrated with this OAIC's premise; b) a formal training strategy that stresses the integration of basic and clinical research and interactions across the OAIC research spectrum and the other OAIC Core facilities; c) a formal mentorship program that uses a team approach to foster basic and clinical science approaches; and d) a monitoring process to evaluate trainees' progress formally using specific milestones and achievements."
"9460380","HCCC Director, George Weiner, MD works with HCCC leadership to set the overarching vision for the HCCC. Planning and evaluation efforts of the HCCC include annual meetings of the External Advisory Board that has been expanded since the last review, quarterly meetings of the HCCC Executive Board that serves as an internal advisory committee, and meetings with internal constituencies. Over the past funding period, the HCCC has developed and pursued a new strategic direction with the support of the institution. The HCCC is continuing to implement the concepts resulting from these strategic planning efforts, while engaging in ongoing planning and evaluation efforts to identify future opportunities with a particular focus on the needs within our catchment area. This ongoing planning takes place in multiple forums including the annual HCCC research retreat."
"9490321","Our understanding of the pathogenesis of diabetes, obesity and other metabolic disorders has benefited greatly from the use of dietary interventions and gene targeting methodology in mice to elucidate molecular mechanisms. However, such efforts are often hampered by a lack of facilities or expertise for metabolic phenotyping. The Mouse Phenotyping, Physiology and Metabolism Core provides investigators of the Penn Diabetes and Endocrinology Research Center (DRC) with access to state-of-the-art, timely and cost-effective resources for performing metabolic studies in mice. The core offers consultation and assistance with experimental design, and an expanding list of services including Comprehensive Laboratory Animal Monitoring System (CLAMS) that can simultaneously record energy expenditure, locomotor activity, eating and drinking, glucose and insulin clamp studies (including radioactive tracers for determining hepatic glucose output and uptake into other tissues), measurement of body composition using dual emission x-ray absorptiometry (DEXA) and nuclear magnetic resonance spectroscopy, thermal imaging, exercise capacity, and a variety of standard metabolic assays. In addition to the many existing services that have been critical to the productivity of DRC investigators, we are excited to be providing new services aimed at phenotyping in variably controlled conditions of ambient temperature and light, as well as facilitating metabolic flux studies through the development of ?cold clamp? techniques for delivery of isotope-labeled metabolites while controlling glucose and insulin levels. Studies in the core are performed by two research specialists and a technical director under the leadership of Dr. Joseph Baur and coordinated with other core laboratories including the Biomarkers and Metabolomics cores. These efforts allow DRC investigators to rapidly translate ideas from the bench to mice as the first critical steps toward new therapeutic approaches for the multitude of patients suffering form diabetes and related disorders."
"9605914","Summary A central challenge in neuroscience is to develop methods to manipulate specific cell types within the mammalian brain. Recent developments in optogenetics have revolutionized our ability to control the activity of both neurons and non-neuronal cells. However, this approach suffers from one drawback, the difficulty in delivery light stimulus to target cells that are located deep within the brain or the body. The Chalasani lab has recently demonstrated a noninvasive method to control the activity of neurons. They have identified a pore- forming subunit of a mechanosensitive channel (TRP-4) that responds to low-intensity ultrasound. Further, they showed that expressing this channel is specific cells renders those target cells sensitive to mechanical deformations generated by noninvasive ultrasound waves. This proposal aims to develop this approach (they have termed ?sonogenetics?) to control specific cells within the mouse brain. Further, they find that this approach can be used to control the activity of mammalian neurons in vitro. They plan on using a high- throughput assay system to test whether other members of the TRP-N family are sensitive to ultrasound pulses. Additionally, they will also analyze whether altering the number of ankyrin repeats affects the ultrasound responsiveness of these channels (consistent with a recent study showing similar results in the Drosophila TRP-N channel) (Aim 1). They also plan on developing a new head device with a slot for a tiny, lightweight ultrasound transducer to deliver ultrasound stimulus to the mouse brain (Aim 2). Finally, they will test the efficacy of the sonogenetic approach in vivo using electrophysiological and behavioral analysis. They will express TRP-4 or other mechanosensitive channels in cortical PV interneurons, striatal D1 or D2 medium spiny projection neurons and control their activity in vivo. Optogenetic methods have been previously used to control these cell populations providing benchmarks for comparison. These studies will develop a noninvasive method to manipulate the activity of specific cells within the rodent brain or its body. Further, these methods can be translated into the human to target specific cell populations for therapeutic purposes."
