"APPLICATION_ID","ABSTRACT_TEXT"
"9472721","PROJECT SUMMARY Hearing loss is one of the most prevalent sensory deficits that affect one in five individuals in the United States. While the underlying etiology can vary widely, viral infections are speculated to be associated with hearing loss with a sudden onset. Lassa fever (LF), caused by Lassa virus (LASV), is a major public health threat in West Africa and is characterized by acute hemorrhagic disease and/or neurological sequelae, and up to 500,000 cases are reported annually. Approximately 30% of LF survivors develop sudden onset hearing loss weeks or months after leaving the hospital, placing a huge burden on the public health system and impacting patients' quality of life. This phenomenon is quite unique because it typically develops at later stages of the disease process, thus making LF the only viral infection described in medical literature that induces hearing loss mostly in the convalescence phase. Until now, the lack of a robust animal model exhibiting sudden onset hearing loss induced by LASV prevented the mechanistic study of this clinical feature. To address this need, we developed a novel murine model for LF that mimics many symptoms of human LF. Most importantly, our model consistently reproduced the hearing loss in animals that were recovering from infection. This powerful tool will allow us, for the first time, to study the pathogenesis of hearing loss associated with LF, in a maximum containment BSL-4 setting. The long-term goal of our research is to identify the immunological and pathological mechanisms responsible for LASV-induced hearing loss in human patients to enable future treatment. The objective of this application is to use our physiologically relevant LF mouse model to study the mechanism of LF associated hearing loss, as well as to assess auditory damage of LF survivors in West Africa. Therefore, we propose the following Specific Aims: 1. Determine the mechanism of hearing loss in LASV-infected Stat1-/- mice. We will investigate the underlying mechanism by focusing on the inner ear, as well as determining the involvement of the central nervous system in hearing loss, by studying the auditory behavior of infected mice in order to define the localization of the injury and assess histopathological changes in the inner ear. 2. Identify the role of T cells in the development of hearing loss by performing loss/gain of function experiments. We will utilize T cell depletion and adoptive transfer techniques to determine the contribution of T cells to hearing loss in infected Stat1-/- mice. We will also identify the viral antigen most essential for T cell recruitment to the auditory nerve. 3. Determine the degree of hearing loss and location of functional damage in human patients exhibiting SHL after surviving LASV infection. We propose to investigate the underlying the hearing loss in documented LF survivors in Nigeria by using noninvasive diagnostic tests routinely performed during newborn hearing screening in the USA."
"9559818","ABSTRACT Reducing HIV incidence requires a ?precision public health? approach encompassing prevention campaigns, targeted interventions, and ?next-generation? surveillance through multimodal instruments, including sequencing. Molecular epidemiology methods (phylogenetics and phylodynamics) have recently gained traction for use in identifying and tracking epidemic transmission clusters, as well as reconstructing the demographic history of viral pathogen populations. However, such methods are not equipped to identify both transmission clusters and their corresponding dynamics in real time, and transmission clusters are assumed to be unrealistically static over the course of the epidemic. Consequently, scientists, and/or clinicians, cannot distinguish between growth or decline of a sub-epidemic nor determine the sources ?local or external? driving regional epidemic incidence. The overarching goal of this project is to develop a novel theoretical and technical framework able to model dynamically HIV transmission clusters over time by analyzing large, longitudinal sequence data. Our new tool for dynamic identification of transmission epicenters (HIV-DYNAMITE) will aid in monitoring, in real time, hyper-connected and/or long-lasting clusters fueling emerging HIV regional epidemics. As an application study, we will focus on the ongoing HIV epidemic in Florida. Florida has the highest incidence of HIV in the United States (US) due to a unique set of circumstances fostering an ongoing statewide epidemic. HIV infections are rising amongst men who have sex with men, minority, and immigrant/tourist populations. Risk assessment of the epidemic thus needs to be contextualized, taking into account both local determinants as well as inflow from other states and/or countries. In collaboration with the Florida Department of Health (FDOH), we seek to identify and predict infection trends as well as virus spread within Florida and among neighboring destinations by applying HIV-DYNAMITE to the extensive FDOH viral sequence dataset (>44,300 sequences) collected over the past 10 years coupled with geo-demographic information. We will validate the system using newly obtained longitudinal data and design intervention strategies through focus groups with the FDOH and other stakeholders. We aim to both complement and enhance existing efforts, such as the CDC?s HIV-TRACE, which is currently based on sequence data only, which also lacks dynamic or geographic spread components. The interdisciplinary expertise of the team renders this project feasible, and the proposed approach has the potential to be incorporated into other settings within the US with comparable statewide surveillance and virus sequencing coverage through national reference centers."
"9473239","OVERALL ABSTRACT  Mast cells and eosinophils are essential effector cells in both acute and chronic allergic inflammatory responses. The overall goal of this Program is to exploit eosinophil and mast cell Siglecs (sialic acid binding, immunoglobulin-like lectins) to prevent or treat immediate allergic reactions and chronic allergic inflammation. The overarching hypothesis is that specific mAbs, endogenous tissue glycans, or synthetic ligand analogs, can specifically and selectively engage complementary glycan binding Siglecs (CD33, Siglec-6, and Siglec-8) on eosinophils and/or mast cells to prevent or limit IgE-dependent and IgE-independent eosinophil and mast cell- related allergic responses.  This application focuses on the role of three mast cell and eosinophil Siglecs that we hypothesize provide ideal targets for dampening allergic effector cell responses in a variety of acute and chronic allergy-related disorders. Dr. Bruce Bochner will serve as the PI of Project 1 (Defining Siglec-6 and Siglec-8 function on effector cells of allergic diseases as well as Core A (Administration) and Core B (Human mast cell and tissue acquisition core). Dr. James Paulson will serve as the PI of Project 2 (Siglec-targeted nanoparticles for treating mast cell mediated allergic disease) while Dr. Ronald Schnaar will serve as the PI of Project 3 (Human siglec ligands control mast cell and eosinophil mediated inflammation). This is a Program team with a proven track record of productivity and synergy.  This application includes projects that examine Siglec/eosinophil/mast cell pathways from various perspectives including pharmacology, biochemistry, cell signaling, glycobiology, and cellular and molecular biology, using in vitro experimentation and in vivo humanized models. The majority of the proposed research utilizes human material including primary human cells and biologic samples, along with animal models involving humanized mast cell mice and novel knock-in strains of mice expressing human Siglecs of interest to provide more in-depth hypothesis testing on mechanisms and outcomes that cannot yet be assessed with human research. Each Project provides numerous elements of novelty ranging from human Siglec knock-in mice to development of unique reagents for targeting specific Siglecs to discovery of endogenous human tissue ligands for specific Siglecs."
"9416109","?    DESCRIPTION (provided by applicant): Over 25% of the US population >65 years of age have type 2 diabetes and 80% of these individuals are overweight or obese. These individuals face shortened lifespans, increased health care needs, greater medical complications, and lower quality of life relative to those of similar age without these conditions. Lifestyle interventions focused on weight loss are recommended for overweight and obese individuals with type 2 diabetes, but whether these interventions meaningfully improve the lives of older individuals with diabetes over extended follow-up is unknown. Look AHEAD is a randomized trial comparing the effects of intensive lifestyle intervention (ILI) focused on weight loss achieved through healthy eating and increased physical activity versus a control group given Diabetes Support and Education (DSE) in overweight and obese individuals with type 2 diabetes. Although ILI did not produce beneficial effects on the primary and secondary outcomes related to cardiovascular disease, it did produce beneficial effects on a broad spectrum of health parameters during the period of the intervention. The LA Extension (LA-E) will examine whether ILI, provided for 10 years during mid- life, has enduring benefits that persist beyond the period of the intervention for older individuals with diabetes. We propose to follow approximately 3,800 participants (current ages 58-89 years) for 4.5 additional years with biennial clinic visits and 6-month outcomes phone calls. The primary aims of LA-E are to test whether ILI relative to DSE has long term legacy effects on 1) increased lifespan and 2) reduced health care costs. Secondary aims test whether ILI relative to DSE has long-term effects on key dimensions of healthy aging: less frailty, reduced diabetic microvascular complications, and improved quality of life. LA-E will also compare long- term trajectories of weight, physical activity, fat and lean mass, and bone density and examine how these are related to outcomes. LA-E focuses on the clinical outcomes that are most relevant to healthy aging and resilience and will provide the long-term data needed to frame guidelines related to lifestyle intervention in the care of older overweight or obese individuals with type 2 diabetes."
"9607817","Invasive fungal infections are an important cause of morbidity and mortality for people with compromised immunity. Unfortunately, the mortality associated with invasive fungal infections remains unacceptably high. One of the contributing factors to this poor outcome is the fact that there are relatively few therapeutic options for the treatment of invasive fungal infections, particularly when compared to the number of antibiotics available for the treatment of bacterial infections. To identify new antifungal drug candidates, we have initiated a high throughput screening and chemical biology-based project to identify molecules that interfere with fungal cell wall biosynthesis. Application of this strategy has rapidly led to the identification of human phosphoinositide dependent kinase-1 (PDK1) inhibitors as highly active antifungal molecules in vitro. PDK1 inhibitors have been extensively developed as targeted anticancer molecules because of their low toxicity toward normal cells. Encouragingly, two of the PDK1 inhibitors identified in our preliminary work (UCN-01 and OSU-03012) have been, or are being, evaluated in human clinical trials. In order to develop the promising potential of PDK1/Pkh inhibitors as antifungal drugs, we will: characterize the molecular basis for the activity of mammalian PDK1 inhibitors toward fungal PDK1 orthologs (Aim 1); characterize the function of PDK1 orthologs in the human fungal pathogens Candida albicans and Cryptococcus neoformans (Aim 2); determine in vivo efficacy of PDK1 inhibitors in animal models (Aim 3); and optimize antifungal properties of PDK1 inhibitors and identify antifungal PDK1 inhibitors with novel chemical scaffolds (Aim 4). Successful execution of these aims is expected to not only provide a fundamental chemical and biological foundation for the development of antifungal PDK1 molecules but could also lead to the rapid translation of PDK1 inhibitors to clinical use since two of our lead compounds have already been evaluated in human clinical trials."
"9415030","DESCRIPTION (provided by applicant): SATB2 is a homobox transcription factor first discovered in 2003 that binds to AT rich sequences and likely binds chromatin modifying enzymes such as histone acetyltranferases and deacetylases for the regulation of gene expression. A number of recent papers have described SATB2 overexpression in a variety of cancers and have emphasized the importance of this overexpressed gene in driving tumorigenesis. We have studied the malignant transformation of normal human bronchial epithelial cells (BEAS2B) by carcinogenic metals such as nickel (Ni), hexavalent chromium (Cr+6), arsenic (As) and vanadate (V). While each of these metals has its own unique signature of gene expression when they transform BEAS2B cells, the signature is vastly different from metal to metal. However, SATB2 is increased in every transformed clone by any one of these metals. SATB2 is not expressed in parental BEAS2B cells. Further studies have shown that SATB2 mRNA and protein are induced in BEAS2B cells by chronic Ni ion treatment. We hypothesize that SATB2 is a transcription factor needed for normal mammalian development but its inappropriate expression during chronic Ni exposure is a driver of cell transformation. We want to investigate the mechanisms and consequences of its overexpression in BEAS2B and 16HB cells exposed to and transformed by Ni. We will overexpress SATB2 in normal BEAS-2B and 16HBE cells and investigate the effect this has on the cell's transformed properties and study the expression of other genes in these cells using gene chips. SATB2 overexpression and resulting cell transformation will also be studied in the presence of nickel exposure. We will lower the levels of SATB2 by transient knockdown with siRNA and stable knockdown with small hairpin RNA in nickel transformed BEAS2B and 16HBE cells and study the consequences of SATB2 loss on their transformed properties and investigate the effect this knockdown has on the expression of other genes using gene chips in the nickel transformed cells. We will study the mechanism of SATB2 overexpression focusing on its promoter, enhancer, upstream regulators and miRNA that target SATB2 following chronic nickel treatment of BEAS2B and 16HBE cells and in nickel transformed cells. In addition, SATB2 overexpressed in BEAS2B and 16HBE cells and in Ni-transformed cells will be immunoprecipitated, and interacting protein partners will be identified by gel electrophoresis and mass spectrometry. To address whether nickel is able to induce SATB2 expression in vivo, we will expose A/J mice to various doses of nickel by inhalation or ingestion, and analyze SATB2 expression in several target tissues. To explore the role of SATB2 in nickel-induced tumorigenesis, we will analyze the levels of SATB2 expression in rat lung tumors induced by nickel subsulfide exposure (obtained from National Toxicology Program archive)."
"9615124","RELEVANCE (See instructions):"
"9536240","Project Summary:  Neurofibromatosis Type II (NF2) is an autosomal dominant cancer predisposition syndrome resulting from loss of function mutations in the Nf2 gene locus, which codes for the protein, Merlin (Moesin-Ezrin- Radixin-Like Protein). Patients with NF2 suffer almost invariably from bilateral vestibular schwannomas (VS) and have a high propensity for sensorineural hearing loss, vestibular dysfunction, and the development of meningiomas and ependymomas. Surgical resection is currently frontline therapy for the treatment of VS and the necessity for surgical margins can further compromise auditory, vestibular, and facial nerve function.  Merlin has an actin binding domain and localizes to the cortical membrane in the cell where it is believed to function as a negative regulator of cell growth during contact inhibition. In order to develop a better understanding of how loss of Merlin contributes to schwannoma genesis, the lab generated a murine model of NF2 in which Nf2flox/flox mice have been crossed with mice which express Cre recombinase driven by a 3.9kb fragment of the periostin (Postn) promoter. These Nf2f/f;Postn-Cre mice develop a clinical pathology similar to human NF2 patients with fully penetrant peripheral, vestibular, and dermal schwannomas along with sensorineural hearing loss.  We hypothesize that loss of Merlin drives oncogenic transformation of Schwann cells through up- regulation of the NF-?B pathway. In Aim 1, we will develop new tools to elucidate NF-kB signaling in our NF2 mouse model. By modulating the signaling of a specific NF-?B protein, we will attempt to prevent pathogenic schwannoma formation in our Merlin conditionally deficient animals and assess how tumor growth alters the sensorineural hearing loss. In Aim 2, we seek to modulate a therapeutically targetable protein as a way of ameliorating a particular disease process we have observed in the inner ear of our mice and that we hypothesize is primary driver of hearing loss in our mice. The studies in Aim 1 and 2 are designed to challenge the prevailing opinion about the pathophysiology driving sensorineural hearing loss in NF2. This proposal will lead to a better understanding of Merlin signaling and provide a data driven approach to how to think about and treat sensorineural hearing loss in NF2."
"9419766","Insulin resistance is an important risk factor for alcoholic liver disease (ALD). Vice versa, heavy alcohol  consumption induces insulin resistance that is associated with progression of hepatic fibrosis in  non-alcoholic fatty liver disease (NAFLD). Insulin is the key hormone that regulates lipid and glucose  metabolism; it is also an important regulator of inflammation. Thus, hepatic insulin action is likely a key  player in the pathogenesis of ALD, yet the mechanisms through which impaired insulin action predisposes  to ALD remain poorly understood. We and others have previously demonstrated that insulin signaling within  the mediobasal hypothalamus (MBH) controls hepatic glucose production (hGP), very low density  lipoprotein (VLDL) secretion, white adipose tissue (WAT) lipolysis and innate immunity through the  autonomic nervous system. Based on our pilot data that demonstrate that in a rat model for binge drinking,  i.e. short term alcohol consumption impairs glucose tolerance and induces insulin resistance that is due to  impaired hepatic insulin action. Binge drinking markedly impairs hypothalamic insulin action, defined as the  ability of hypothalamic insulin to suppress hGP and adipose tissue lipolysis. Thus, the major hypothesis  proposed in this proposal is that some of the metabolic and innate immunity defects induced by alcohol are  caused through brain effects disrupting autonomic control of both metabolism and innate immunity. In  support ofthis novel paradigm we find that a central cause ofthe impaired hypothalamic insulin action is  decreased insulin signaling in the hypothalamus likely due to increased inflammation, ER stress and   expression of protein tyrosine phosphatase l b (PTPIb), a negative regulator of insulin signaling. Here we  propose to delineate the mechanisms through which chronic alcohol consumption impairs insulin action,  disrupts hepatic carbohydrate, amino acid and lipid metabolism and generates a pro-inflammatory  environment within the liver that predisposes to ALD."
"9537762","Summary  Endothelial cells play a critical role in multiple aspects of lung development and homeostasis, yet the precise mechanisms that regulate vasculogenesis and how endothelial cells signal to other cell types to orchestrate lung development have not been well defined. Accurate regulation of these processes is critical to ensure proper lung development and prevent bronchopulmonary dysplasia (BPD), a lung disease of premature infants that often results in life-long complications. Hallmarks of BPD are impaired vasculature and arrested lung development. We created three-dimensional (3D) co-culture systems in which lung endothelial cells (LuMECs) drive the putative lung stem cells, BASCs, to produce bronchiolar or alveolar organoids. These organoid cultures provide an opportunity to model interactions that occur between endothelial cells and alveolar cells during lung development. Using this system, we discovered a novel BMP4-NFATc1- Thrombospondin (TSP1) pathway in endothelial and epithelial cells in the adult lung. We showed that TSP1, known as an anti-angiogenic factor, is required for the development of alveolar organoids. We also identified R-spondin2 (Rspo2), which regulates Wnt signaling in other systems, as a BMP4-regulated protein that may be downstream of TSP1 in endothelial cells. The mechanisms underlying TSP1 regulation of lung vascular development and alveolarization are unknown. We hypothesize that endothelial-derived TSP1 induced by BMP4-NFATc1 signaling inhibits pulmonary vascular development and is required for proper lung development. Further, we posit that vascular lung injury, such as that seen with hyperoxia exposure, impairs TSP1 signaling, thereby altering vasculogensis and blocking alveolar development. In Aim 1, we will determine how TSP1- CD47 interactions regulate vasculogenesis and lung development. Defective lung endothelial cells from mice exposed to hyperoxia will be used in lung organoid co-cultures to test the impact of impaired endothelial cell signals on alveolarization. Similarly, cells from knockout mice will be used in neonatal lung organoid cultures to determine the effect of CD47 deficiency on alveolar development. CD47-knockout mice and endothelial- specific TSP1-knockout mice will be used to test the role of TSP1-CD47 interactions in the response to neonatal hyperoxia-mediated lung vascular injury in vivo. In Aim 2, we will define the mechanisms by which TSP1-dependent Rspo2 mediates pulmonary vascular development by evaluating ligand response in vitro and after neonatal hyperoxic injury in vivo. Recombinant Rspo2 will be used in neonatal lung organoid cultures and in assays for endothelial cell proliferation, migration and tube formation. We will determine if lung endothelial cell secreted factors, and more specifically, Rspo2, is sufficient for prevention of neonatal hyperoxia-mediated lung injury. These studies will elucidate mechanisms by which lung endothelial cells drive critical outcomes in development. This work will determine if defective TSP1-dependent signaling is a mechanism of interrupted lung development in premature infants with BPD, leading to new ways to direct therapy for BPD."
"9628062","DESCRIPTION (provided by applicant): The spirochete Treponema denticola (Td) is strongly associated with severe and refractory periodontal conditions. As a member of the 'red-complex' bacteria, Td primarily lives on the apical surface of subgingival plaque in direct contact with the epithelium. Thus Td is at the forefront that directly encounters enormous host immune attacks, e.g., complement killing and phagocytosis. In the pocket, polymorphoneclear leukocytes (PMNs) are the major immune cells that protect the host by killing pathogens via phagocytosis. In addition, the gingival crevice fluid (GCF), which is mainly composed of serum, contains the complement system, a critical component in host defense. Previous reports suggest that Td is resistant to the complement killing, and is able to modulate PMNs and can thrive in the oral flora. However, the molecular mechanisms involved remain elusive. The central hypothesis of this application is that TDE0362 (Tmac), a new virulence factor of Td, has dual functions: its C-terminus (C362) is a protease that cleaves immune factors that are essential for the activation of PMNs and the complement killing; its N-terminus (N362) contains a bacterial immunoglobulin (Big)-like domain which blocks PMN activation via a molecular mimicry mechanism. Collectively, Tmac protects Td from the phagocytosis and the complement killing, and consequently enhances its survival and establishment of infection. To test this hypothesis, this application wil focus on the following Specific Aims: (1) To determine if Tmac is cleaved and secreted, and the mechanism involved in the cleavage; (2) To study the endopeptidase activity of Tmac on human IgG; (3) To elucidate the role of Tmac in PMN activation and its mechanism involved; and (4) To investigate the role of Tmac in the pathogenicity of Td in vitro and in vivo. Completion of this project will advance our current understanding of the pathogenicity of Td, in particular, the mechanisms involved in the innate immune evasion, which could potentially lead to new therapeutic interventions against periodontal diseases."
