"APPLICATION_ID","ABSTRACT_TEXT"
"9654985","Project Summary/Abstract Treating the immune response within tumors is a major focus of new therapeutic development. Much of the focus has been place on T cells, in particular via checkpoint therapies such as anti-CTLA4 or anti-PD1. Little is currently known of how individual populations of myeloid cells can be partners for T cells. We have recently isolated rare populations of myeloid cells that appear critical for robust responses but we don't yet fully understand how they work. We hypothesize that rare stimulatory dendritic cells traffic antigens and stimulate T cell according to specialized rules and that harnessing and modulation of this pathway is part of the reason that checkpoint blockades may work. We further hypothesize that specific tissue-based cells are responsible for upregulating the critical cytokine to make stimulatory dendritic cells but that tissue production is dysregulated in cancer and possibly improved with checkpoint therapies. In this proposal we will be vastly extending an approach that my lab has been pursuing over the last few years. Specifically we will be extending our cell-biology based studies of these critical cells (Aim1) to understand how they play a fundamental role in antigen trafficking. Additionally, we will seek to understand how they hand off antigen to other antigen-presenting cells in the lymph node to engage T cells (Aim2) and how both of these processes are affected by checkpoint blockades. Finally, in aim 3, we will seek to understand the normal and intratumoral production of the cytokine Flt3L, a key player in regulating the number of these rare cells. At the end of this work, we will understand how these intratumoral myeloid cells function on their own and in concert with T cell therapies."
"9456738","?    DESCRIPTION (provided by applicant): The candidate's career goals are to become an independent researcher in the field of biomedical imaging, to make significant contributions to the basic knowledge of brain structure and function, and to develop novel tools that will be useful to address important issues in translational neuroscience. The candidate has received training in Physics; her research has focused on fMRI at low and high magnetic fields, on the development of research tools for the fMRI community, and on the investigation of brain function in health.  The K01 award proposal was designed to allow the candidate to become an expert bio-imager of the ascending arousal system (AAS). The candidate's objective for this K01 award period is to receive training in the neuroanatomy, neuroscience and patho-physiology of the AAS, an area different from her previous training and research focus. To conduct the proposed research, she will also gain new research skills in imaging and computational methods for neuro-anatomy. Further, the candidate seeks to strengthen her ability of formulating clinically relevant hypotheses, of using a diversified set of skills and tools to test these hypotheses properly and promptly, and of grant writing. This will be achieved by regular meetings with her mentors, her research and clinical collaborators, by attending to specific didactic courses / workshops / conferences, and by hands-on training during the development of the proposed research project.  Gray matter brainstem nuclei (Bn) of the AAS play a crucial role in regulating arousal, a key component of human consciousness. Because an in vivo identification of brainstem Bn of the AAS has been elusive so far by current imaging techniques, the neuro-anatomic and functional basis of arousal in health (sleep/wake conditions, anesthesia) and in disease (disorders of consciousness, sleep disorders) is poorly understood. The candidate's main research objective for this K01 award period is to develop and validate a novel procedure to delineate an in vivo probabilistic structural atlas of 13 human Bn of the AAS in MNI space. The procedure will use a newly developed set of methods to acquire multi-contrast echo-planar-images with exactly matched geometric distortion and resolution at 7 T, and semi-automatic segmentation procedures. Finally, this research project proposes to apply the developed tool to identify in vivo which Bn of the AAS are affected by hemorrhages in traumatic coma, and to evaluate the AAS connectivity in health and traumatic coma. Our preliminary results show the feasibility of generating a probabilistic template of four Bn of the AAS by 7 T multi- contrast imaging, of evaluating at 3 T the percent of injured tissue of these Bn in traumatic coma, and of mapping their functional connectivity in health. We share our enthusiasm with our collaborators that study the AAS in coma, sleep and anesthesia because the development of an in vivo atlas of Bn of the AAS might greatly advance the knowledge of the mechanism of arousal, improve the accuracy of prognostication in the early stage of coma, and facilitate the development of pharmaceuticals for altered states of arousal."
"9461613","In tasks requiring attention and working memory, prefrontal and parietal cortex exhibit functional connectivity  in the form of oscillatory phase-locking. Project 4 will test the general hypothesis that phase-locking depends  on direct connections between the two areas originating from neurons in layer 3. By monitoring electrical  activity simultaneously at fine intervals from the cortical surface to the white matter, while monkeys engage  in working memory (Aim 1) and attenfion (Aim 2), the experiments will test the speciflc predicfion that signs  of funcfional connectivity are maximal in layer 3. By monitoring the electrical activity of identified projection  neurons and by examining the impact of blocking projections between the two areas, the experiments will  test the specific prediction that direct projections are critical for functional connectivity (Aim 3). Results  obtained in Project 4 will have direct relevance to the Central Hypothesis regarding the origin of cognitive  deflcits in schizophrenia. This hypothesis states that cognifive deficits arise because pathological changes in  layer 3 pyramidal cells interfere with functional connectivity between prefrontal and parietal cortex. Projects  1-3 will focus on the properties of layer 3 pyramidal cells in the healthy brain and in schizophrenia. Project 5  will focus on funcfional connectivity in the healthy brain and in schizophrenia as measured with coherence  and causality analyses. The unique contribufion of Project 4 will be to link these domains of inquiry by  establishing the role of layer 3 neurons in functional connectivity as assessed with coherence and causality  analyses.  RELEVANCE (See instructions):  This project will establish the role of layer 3 neurons in the cognitive deflcits in schizophrenia."
"9674924","Project summary The NCMI is dedicated to the advancement of cryo-electron microscopy and tomography methodology for structure determination of macromolecules, molecular machines and cells in their various functional states at the highest possible resolutions. Having completed 10 C-alpha backbone traceable cryo-EM structures of molecular machines during the current grant period, we are well poised to tackle the next set of challenging structural biology problems. Our technology research development will focus around optimization of cutting edge instrumentation, data collection strategy, data management, image processing, modeling and visualization from electron images recorded from two unique combinations of instrumentation: (i) a 300 kV electron microscope with a direct electron detector and an in-column energy filter and (ii) a 200 kV electron microscope with a direct electron detector, an in-column energy filter and a Zernike phase contrast optics. Our technology development is led by 10 driving biological projects and also synergizes with 10 user projects that together include animal, plant and bacterial viruses, apoptosis-causing protein machine, chaperonin-substrate complex, membrane ion channels, nuclear receptor-coactivator complex, small RNA, oncogene protein complex, lipoproteins, amyloid protein aggregates, neuronal cells, virus-infected cells and mammalian cells related to cancer and eye diseases. Specifically, our Center will focus on 3 technology research and development projects: (i) Characterize and determine the optimal utilization of direct electron detectors and Zernike phase optics; (ii) Extend the structural determinations of biochemically purified molecular machines beyond current resolution limits; (iii) Develop novel methodologies for analyzing subcellular structures in cells by cryo-ET. We will proactively identify new projects from NIH-funded investigators across the US. We will continue our rigor in disseminating our software, experimental and computational protocols via workshops and web seminars. We will maintain an engaging advisory board to critique our progress and guide our strategic planning annually. Our efforts will extend cryo-EM/cryo-ET capabilities to fill the information gaps between x-ray crystallography, NMR and optical microscopy from nanometer to atomic resolutions"
"9509415","NIDDK Medical Student Research Program (DK-MSRP): Project Summary/Abstract NIDDK created the NIDDK Medical Student Research Program (DK-MSRP) in 2009 to promote exposure of medical students to research and career pathways involving diabetes, obesity, and metabolism. The Vanderbilt Diabetes Research and Training Center (VDRTC) was asked to lead this program because of its experience with a long standing medical student research program. This application, in response to the RFA for creating a National Enrichment Program, proposes an enhanced DK-MSRP that engages medical students from around the country in research and excites them about careers in discovery related to diabetes and its complications. The DK-MSRP consists of: 1) Nation-wide application process available to students from all US medical schools; 2) Matching of selected students with one of 15 NIDDK-supported Diabetes Research Centers; 3) Student-conducted research at a NIDDK-supported Diabetes Research Center; 4) Enrichment activities to educate students about diabetes and research opportunities; 5) National Research Symposium at the end of the summer; 6) Robust program evaluation; 7) Short and long-term career follow up of student participants; 8) Experienced administrative supervision, educational support, and advisory panel oversight; and 9) Synergy with other NIDDK-funded programs. Since its inception in 2009, 550 students from more than 100 medical schools have conducted research at one of the 15 NIDDK-supported Diabetes Research Centers during the summer between their first and second years of medical school. This program, with its considerable diversity in geography, ethnicity, and scientific area of research, has become a way to initiate research exposure for students who might not otherwise pursue this career path. The VDRTC and the DK-MSRP propose these specific aims: 1) Create and maintain an organizational structure that provides medical students with an in- depth experience in scientific discovery; 2) Provide access to online educational materials and seminars on bench, translational, and community research in diabetes and its complications; 3) Organize and host a National Research Symposium for DK-MSRP students to present their work and engage with leaders in diabetes research; 4) Develop networking skills and coaching for career development of DK-MSRSP students to nurture future researchers in diabetes, obesity, and metabolism; 5) Develop a social media platform to track students, monitor program outcomes, and create resources for trainees' continued involvement in clinical and research careers in diabetes. Thus the DK-MSRP generates significant enthusiasm about diabetes research and creates momentum toward a research career and is a key example of NIDDK-supported Diabetes Research Centers and other NIDDK programs working together to train future leaders."
"9458729","The mission of the Stable Isotope & Metabolomics Core (SIMC) is to provide guided metabolite and substrate  flux determinations in complex in vivo metabolic rodent models and for human clinical investigation for  members of the Einstein-Mount Sinai Diabetes Research Center (ES-DRC). The SIMC provides an array of in  vitro metabolic methodologies that augment in vivo investigations. These services provide investigators with  specialized assays to determine substrate flux dynamics and metabolite profiles at the organelle, cellular,  tissue and whole body level thereby elucidating the integrative network of disorders in glucose, protein and  lipid metabolism. Through these collaborative efforts with the other Cores of the ES-DRC, the effects of defined  pharmacological, dietary, environmental and genetic alterations are thoroughly characterized for their effects  on glucose and lipid homeostasis, insulin action, and metabolism. The role of candidate molecules in relevant  tissues (i.e., neurons, hepatocytes, skeletal muscle, adipocytes and beta cells) that are related to glucose  homeostasis can be specifically delineated by thorough and definitive analyses using in vivo and in vitro  experimentation with a step-wise guided approach in rodents and humans as well as in cell lines. To  accomplish these goals, the SIMC will: 1) perform in vivo stable isotope substrate flux assays for the  determination of rates of protein synthesis, lipogenesis, peripheral glucose disposal, hepatic glucose recycling,  glucose-glycerol cycling and glucose-lactate cycling; 2) determine glycolysis (extracellular acidification rates)  and mitochondrial oxygen consumption (mitochondrial respiration) in isolated cells, tissue explants or tissue  culture, using Seahorse Biosciences Flux Analyzers, as well as more comprehensive stable isotope flux  assessments; 3) perform targeted hypothesis-driven assessments of plasma and tissue metabolite profiles for  key metabolites in the glycolytic/gluconeogenic, pentose phosphate, and tricarboxylic (TCA) cycle pathways,  and lipid metabolism, including fatty acid, fatty acyl CoA and fatty acyl carnitine profiles; 4) provide mentorship  and assistance with protocol development , which uses mass spectrometer-based flux and metabolite profiling  methods for the evaluation of molecular biochemical targets relevant to the control of glucose and fatty acid  homeostasis; and 5) coordinate these efforts with other ES-DRC and Institutional Core facilities at Einstein and  Mount Sinai. All of these services are available to investigators new to diabetes research, as well as to  investigators working on diabetes-related projects that can be enriched and extended by the use of the  expertise and facilities of this Core."
"9472878","Project 4: Neuroprotection and neuroinflammation induced by the complement proteins and receptors  In order to increase the successful identification of novel therapeutic targets for degenerative disorders  commonly seen in the elderiy, the interrelations between new discoveries in genetics (GWAS identified risk  association genes), cell biology (autophagy), immunology (inflammasomes) and neurobiology must be  delineated using a combination of experimental approaches. One rapidly emerging area is the link between  the immune system and cellular homeostasis in neurobiological systems, consistent with a role for the  immune system components in normal and pathological brain function. The complement system is a  powerful effector mechanism of the innate immune system that contributes to protection from infection and  resolution of injury. Complement component deposition has been associated with Alzheimer's disease (AD),  macular degeneration, Parkinson's disease and other age-related neurodegenerative disorders. While the  activation of the complement cascade may be detrimental in these diseases, C l q , the initiator molecule of  the classical complement pathway, has anti-inflammatory effects in the absence of the other components of  the complement system. Unexpectedly, it has become apparent that in the brain C l q synthesis is induced in  response to a variety of insults and injury initially in the absence of synthesis of other complement  components. In addition, our lab made the novel observation that in vitro C l q improves neuronal survival  under nutrient stressed conditions and suppresses amyloid beta-induced neuronal death suggesting that  C l q may have a neuroprotective role. This novel neuroprotection triggered by C l q was associated with  induction of expression of neuronal genes which if suppressed abrogated the C l q neuroprotective effects.  Here we will collaborate with other members of the Program Project to identify the mechanisms of this C l q  neuroprotection/survival, determine if this coordinates with a GWAS identified risk polymorphism in CRI, and  create new animal models to elucidate the significance of this pathway in in vivo models of  neurodegenerative diseases in aging populations. The molecular delineation of this novel pathway should  uncover a number of potential therapeutic targets which have not been explored which can then be  translated into innovative strategies (perhaps in combination with other therapeutic targets) in the clinic for  the enhancement of neuron survival to improve the quality of life for individuals suffering from  neurodegenerative or neurodevelopmental disorders.  RELEVANCE (See instructions):  This project will identify key signaling pathways and molecular interactions that are required for a novel  neuroprotection mechanism discovered in our laboratory and determine if this pathway improves neuronal survival  in an animal model of Alzheimer's Disease (AD). In a complementary approach the biological basis of the AD risk  association of a polymorphism in an immune regulatory protein, CRI, will be determined. These results will  provide the first step in design of novel pharmacologic interventions for degenerative diseases in humans."
"9607347","Deciphering neural coding will require deconstructing the complex and intertwined signaling mechanisms that drive cellular excitability, synaptic plasticity, and circuit dynamics in the brain. This fundamental objective has been extremely challenging because unraveling the temporal and spatial interactions of multiple signaling pathways requires coordinated observation of multiple networks within individual cells and multiple neurons within intact circuits. Large gaps in knowledge remain because our current tools for tracking the dynamics of molecular activity are poorly suited for investigating more than one reporter at a time. Here, we propose to tackle this constraint through development of a novel methodology for simultaneous optical imaging of multiple quantitative FRET biosensors within single neurons, using FLuorescence Anisotropy Reporters (FLAREs). Numerous FLAREs targeting canonical signaling pathways, including calcium, cAMP, and the MAPK cascade, have been constructed in several colors allowing simultaneous imaging of up to three sensors in a single preparation, either in the same or complimentary pathways. We propose three aims to validate and further develop this technology to tailor it for studying cells and circuitry in acute and cultured slices from the mouse brain during neural coding. We will first adapt an optical sectioning microscopy method that is highly advantageous for fluorescence polarization imaging, known as dual-inverted Selective Plane Illumination Microscopy (diSPIM), for FLARE imaging. We will also expand the FLARE palette to include key regulators of synaptic function (Rac, CaMKII) and membrane excitability (voltage). Construction of the FLARE-SPIM instrument will enable proof of principle studies on two high-value neuronal circuits. First, pushing the limits of subcellular spatial resolution, FLARE-SPIM imaging will be performed on key signaling molecules in single dendritic spines in acute hippocampal brain slices during induction of long-term potentiation. Second, pushing the limits of cellular temporal resolution, we will track the rhythmic fluctuations of voltage, calcium, PKA and ERK activities during circadian oscillations of neuronal activity exhibited in organotypically-cultured suprachiasmatic nucleus brain slices. Together, these studies will lay the foundation for systematic exploration of neuromodulation within cells and neuronal circuitry, providing critical and unprecedented new insights for the spatial and temporal interactions between signaling pathways. Through collaboration with other Brain Initiative groups working on similar problems, this foundational work will be scalable to add suites of sensors that visualize nodes of coordinated cellular activity and reveal and measure the complexity of neural coding within intact brain circuits."
"9454573","?    DESCRIPTION (provided by applicant): Dr. Airie Kim is a Pulmonary and Critical Care physician who is greatly interested in the pathophysiology of sepsis and overwhelming inflammation in intensive care units (ICUs). One facet of this problem that is particularly amenable to laboratory study is anemia of inflammation (AI), a prevalent condition with strongly associated morbidities and mortality. Her long-term goal is to become an expert and academic leader in the field of AI, and eventually in other inflammation-related aspects of critical illness She will be supported by her primary mentor, Dr. Tomas Ganz, a leader in the field of anemia and iron metabolism, as well as her co- mentors and advisors who will provide their multidisciplinary expertise in training Dr. Kim in the theoretical and technical aspects of hematopoiesis and inflammation. Through UCLA's Clinical and Translational Science Institute (CTSI), Dr. Kim will have access to numerous career development seminars that address such topics as grant writing, manuscript preparation, and ethical research. She will also take graduate courses to obtain further training in immunology, pharmacology, hematopoiesis, and biostatistics. Dr. Kim is fortunate to have the full support of her institution, as well as the man advantages of carrying out her research project at UCLA, a renowned research center. This proposal outlines a 5-year research and career development plan that will prepare Dr. Kim to become an independent physician-scientist engaged in high-level scientific research. This project aims to elucidate the mechanisms of acute and severe AI, and to test novel therapies and their mechanisms of action in a mouse model. Dr. Kim recently characterized a mouse model of AI induced by heat-killed Brucella abortus (BA) that mimics the characteristics of human ICU anemia, including rapid onset, hypoferremia despite preserved iron stores, shortened erythrocyte lifespan, and depressed erythropoiesis. Using the BA mouse model of AI, Specific Aim 1a seeks to comprehensively investigate the underlying mechanisms, including potential contributions of reduced erythropoietin (EPO) production, decreased EPO receptor activity, and altered erythropoietic differentiation. One specific inflammatory cytokine that has been implicated in the development of AI is interferon-? (IFN-?). Using IFN-?R1-/- mice, Specific Aim 1b seeks to examine the mechanisms of IFN-? involvement in erythroid progenitor differentiation, macrophage activation, and erythrocyte lifespan. Two promising candidates for the treatment of AI are an orally bioavailable prolyl-hydroxylase (PHD) inhibitor that has been shown to improve anemia in patients with chronic renal failure, and erythroferrone (ERFE), a hormone newly identified by Dr. Kim's group that is induced by EPO and suppresses hepcidin expression. For Specific Aim 2a, Dr. Kim will test the PHD inhibitor in the BA mouse model in order to investigate its mechanistic and potential therapeutic effects in acute and severe inflammatory anemia. For Specific Aim 2b, Dr. Kim will use murine recombinant ERFE in the BA mouse model in order to investigate the effects on erythropoiesis and recovery in acute and severe AI. This project seeks to answer important mechanistic questions about AI, and investigate the use of novel therapies. With this work, Dr. Kim aims to advance our knowledge and potential treatments of the common but poorly understood condition of ICU anemia."
