"APPLICATION_ID","ABSTRACT_TEXT"
"9164310","Abstract Arthropod-borne viruses (arboviruses) are undoubtedly a major public health concern and a cause of significant morbidity and mortality worldwide. Among the arboviruses, mosquito-borne viruses collectively constitute some of the most important human pathogens. Recently, we have observed significant expansions in their geographic distribution, substantial increases in their virulence, and their adaptation to new vectors that have now increased transmission rates to humans. The importance of these viruses is further underscored by the lack of available vaccines, therapeutics, or reliable measures that can be implemented to diminish disease. Recently, arbovirologists have become increasingly interested in the discovery and characterization of novel insect-specific viruses, in particular, mosquito-specific flaviviruses. Unlike the much better known mosquito- and tick-borne flaviviruses, which alternately infect vertebrate and invertebrate hosts, mosquito-specific flaviviruses appear to replicate only in mosquitoes and mosquito cells. A large number of insect-specific flaviviruses has been isolated from and/or detected in mosquitoes and sandflies collected worldwide, with very high prevalence rates among affected populations. Although these insect-specific flaviviruses are abundant in nature, very little is known about their ecological niche, their role in the evolutionary history of flaviviruses, the genetic determinants that render them unable to replicate in vertebrate cells, or to what extent they affect transmission of vertebrate-pathogenic flaviviruses in nature. Several studies have demonstrated that these viruses are mosquito-specific using conventional virologic techniques, but there are currently no data that describe their lack of replication in vertebrate cells at a cellular or molecular level, and no work has been attempted to determine exactly where the restriction to replication in vertebrate cells exist for these flaviviruses. Additionally, very few studies with conflicting results have been performed to determine the effect of mosquito- specific flaviviruses on their vertebrate-pathogenic flavivirus relatives, and no work has been done to identify the mechanism by which superinfection exclusion occurs among these viruses. This project will utilize a recently discovered insect-specific flavivirus (tentatively designated Aripo virus; ARPV) that is evolutionarily closely related to the vertebrate-pathogenic flaviviruses, as a prototype, to achieve the following aims: (1) to determine at what stage of the virus? replication cycle is ARPV restricted from replicating in vertebrate cells, and (2) to identify the mechanism by which ARPV precludes superinfection by vertebrate-pathogenic flaviviruses in mosquitoes. This study will utilize a wide array of techniques to determine if ARPV is restricted from replication in vertebrate cells because of an inability to attach and enter, replicate and/or translate its genome, or correctly assemble and release its progeny virions. We will also determine how ARPV affects the RNAi pathways in vitro and in vivo, and identify which components are responsible for preventing the subsequent superinfection by vertebrate-pathogenic flaviviruses, in a medically important vector species. Altogether, the results obtained from this project will be instrumental in understanding flavivirus biology, and will be readily translated to design new therapeutic targets, attenuate flaviviruses for novel vaccine approaches, and design biological control measures for important vectors through the use of mosquito-specific viruses or activation of key components in the RNAi pathway to prevent subsequent flavivirus infection. My most recent work involves the isolation and characterization of a novel insect-specific flavivirus, named Aripo virus (ARPV) that was isolated from mosquitoes collected in Trinidad. The complete ARPV genome was determined and phylogenetic analyses showed that ARPV is closely related to the pathogenic mosquito-borne flaviviruses. My work also shows that prior infection with ARPV reduces superinfection and dissemination rates of West Nile virus in vivo in Ae. aegypti mosquitoes. Experimentally, ARPV infection is also efficiently transmitted vertically in Ae. aegypti mosquitoes, at least to the F3 generation. There is currently no work being undertaken to determine exactly where the restriction to replication in vertebrate cells exist for these insect- specific flaviviruses, and no work aimed at identifying the mechanism by which superinfection exclusion occurs between insect-specific and pathogenic flaviviruses. These new avenues of research involving flavivirus host restriction and mosquito innate immunity will form the foundation of my future research as I transition into an independent position. My preliminary work shows ARPV can attach and enter, and replicate and translate its genomic material in vertebrate cells, clearly demonstrating this is a productive line of research. Extensive theoretical and practical training in new experimental techniques are required to effectively complete my aims and successfully transition to an independent faculty. UTMB offers a vast plethora of opportunities including training in lab and project management, manuscript and grant writing, and mentoring and communication. UTMB contains renowned arbovirologists, RNA biologists, faculty mentoring programs, core facilities and many intramural funding options that will effectively guide and support my transition toward independent investigator status. This award will provide financial support and protected time to generate high quality data for R grant submissions. This award will support my long-term goal of leading an effective arbovirus research team."
"9481432","Project Summary When HIV-1 is transmitted from one individual to another, a major bottleneck takes place and only one or a few viral variants establishes infection in the new individual. The study of these special transmitted/founder (T/F) viruses is important because these viruses seed new infections. Since T/F viruses are the most important targets of prevention based strategies, a deeper understanding the phenotypic properties that correlate with successful transmission is crucial. Several phenotypic features of the Env glycoprotein clearly differentiate T/F HIV-1 from those that arise during chronic infection or after lab adaptation: T/F Envs are exclusively CCR5 tropic, they have fewer glycosylation sites and shorter variable loops, and they are more resistant to neutralizing antibodies. In this proposal, I will characterize a new feature of T/F HIV-1 variants which I have discovered: T/F HIV-1 is highly specific for the CD4 receptor of humans, whereas lab adapted HIV-1 is far more promiscuous and can enter cells through the CD4 molecules of all primate species that I have tested. This distinction is important because it further supports the idea that the lab adapted viruses that we have been studying for decades may not truly be representative of viruses that are naturally transmitted during infection. The objectives of this proposal are to study the evolutionary diversity of CD4 to identify receptor requirements that are critical to the successful entry and infection of T/F HIV-1 variants. The specific aims of this research proposal are to: 1) determine the extent to which CD4 imposes selection on lentiviruses during transmission, 2) investigate post- entry interactions between primate CD4 and Nef and Vpu from T/F HIV-1, and 3) identify nonhuman primate individuals with CD4 alleles best suited for studying HIV-1 transmission and early infection. Collectively, this research will provide critical insights into how we tackle modeling T/F HIV-1 infection in nonhuman primates. In addition, it will further our understanding of the biological interactions made between T/F viruses and their hosts, as well as aid in our understanding of how lentiviruses adapted to humans during zoonosis."
"9465461","Project Summary/Abstract: ?Bayesian image analysis in Fourier space (BIFS)?  The objective of this grant is to develop a family of new medical imaging processing methods that will advance the state-of-the art in radiological research and diagnostic evaluation. We will improve on commonly used spatial filtering methods, Fourier/wavelet shrinkage/sparsity methods, and conventional Bayesian image analysis methods by reformulating Bayesian Image analysis in Fourier Space (BIFS), i.e., by modeling in terms of spatial frequencies. Spatially correlated prior distributions that are difficult to model and compute in conventional image space can be more efficiently modeled as a set of independent processes across Fourier space. The originally inter-correlated and high-dimensional problem in image space is thereby broken down into a series of independent one-dimensional problems in Fourier space, where the independent distributions are tied together by our development of a parameter function over Fourier space. This independence over Fourier space structure coupled with the concept of the parameter function will enable us to develop new families of powerful and easy to specify BIFS models with fast algorithms to compute posterior image estimates. We will disseminate these methods to imaging researchers and clinical practitioners by developing a BIFS software package designed to solve a wide range of medical image processing problems.  The specific aims of the proposal are: 1) to develop novel BIFS models targeted to provide improved solutions to medical image processing problems; 2) to validate benefits of BIFS models compared with conventional processing methods based on careful simulation and phantom imaging studies; 3) to clinically validate improvements generated by BIFS modeling in two ongoing clinical studies: a) quantification of brain perfusion patterns associated with frontotemporal lobar dementia, and b) detection of breast cancer in MRIs; and 4) to disseminate the methods to the wider clinical and scientific communities by generating and releasing an R package for the implementation of BIFS.  Our innovative BIFS modeling approach has the potential to make a big difference in the field of medical image processing problems and image analysis in general. The impact on radiological application through the development of new, readily implementable and fast-to-compute BIFS models will lead to increased accuracy for the detection of findings in radiological screening and diagnosis; improved assessment of treatment efficacy; increased accuracy for measuring disease effects in imaging-based clinical studies; and expanded potential for practical image data-mining."
"9558732","Principal Investigator/Program Director (Last, first, middle): ABSTRACT Title: MESENCHYMAL STEM CELL NICHE FOR TUBERCULOSIS Tuberculosis is the leading cause of death in mankind due to infections and more than 8 million new cases occur each year with 2 million deaths per year. Emergence of multi-drug resistance (MDR) and extraordinarily resistant (XDR) Mycobacterium tuberculosis (MTB) isolates has rendered the control of tuberculosis very difficult. A third of human population is infected with latent MTB from which active cases arise. Paradoxically, HIV-1 infection can deplete CD4 T cells and enhance co-infection due to tuberculosis and death rate. There is extensive lung damage during ongoing tuberculosis, tuberculosis during HIV infection, and in particular during MD/XDR tuberculosis. Urgent methods are required to repair and restore lung function and concurrently eradicate Mycobacterium tuberculosis (MTB) from the lungs of humans with and without HIV infection. Phase I studies show that transfusion of mesenchymal stem cells (MSCs; aka.stem cells) into patients with MDR/XDR patents was safe and there was partial clinical improvement in lung function and systemic immunity. Human bone marrow derived MSCs are unique because they can be grown in large numbers in vitro and infused back into humans from both allogenic and autologous sources. We made a new discovery that rapamycin-activated stem cells internalized and killed MTB in vitro through enhanced autophagy. We now propose that such `conditioned stem cells' can be transfused into patients with MDR-XDR tuberculosis to obtain enhanced killing of MTB and concurrent restoration of lung function. Since the cell biological basis of stem cell mediated infection control remains unclear, we propose the following studies to optimize stem cell administration into humans for immunotherapy of tuberculosis. SPECIFIC AIM- 1: Investigate the mechanisms of receptor mediated phagocytic uptake, cytokine and oxidant responses of MTB by human mesenchymal stem cells. SPECIFIC AIM-2: Investigate the mechanisms of inducing and maintaining autophagy in mesenchymal stem cells to develop immunotherapeutic methods. Rationale: We discovered that in vitro conditioned mesenchymal stem cells killed mycobacteria including BCG and MTB. Since autologous MSCs have been transfused in a phase I study and found relatively safe, we will assess the cell biology of stem cells prior to transfusion by analyzing mechanisms of MTB uptake into stem cells and correlate with cytokines and growth factors. We will analyze various surface receptors, phagocytic phenomena and associated oxidant synthesis to understand how stem cells can be conditioned to kill MTB. Since autophagy killed MTB within stem cells, we will evaluate the multiple mechanisms of inducing autophagy and their effects on stem cells. Impact of the project: The prevalence of MDR/XDR tuberculosis and HIV infection renders the control of both TB and HIV difficult. Lung damage in tuberculosis is well established. Thus, newer methods fo immunotherapy is urgently required. Once stem cell biology is investigated and understood, we anticipate that that `conditioned and improved' stem cells can be transfused into patents for effective control for infection in the lungs. The availability of large numbers of stem cells, the expertise to analyze the cell biology of stem cells suggest that this proposal will have lasting impact on immunotherapy for lung specific disease. Performance sites for research: Principal Investigator: Chinnaswamy Jagannath, Ph.D. Professor, Dept. of Pathology and laboratory Medicine, University of Texas Health Sciences Center, 6431, Fannin, Houston, Texas 77030 USA PHS 398 (Rev. 09/04) Page"
"9427194","ABSTRACT Despite decades of research, effective therapies for obesity are lacking. Given the magnitude of the obesity epidemic, there is a critical need for intervention strategies that effectively reduce body weight and maintain weight loss. Nodose ganglia (NG) neurons of the vagus nerve that innervate the gut are a key component of the nutrient sensing machinery that provides negative feedback to terminate a meal. Postprandial signals are sensed by vagal afferent terminals in the gut and the information is relayed centrally to neurons of the nucleus tractus solitarius (NTS). The neuropeptide cocaine and amphetamine regulated transcript (CART) expressed by NG neurons is a primary molecular signal that controls caloric intake. In obesity, loss of vagal CART is sufficient to increase food intake and body weight. Therefore, we hypothesize that in diet-induced obesity, restoring CART expression in NG neurons will cause voluntary reduction in food intake and sustain body weight after weight loss interventions. To evaluate the therapeutic potential of targeting CART and NG neurons innervating CART (NGCART) we will study 1) how metabolic cues are integrated in NGCART neurons, 2) how this information is relayed centrally, and 3) the impact of overexpressing CART in NG neurons on body weight. We apply powerful genetic and molecular neuroscience tools to the vagus nerve for in vivo imaging, connectivity mapping, and targeted overexpression in NGCART neurons. In aim 1, we propose to determine the metabolic signals that recruit NGCART neurons by using a Cre-dependent viral tracer injected into the NG of CARTCre mice to map the projections and terminals of NGCART neurons in the gut, and record the activation profile of these neurons in live animals by using a genetically targeted calcium indicator. In aim 2, we will combine multisynaptic circuitry tracing with serial two photon tomography to map NGCART neurons synaptic circuitry through the brain. In aim 3, we will use a cre- dependent CART overexpression virus to restore CART expression in NGCART neurons of CARTCre mice and determine the impact on feeding and body weight in diet induced obesity. These studies will elaborate on previous work by identifying a molecular and cellular target that can provide the foundation for developing peripheral treatments for obesity."
"9238787","DESCRIPTION (provided by applicant): Vascular smooth muscle (SMC) phenotypic modulation, the transition from a contractile to a proliferative phenotype accompanied by neointima formation following vascular injury, plays a critical role in the development and progression of several proliferative cardiovascular diseases such as atherosclerosis, hypertension, restenosis after angioplasty or bypass, diabetic vascular complications, and transplantation arteriopathy. The regulatory mechanisms underlying SMC phenotypic modulation, however, are poorly understood. A hallmark feature of the phenotypic modulation is the down-regulation of SMC contractile genes. Platelet-derived growth factor-BB (PDGF-BB), a well-known stimulator of SMC phenotypic modulation, down- regulates SMC gene expression and stimulates SMC proliferation via posttranscriptional regulation of the related genes. The post-transcriptional mechanisms involved in SMC phenotype gene expression, however, remain largely unknown. Our exciting preliminary data indicate that the down-regulation of SMC contractile genes is caused by abnormal RNA editing of their precursor mRNAs (pre-mRNAs). This abnormal pre-mRNA editing is facilitated by adenosine deaminase acting on RNA (ADAR), which converts adenosines to inosines (A->I editing). A-to-I RNA editing of the pre-mRNA transcripts from introns or 3'-untranslated regions alters pre- mRNA splicing, leading to decreased mature mRNA levels and abnormal cellular functions. PDGF-BB induces ADAR1 while down-regulating SMC myosin heavy chain (SMMHC) and calponin (CNN). Knockdown of ADAR1 by shRNA restores PDGF-BB-blocked SMMHC and CNN expression, demonstrating that ADAR1 plays an essential role in SMC phenotype modulation. ADAR1 appears to be also important for PDGF-BB-induced SMC proliferation/survival. In vivo studies show that SMMHC and CNN pre-mRNA is accumulated when their mature mRNA is decreased in balloon-injured rat carotid arteries. Moreover, ADAR1 is highly induced in media layer SMCs initially, and neointima SMCs subsequently following the injury. Of importance, knockdown of ADAR1 dramatically inhibits injury-induced neointima formation, demonstrating a critical role of ADAR1 in vascular remodeling in vivo. These seminal findings strongly support a novel hypothesis that ADAR1/abnormal RNA editing mediates PDGF-BB-induced down-regulation of SMC contractile genes and SMC proliferation/survival, leading to SMC phenotypic modulation and vascular remodeling. Using primary culture of SMCs, in vivo rat balloon injury and mouse wire injury models combining with molecular, cellular and histological approaches, we will 1) determine the role and mechanism whereby ADAR1 modulates SMC phenotype; 2) elucidate the molecular mechanisms underlying ADAR1 function in regulating SMC proliferation/survival; and 3) study the role of ADAR1 in SMC phenotypic modulation and vascular remodeling in vivo. Successful completion of these aims will unravel a novel mechanism governing SMC phenotypic modulation, which will ultimately lead to identification of novel targets for developing therapeuti agents to treat proliferative vascular diseases."
"9540235","Project Summary In both humans and mice, natural killer (NK) cells are required for host defense against viral infection, most notably herpesvirus infections. To support viral clearance, NK cells robustly proliferate in an antigen-specific fashion, generate immunological memory, and exhibit enhanced functionality upon secondary encounter with the same virus. However, the molecular mechanisms governing these dynamic NK cell responses to infectious pathogens are incompletely defined. To address the requirements for NK cell expansion, I have examined by RNA sequencing (RNA-seq) the transcriptome of virus-specific NK cells during a model of mouse cytomegalovirus infection (MCMV). By comparing highly expressed genes in proliferating NK cells during MCMV infection to those in naïve NK cells, I have identified the transcription factor interferon regulatory factor 8 (IRF8) as being enriched in MCMV-responding NK cells. Preliminary studies revealed that NK cells lacking IRF8 are impaired in their proliferative capacity, and this coincides with host susceptibility to MCMV infection. Thus, the goal of this proposal is thus to define the role of IRF8 in MCMV-specific NK cells during infection. In further preliminary studies, Zbtb32 was identified by RNA-seq as being significantly downregulated in Irf8-/- NK cells versus wild-type (WT) NK cells during MCMV-driven proliferation. This study will first examine whether IRF8 binds regulatory elements within the Zbtb32 locus by chromatin immunoprecipitation and whether overexpressing Zbtb32 in Irf8-/- NK cells, through generating novel retrogenic mice by retroviral transduction, can restore normal MCMV-driven proliferation (Aim 1). Subsequently, this study will use immunoprecipitation and mass spectrometry to identify distinct IRF8 binding partners in activated versus naïve NK cells that may underlie the infection-specific transcriptional program of IRF8 (Aim 2). Together, these studies will shed light on how IRF8 induction promotes the generation of potent MCMV-specific NK cell responses. By advancing basic knowledge of the mechanisms governing antiviral NK cell responses, the proposed research may reveal novel strategies for manipulating NK cell responses against pathogens in the clinic."
"9630430","Project Abstract Understanding the influence of the neural efferent and afferent regulation of ?-cell health and function would be an important advancement. Although it is known that neural input plays a critical role in the health of the pancreas, details of the neuroanatomy and neurobiology of the human pancreas remains largely unexplored. It may be that T1D patients, wherein residual ?-cells continue to secrete C-peptide, could benefit from neuromodulation therapies that stimulate neurovascular regrowth and result in anti-inflammatory effects in the pancreas. Furthermore, neuromodulation therapies may help to improve insulin secretion in patients with T2D or perhaps delay onset of disease for those at high risk for T1D (e.g. first-degree relative with T1D, multiple islet autoantibodies, genetic risk factors). Both knowledge of the functional neuroanatomy and enabling technologies to test this hypothesis do not currently exist. This project brings together a potent combination of experts in islet biology, neurophysiology, bioengineering, and clinical endocrinology with an innovative approach to define the comparative neuroanatomy of the human and rat pancreatic neural network. Our hypothesis is that pancreatic ?-cells, functioning like peripheral neurons, maintain blood glucose levels, in part, due to the neural regulation of islet blood flow. This novel hypothesis will be tested by one specific aim: 1) To determine pancreatic neuroanatomy. These studies will enable understanding and mapping of the autonomic and sensory efferent and afferent networks in normal human and rat pancreas. Importantly, our studies will map the human pancreatic neural networks utilizing specimens already collected from human organ donors without diabetes and those with T1D or T2D using optical clearing methodologies and high resolution 3D microscopy. The outcomes of these studies will provide critical design data for logical application of next-generation neuromodulation technologies to improve islet health. This proposed work is directly in-line with the SPARC program to understand comparative neuroanatomy of the endocrine pancreas to enable neuromodulation strategies for amelioration of end organ diseases."
