"APPLICATION_ID","ABSTRACT_TEXT"
"9614010","DESCRIPTION (provided by applicant): Treatment of Co-Occurring Alcohol Use Disorders and Depression/Anxiety Disorders highlight the need, recognized by the NIAAA, to identify new targets/drugs for the treatment of alcoholism and its co- morbidities. Naltrexone a non-selective opioid receptor antagonist is one of the few therapeutics currently used in the treatment of alcoholism, validating the opioid receptor system as a relevant target for alcohol abuse. However, naltrexone shows highly variable eficacy in treatment seeking alcoholics and is plagued by side effects and consequent lack of compliance of use. We propose that the non-selective nature of naltrexone may be contributing to the variable efficacy and/or the side effects that limit compliance. Here, we propose to examine specifically the role of the delta opioid receptor (DOR) subtypes, DOR1 and DOR2 in alcohol related behaviors. We are particularly intrigued by the DOR as a target because it is involved in both alcohol consumption and anxiety, which is often co-morbid with alcohol abuse and is a key risk factor for relapse. In our preliminary studies we have found that drugs that target the DOR1 and DOR2 subtypes of opioid receptor have opposing effects on ethanol consumption. In addition, we have found that an antagonist at DOR2 and an agonist at DOR1 can act synergistically to reduce ethanol consumption clearly indicating that these two receptor subtypes are distinct targets with opposing actions. We also have preliminary evidence that the DOR1 may be a heterodimer of the DOR and the mu opioid receptor (MOR). In this proposal, we will examine which commercially available DOR ligands are effective for the reduction of ethanol consumption and ethanol withdrawal induced anxiety. We will also examine whether prolonged ethanol exposure alters the potency and/or efficacy of the DOR ligands, in particular the subtype selective ligands. As a third goal, we will determine whether the effects of any of the DOR drugs require expression of the other opioid receptors, in particular the MOR which could indicate that they target a DOR/MOR heterodimer to exert their effects. Together, these studies may validate the DOR as a target for alcohol abuse disorders, indentify the pharmacological profile of the most ideal ligands for alcohol abuse disorders, and perhaps provide in vivo relevance for the MOR/DOR heterodimer as a target."
"9505284","Despite the discovery of Mycobacterium tuberculosis (Mtb) over 100 years ago and the availability of effective drugs for over 60 years, there remain formidable hurdles for controlling tuberculosis (TB) disease including the lack of a highly efficacious vaccine, long drug treatment regimens, prevention of infection, and killing dormant bacilli within macrophages. After close contact with a person with pulmonary TB, most people develop latent Mtb infection (LTBI). However, some individuals are naturally resistant to infection (RSTRs). The mechanisms of resistance are unknown and may provide insight into novel therapeutic strategies. In a large TB household contact study in urban Uganda over the past 20 years, we found that ~9% of close adult household contacts remained persistently TST and Interferon-? Release Assay (IGRA) negative during extended follow-up. To our knowledge, this large Ugandan cohort is unique with rigorous longitudinal clinical and epidemiologic data. Using genome-wide profiling of mRNA isolated from Mtb-infected peripheral blood- derived monocytes, we compared transcriptional signatures in the RSTR and LTBI groups. We found that the histone deacetylase (HDAC) gene family distinguishes RSTRs from LTBIs and may regulate resistance to Mtb infection. HDACs regulate transcription and some family members mediate the innate immune response to microbes. We also found polymorphisms in HDAC1 that are associated with resistance to infection. In peripheral blood monocyte-derived and alveolar macrophages, HDAC inhibitor treatment decreased Mtb replication in comparison to untreated cells. These findings support the concept that RSTRs have protective innate immune responses that are monocyte-dependent. However, several critical questions need to be addressed including elucidation of the molecular and genetic mechanisms of HDAC-mediated control of Mtb replication in macrophages and clinical resistance to Mtb infection. In addition, the role of alveolar macrophages in regulating HDAC-mediated immune responses is poorly understood. We hypothesize that HDACs mediate resistance to infection by inhibiting Mtb replication through transcriptional regulation of anti- microbial pathways. Characterization of HDAC-dependent immune responses will enable identification of natural resistance mechanisms to Mtb infection. The latter will provide new insight into our understanding of TB pathogenesis, point to novel approaches to TB vaccine and drug development, and identify biomarkers of resistance to and/or clearance of Mtb infection. The research aims will be integrated with a mentoring strategy for mentees that fosters development of patient-oriented research with a pathway to independence."
"9551213","Project Summary This 3-year Phase II SBIR Application focuses on advancing the lead ?ultra-broad-spectrum? carbapenem (USBC) VNRX-4099, possessing an unprecedented antibacterial spectrum of activity including MRSA, Enterobacteriaceae and Pseudomonas aeruginosa, to IND filing status. The UBSC VNRX-4099 will be paired with a proprietary in-house ?-lactamase inhibitor VNRX-5133 (BLI) to protect against resistance by Ambler Class A, B and D carbapenemase-producing Gram negatives. In parallel, a discovery effort will be executed to identify a fast follower and/or chemically-diverse back-up UBSC that could be advanced into IND-enabling studies if required. Ultimately, it is envisioned that this new combination product will provide a unique clinical option for empiric therapy of multi-drug resistant polymicrobial infections in the hospital general ward and ICU, and as a second line therapy for susceptible organisms."
"9521375","?    DESCRIPTION (provided by applicant): Injury to the renal proximal tubular epithelium (PTE) represents the underlying cause for acute kidney injury (AKI) following exposure to various stresses including ischemia-reperfusion (I/R) and nephrotoxins. Kidney cells possess intrinsic mechanisms that can be activated to protect their survival under stress conditions. Facilitating repair of PTE cells will have beneficial effects in the treatment of AKI; however, the knowledge gap in understanding the mechanisms associated with repair of injury to these cells has been a setback in the development of novel therapies for AKI. Our group previously identified MG53, a novel member of the TRIM family protein, as an essential component of the cell membrane repair machinery. Although native MG53 protein is predominantly expressed in striated muscles, it is also present in the kidney particularly in PTE cells at a low, but significant concentration. PTE cells derived from the Mg53-/- mice are more vulnerable to membrane injury than normal cells, a phenotype that is also observed in striated muscles, suggesting that MG53 contributes to repair of renal epithelial cells. Compared with wild type mice, the Mg53-/- mice develop renal disorder and are more susceptible to I/R- induced AKI. We found that the recombinant human MG53 (rhMG53) protein can cross the glomeruli and target to injury sites on PTE cells to facilitate the renal protective effect against various stresses. Intravenous administration of rhMG53 could protect I/R and cisplatin-induced injury to the kidney in rodent models. These data suggest that upregulating the MG53-mediated repair mechanism in PTE cells may be beneficial in preventing AKI and treating established AKI. Since native MG53 is present in circulation, systemic administration of rhMG53 would be unlikely to induce an immune response, and potentially be a safe biologic approach for treatment of AKI. The long-term goal of this project is to test the hypothesis that MG53 contributes to maintenance of renal function under physiological conditions, and targeting MG53-mediated repair of injury to PTE cells represents an effective means for prevention and treatment of AKI. Two specific aims are proposed: a) to elucidate the mechanism for MG53-mediated membrane repair in maintenance of renal function under physiological and AKI conditions; and b) to conduct proof-of-concept studies on rhMG53- based therapy for prevention or treatment of AKI. Fulfillment of these studies should advance our knowledge on the molecular mechanisms that underlie the protection of renal cells from stress-induced injuries, and help development of novel therapies for prevention and treatment of AKI."
"9470937","R13 ? Project Summary This application seeks partial support for the 2018 Gordon Research Conference (GRC) on Antibody Biology and Engineering, together with an accompanying Gordon Research Seminar (GRS) to be held on March 24- 30, 2018 at the Renaissance Tuscany Il Ciocco, Lucca (Barga), Italy. This is the 5th GRC and the 3rd GRS on this topic which is representative of a highly exciting and influential meeting in the community. The aim of this meeting is to provide in-depth coverage of important recent developments in the rapidly evolving field of antibody biology and engineering, in an informal setting designed for maximal discussion and interaction. This field has broad implications for a wide variety of biologic and clinically significant topics that cut broadly across the multiple fields within the biomedical community, including immunity, infectious diseases, inflammation and oncology. Furthermore, for the third time in this meeting series, we will incorporate a Gordon Research Seminar (GRS). This has proved to be a highly successful addition to the Gordon Research Conference (GRC). The GRS will run immediately prior to the GRC. It will provide seminar and poster sessions specifically for graduate students, post-doctoral fellows, and early career scientists to allow them to present and discuss their research. As before, a GRS keynote speaker together with the GRC chairs, will offer support and advice through a mentorship session and continuous interactions with the trainees during the course of the GRS and subsequent GRC meeting. The GRC will host approximately 28-30 talks from invited speakers, spanning topics in basic research through clinical applications with a very dynamic mix of scientists from academia and industry. It is envisioned, that an additional 10-14 shorter talks will be given primarily by young scientists, selected from submitted abstracts. In addition, the GRC will also incorporate 4 poster sessions. Taken together, the 2018 GRC will report the most significant recent research advances in an international field of antibody biology and engineering. The discoveries presented this conference are at the leading edge in the therapeutic antibody development and clinical applications. Building on the long history of creative academia-industry interactions which have characterized the three previous meetings in this series, this GRC and its associated GRS will provide an ideal opportunity for academic and bio-pharma researchers from around the world to network and forge new collaborations. We envision that novel therapeutic applications are likely to ensue from the cross pollination of the ideas that will be presented at this meeting. Furthermore, by providing opportunities for younger researchers to present their studies and to discuss their work with more established scientists, this meeting will act as an important spring board for the development of a future group of investigators in this rapidly emerging and critically important field."
"9430441","PROJECT SUMMARY . Mitochondria play a pivotal role in regulating cardiac function in health and disease by regulating energy balance, biosynthetic processes, and cellular survival. Mitochondrial quality control and homeostasis are maintained in part through fusion and fission of mitochondria as well as through autophagic clearance or mitophagy of damaged mitochondria. Disruption of mitochondrial homeostasis has been closely linked to a host of acquired and genetic disease states, characterized by cardiomyocyte death at the cell level and overt cardiac dysfunction at a systemic level. Thus, clearly a thorough understanding of the molecular regulators of mitochondrial homeostasis in the heart is critical for reducing cardiac dysfunction related mortality. Our preliminary data demonstrate that the mitochondrial E3 ubiquitin ligase, Mulan, is a novel regulator of mitochondrial dynamics and mitophagy in mammalian hearts. Mulan participates in the maintenance of mitochondrial integrity and function. While Parkin, a cytoplasmic E3 ligase, has been extensively studied in mitophagy, Mulan's proposed role as a mitochondrial injury sensor, mediator of mitophagy, and inducer of cell death is both novel and a significant departure from the current state of understanding in the field. Given that Mulan is upregulated in Parkin null mouse hearts, we postulate that Mulan's upregulation may serve to compensate for the loss of Parkin, thus maintaining the basal cardiac function of Parkin null mice. Employing state-of-the-art techniques, we will investigate the intricacies of protein-protein and protein-substrate interactions by Mulan as well as how modulation of Mulan's expression fundamentally alters mitochondrial dynamics. Ultimately, our data may provide the first glimpse of an unrecognized, yet significant role of Mulan as a ?resident mitochondrial injury-sensor? in the heart. Furthermore, we intend to define the distinct contribution of Mulan in mitophagy, that is independent from Parkin, as well as Mulan's role in mitochondrial function, dynamics, and cell death in the heart. Given the emerging importance of mitochondrial dysfunction in cardiac pathology, the findings from our proposal will help define the role of Mulan as a key mitochondrial injury-sensor. In addition, the proposed studies will have broad implications for the understanding and treatment of heart disease."
"9524596","Abstract Our past research has provided considerable insight into the signals elicited through G-protein coupled receptors (GPCRs) that activate RhoA on astrocytes and in 1321N1 glioblastoma cells. The pathways regulated through PAR1 and S1P receptors via G?12/13 engagement include RhoA activation to increase cell proliferation, survival, and invasion-hallmarks of cancer. Our recent studies demonstrate robust activation of the transcriptional co-activators MRTF-A and YAP through RhoA signaling in glioblastoma cells, and implicate altered gene expression in proliferative and migratory responses. The objective of this proposal is to demonstrate that robust transcriptional gene programs elicited through RhoA signaling are critical to glioblastoma multiforme (GBM) tumor growth and maintenance of glioblastoma stem cells (GSC), with a long term goal of identifying new therapeutic targets for this devastating disease. Aim #1 uses the human 1321N1 glioblastoma cell line to define cellular events and identify changes in specific target genes by which GPCRs and RhoA engage transcriptional pathways that contribute to cancer-relevant cellular responses. S1P- and thrombin-induced proliferation, survival, adhesion, migration, invasion and angiogenesis are assessed in WT and MRTF-A or YAP CRISPR/Cas9 KO cells. Data from RNA seq analysis are used to identify critical regulated genes, and tested for their functional importance in cellular responses. Actions of target genes on, autocrine and transcriptional pathways that amplify response to GPCRs and RhoA are considered. Aim #2 uses patient-derived glioblastoma xenografts (PDX), as a model of glioblastoma stem cells. Several PDX lines will be grown in serum free medium in vitro as neurospheres or adherent cultures and subsequently implanted as orthotopic (brain) xenografts... YAP, MRTF-A, RhoA and their downstream target genes will be knocked down using shRNA and in vitro stem cell markers, cellular responses and in vivo tumor growth assessed. Aim #3 tests the hypothesis that RhoA-mediated transcriptional signaling leads to astrocyte dedifferentiation and gliomagenesis driven by activated Ras). Proof of principle experiments examine dedifferentiation of isolated mouse astrocytes infected with lentiviruses encoding oncogenic Ras and in which molecules in the RhoA signaling pathway are genetically deleted or knocked down with shRNAs. In vivo studies of gliomagenesis are carried out by delivery of oncogenes by lentiviral infection into the hippocampus of GFAP-Cre mice followed by analysis of tumor growth, invasion, and changes in expression of target genes and stem cell markers. The overall findings from these studies should demonstrate that GPCR- and RhoA-mediated transcriptional activation can elicit genetic and functional responses that contribute to dysregulation in glioblastoma, and that RhoA signaling contributes to the oncogenic effect of established GBM tumor drivers. The health-related significance is that these findings could shift the focus of current research and clinical practice from the established disease drivers towards consideration of GPCR- and RhoA-regulated signaling pathways in GBM."
"9434295","Abstract It is increasingly clear that people with schizophrenia have a range of visual perception impairments, including in low-level vision (e.g., acuity, contrast sensitivity) and mid-level vision (e.g., perceptual organization, coherent motion detection). These impairments are significantly related to poorer performance on cognitive (e.g., visual learning and memory) and social cognitive (e.g., facial emotion decoding) measures, and to worse functional outcomes. To date, there is no accepted technique for visual remediation for schizophrenia, and almost no work has been done in this area. However, visual remediation is a well-developed subfield within cognitive rehabilitation for TBI patients, and initial studies of short-term visual perceptual learning in schizophrenia indicate that plasticity exists that could support longer-term changes. Therefore, the overall goal of the proposed project is to test a visual remediation intervention for schizophrenia and determine its effects on specific visual targets with well-understood neurobiological mechanisms. The goal of the R61 is to determine the optimal intervention for improving the targets of contrast sensitivity (CS) and perceptual organization (PO). Extensive evidence exists for impaired CS and PO in schizophrenia. Moreover, these targets are prototypical examples of gain control and integration, respectively, which were identified by the NIMH-sponsored CNTRICS initiative as being the two core mechanisms involved in visual disturbances in the disorder. We will examine two computer-based interventions. One, ULTIMEYES (UE), targets CS. The other, contour integration training (CIT), targets PO. We will also examine the effects of combined treatment (UE&CIT). An active computer-based control treatment will be included. There will be 40 sessions, with assessments after every 10 sessions (N=20/group). The R61 Specific Aim is to evaluate the effects of UE and CIT on CS and PO targets, respectively, to determine if treatment effects meet a pre-specified effect-size criterion. Results of the R61 will be used to identify the treatment (UE, CIT, or UE&CIT) and duration (i.e., dose) that most effectively and efficiently improves the target(s). The goal of the R33 is to conduct an initial randomized controlled trial (RCT) of the optimal treatment identified in the R61. The R33 Specific Aims are to: 1) replicate and extend R61 results supporting visual target engagement in an adequately powered RCT (N=50/group); and 2) determine if visual target engagement is associated with improvements in cognition, social cognition, and functional capacity. If the R33 hypotheses are confirmed, results will inform the design of a later RCT to further explore mediators and moderators of treatment effects, and to move towards a precision medicine approach, wherein we determine which individuals are most likely to benefit from this intervention."
"9450060","Animal Models Core The overall goals of the Animal Models Core is to support all programs of the IPCAVD by performing immunization studies in DH270 unmutated common ancestor (UCA) VH + VL knock-in (KI) mice with V3- Man9 glycopeptide primes and modified mRNA boosts (Project 1, Aim 2), by performing immunization studies with the optimized V3-Man9 glycopeptide and modified mRNA regimen in rhesus macaques (Project 1, Aim 3), and by performing immunization studies in DH270 UCA VH + VL KI mice and overseeing toxicity studies of CGMP clinical trials material (CTM) mRNAs in collaboration with Project 2. The Specific Aims of this Animal Models Core will include: Aim 1. Perform immunization studies in DH270 unmutated common ancestor (UCA) VH + VL knock-in (KI) mice with Man9-V3 glycopeptides and modified mRNAs in Project 1, Aim 2. Aim 2. Perform immunization with the optimized Man9-V3 glycopeptide and modified mRNA regimen in rhesus macaques (Project 1, Aim 3). Aim 3. Perform immunization studies in DH270 UCA VH + VL KI mice and overseeing toxicity studies of CGMP clinical trials material (CTM) mRNAs in collaboration with This project will advance nucleoside-modified mRNA as a platform for HIV-1 Env immunization and establish its immunogenicity in humanized mice and NHPs. Preliminary studies have demonstrated that the extraordinary immunogenicity of modified mRNAs in mice translates to rhesus macaques in the setting of Zika and HIV immunizations. Thus, we anticipate that mRNA will be both cost-effective and highly immunogenic and therefore have the potential to be transformative to the HIV vaccine field as a vector."
"9555527","Project Summary  The HIV-1 accessory protein Vpu enhances viral infectivity by modulating several host cell proteins that are detrimental to the virus, including CD4 and BST-2 (tetherin), and preventing them from being incorporated into viral particles. Importantly, Vpu activities result in the protection of HIV-1 infected cells from cellular immune responses such as antibody dependent cell-mediated cytotoxicity (ADCC). For this reason, inhibitors of Vpu activity could be used to enhance immune killing of HIV infected cells in patients. This type of inhibitor could be an important component of therapies aimed at eliminating reservoirs of HIV infected cells.  The Johnson lab serendipitously discovered that Vpu targets the viral glycoprotein from Gibbon ape Leukemia Virus (GaLV Env) and prevents it from being incorporated into HIV-1 viral particles. Therefore, inhibiting Vpu activity greatly enhances infectivity when HIV-1 is used with this glycoprotein. GaLV Env was selected as a surrogate Vpu target in an assay for identifying inhibitors of Vpu activity. Unlike other types of Vpu assays, the output (infectivity) is quantitative in nature and very amenable to a high throughput screening.  Along with collaborators at Southern Research Institute (SRI, see letter of support), a large high throughput screening (HTS) campaign of over 650,000 compounds was initiated using this assay in hopes of finding appropriate Vpu inhibitors that could be advanced to clinical applications. This screen and dose response validation of the hits was completed in August 2017 and identified 205 candidate Vpu-inhibiting compounds.  The ultimate goal of this project is develop compounds that can be used to block Vpu activity in a clinical setting. The objective of this proposal is to determine which compounds from the HTS campaign are most suitable for further development as clinical Vpu inhibitors. 1. Conduct hit-to-lead studies to identify the best compound candidates.  a. Screen for compounds that do not block cellular SCF Ubiquitin machinery (off target).  b. Screen for compounds with Vpu-specific activity.  c. Screen with advanced toxicity and ADME assays to identify most desirable compounds. 2. Select for compounds with the desired biological activity.  a. Screen for compounds that block Vpu antagonism of CD4.  b. Screen for compounds that block Vpu antagonism of BST-2.  c. Screen for compounds that directly bind to Vpu."
