"APPLICATION_ID","ABSTRACT_TEXT"
"9479631","Abstract Despite dramatic changes in family behavior in the U.S. over the last 150 years, local level marriage and divorce data over time are not available in analysis-friendly formats nor via Decennial Censuses. Therefore, spatial and temporal variation in how these marriage and divorce patterns operate are unknown. The objective of this proposal is to archive, document, harmonize, and disseminate nearly 150 years (1867-2010) of existing county and state-level administrative data on marriage and divorce. Administrative data are the only source of historical counts of marriage and divorce at the local level. These data exist in disparate formats including official reports, pamphlets, books, and websites. The rationale underling this project is that these resources are not available on a wide scale in useable formats (i.e. in conjunction with other county and state-level variables or in a GIS or statistical package format) and the effort for any one researcher to compile these data is too onerous, OR it is taken for granted that these variables are already available. Our approach will make these marriage and divorce data available in an existing database of other county and state-level data in analysis- friendly formats in conjunction with tools and resources for county and state-level analyses. Data sharing will be expanded by also disseminating data via interactive maps and infographics?further broadening the potential audience and impact of these important data. The expected outcome is innovative research that enables researchers to better understand and explain changes in family structure over a broad sweep of time and across the entire U.S. allowing them to address novel research questions about context. Research centers with specialized knowledge and established track records for reaching national audiences are ideally suited to conduct these activities, which places the National Center for Family & Marriage Research and Minnesota Population Center in a unique position to archive and disseminate this valuable set of historical administrative data not available anywhere else. These data and tools will fuel researchers to develop innovative ways of combining and using administrative and survey data. Importantly, this effort will serve multidisciplinary researchers including demographers, economists, geographers, historians, and public policy scholars who use geographic data as well as large household surveys. This project fits squarely with the PDB mission to enhance knowledge and data availability on families and households. The application is consistent with the purpose of the R03 mechanism and the program announcement to archive and document existing data to enable secondary analysis by a broad set of researchers."
"9686257","DESCRIPTION (provided by applicant): Rapid advances in human genetics have prompted concerns about the public's readiness to process and utilize the knowledge gained to make informed decisions about their health. To facilitate genetic literacy, several government agencies including the Office of the Surgeon General and the Centers for Disease Control and Prevention (CDC) have advocated for the increased use of family health history assessment. The family health history, currently underutilized in primary care, offers an ideal proxy to assess genomic risk and is the simplest applied genomic tool available. Web-based family history tools are now publicly available to facilitate its collection, including My Family Health Portrait (MFHP) from the Office of the Surgeon General. Although family history tools like MFHP are developed for general public use, there is evidence to suggest that they may not be accessible to a large portion of the general population with limited health literacy, due to high reading grade demands and navigational challenges. An innovative approach previously demonstrated to overcome challenges with inadequate health literacy and computer literacy in health care settings is the use of Relational Agents (RAs), computer-animated characters that simulate conversations with patients. We have developed a prototype virtual counselor (VICKY: Virtual Counselor for Knowing Your Family History) to collect family health history information for common health conditions including heart disease, stroke, diabetes, hypertension and various cancers. In the proposed study, we plan to refine the virtual counselor and conduct a randomized controlled trial (RCT) to compare the efficacy of using VICKY to the existing MFHP tool for collecting family health history information among an underserved primary care patient population. The primary aims of the study are to 1) evaluate the efficacy of VICKY versus MFHP for collecting accurate family health histories and 2) determine whether accuracy varies as a function of health literacy. Secondary aims of the study will explore factors associated with the effective use of computerized family history tools and examine the impact of the tools on family and provider communication behaviors (e.g., sharing of family history information). This project will be the first to systematically obtain validation data on the efficacy of both VICKY and MFHP for collecting accurate family history data among an underserved patient population, in two languages (English and Spanish). We will determine whether a virtual counselor can overcome many of the existing barriers to using traditional web-based family history tools. This study is uniquely situated to provide insight on the most effective approaches to gathering electronic family history data from underserved populations such that they may be later integrated with electronic health record systems and broadly disseminated. Study findings will inform subsequent implementation efforts of these tools to maximize reach and effectiveness, with the goal of improving the systematic documentation and use of family history in primary care to identify those at greatest risk for chronic diseases who would benefit from preventive intervention efforts."
"9408656","DESCRIPTION (provided by applicant): Nonhuman primates (NHP) offer the most appropriate experimental model for many areas of human biomedical research, particularly in reproductive medicine, immunology and transplantation, and neurological disease. Furthermore, monkey induced pluripotent stem cells (iPSCs) are envisioned as a valuable renewable resource of cells for preclinical testing of personalized regenerative medicine approaches. Based on initial advances in common marmoset assisted reproductive technologies (ARTs) developed at the Wisconsin National Primate Research Center (WNPRC), the production of transgenic common marmosets expressing green fluorescent protein, including the demonstration of germline transmission, has been reported. Marmoset monkeys present several advantages for transgenic approaches, including the ability to routinely carry multiple offspring (rapidly increasing cohort size), facile reproductive management, and a shorter lifespan, which facilitates the study of age-related diseases such as diabetes, arthritis and Parkinson's disease (PD). In regards to PD, identification of specific alleles of the leucine rich repeat kinase 2 (LRRK2) in familial and sporadic cases of PD supports the development of a NHP model expressing these variants, as proof-of-principle for the contribution of human alleles to disease pathophysiology. We propose to advance the development of animal disease models for stem cell-based therapeutic applications with two Specific Aims: Specific Aim 1. To optimize reprogramming of iPSCs from common marmoset fibroblasts, to use transgene expression and genomic editing to define the effect of alleles associated with PD on in vitro neural differentiation in isogenic iPSC lines, and to use genomic editing tools to define the feasibility, efficiency and accuracy of genomic editing in IVF-derived common marmoset embryos. Specific Aim 2. To produce transgenic marmoset monkeys carrying wild-type and PD-associated human LRRK2 alleles and evaluate a proof-of-principle cohort for PD pathophysiology. The long-term goal of this work is to provide investigators with marmoset iPSC lines, and genetically modified common marmosets as platforms for translational research, particularly in the treatment of diseases for which primate species are the most suitable models. Animal experiments will be performed at WNPRC, which is one of the few facilities in North America housing an experimental common marmoset colony, and the only Center where marmosets, primate embryology, and cutting edge neurological translational models are actively being used to test therapies for human disease. The proposed generation and analysis of transgenic monkeys and associated modified iPSCs will provide a platform to create disease specific models and cells, and develop tests of therapeutic approaches, including personalized medicine using engraftment of iPSCs."
"9509411","Islet Procurement and Analysis Core (IPA): Project Summary/Abstract The Islet Procurement and Analysis (IPA) Core was established in 2007 as a result of growing demand for murine islets from multiple members within the Vanderbilt DRTC. Over the last funding cycle, the IPA Core provided services to 56 different investigators (49 Vanderbilt and 7 External Non-Profit) by assisting with 2981 procedures. Islet biology, development, and function in normal homeostasis and disease including a broad spectrum of islet-related processes raging from intracellular signaling, physiological response and adaptation, the immunology of type 1 diabetes, the function of islet-enriched transcription factors in development and maintenance of normal hormone-secreting status and cell fate, all the way to islet transplantation, are major research areas of the Vanderbilt DRTC. An essential component supporting the experimental pipeline of the majority of studies falling under this paradigm is our ability to isolate high quality, well-characterized rodent pancreatic islets, and then to perform complex assays of islet function. In addition, the core provides VDRTC investigators with high-resolution imaging solutions that allow bulk-tissue-imaging and fine-detail quantitative assessment of pancreatic islet morphology. Utilizing whole-slide imaging technology, the IPA Core recently developed and published standards for automated measurement of beta cell mass, and this technique is now broadly used by VDRTC members. In this cycle of competitive renewal, the throughput of procedures and number of services under the IPA Core are expected to more than double as part of the newly established Quality Control Core Facility (QCCF) for the NIDDK-supported Integrated Islet Distribution Program (IIDP), which distributes human islets nationwide and internationally from six US-based islet isolation centers. This novel and essential QCCF program centered within the IPA Core will utilize the robust infrastructure, services, and expertise of the IPA Core and directly benefit eleven VDRTC members who already use human islets from IIDP in their research. Through its standardized assessment of human islet function, cell composition, and islet health, the QCCF and IPA Core will build, together with the IIDP, a database of well-characterized human islet preparations from normal pancreas donors that will be an exceptionally valuable resource for the field. By having a centralized facility, the IPA Core provides VDRTC investigators with high-quality data of standardized islet assessment by procedures using established SOPs, optimized over the last decade for reproducibility and time effectiveness, balanced against maximal data output and at a lower price than would otherwise be possible."
"9460512","?    DESCRIPTION (provided by applicant): The long-term goal of this project is to establish a series of nonhuman primate models for the investigation of human visual system disorders. Currently, the mouse is the predominant model system used in this field, largely due to our ability to generate genetically engineered animals for the study of specific diseases. However, despite their similarities with humans, mice and other rodents do not have a cone-rich macula, the region most critical for human vision. Therefore, a nonhuman primate (NHP) model system that more closely matches human will offer important new insights into disease processes and provide much improved opportunities for development and testing of novel treatments or preventions for specific eye diseases. Our initial sequencing results from ~200 rhesus macaques (Macaca mulatta) indicate that the genetic diversity among macaques is much greater than among people. Among the macaques, we found many individuals carrying pathogenic mutations in known human retinal disease genes. Therefore, the macaque model represents a golden but currently untapped opportunity for innovative research. It is feasible to leverage existing infrastructure to generate a wide range of novel primate models (breeding lines with informative mutations) that will be invaluable for research concerning pathogenesis and the development of treatments. To demonstrate the feasibility of this approach and begin exploiting its potential, we propose to: Aim 1. Perform targeted sequencing of retinal disease genes in 1,600 individual rhesus macaques. Aim 2. Establish a mutational database for macaque eye genes. Aim 3. Generate multiple macaque models of human eye diseases. Aim 4. Characterize the phenotypes produced and begin testing of treatments of macaque models"
"9465502","DESCRIPTION (provided by applicant): Cardiovascular disease (CVD) causes 2,200 deaths in Americans every day with one death every 39 seconds. There is evidence that these deaths can be prevented with better risk factor management, however, many risk factors remain uncontrolled. The Patient-Centered Medical Home (Medical Home) which includes self-management, personalized health records and team-based care, has been proposed as a strategy to reduce these gaps in care delivery. Several Cochrane reviews and meta-analyses have found evidence that adding pharmacists to the primary care team improves risk factor control and physician adherence to guidelines. Managed care organizations have found that a centralized cardiovascular risk service (CVRS) managed by pharmacists can reduce mortality. It is not known if a comprehensive CVRS model would be implemented in typical office practices and this lack of evidence is a major gap in the literature.  The objective of this application is t conduct a multi-center, cluster-randomized study utilizing a centralized CVRS in medical offices with large geographic, racial and ethnic diversity to determine the extent to which the CVRS model will be implemented. We will randomize 16 primary care offices to the CVRS or usual care and enroll 400 subjects of which 220 subjects will be from racial minorities. We will also select 25 patients per office (n=400, total n=800) into a passive observation group which will allow us to determine the extent to which the intervention diffuses more broadly for unexposed patients. Our central hypothesis is that a centralized CVRS managed by clinical pharmacists will be implemented and significantly improve CVD guideline adherence using the Guideline Advantage metrics. The rationale for this proposed study is that implementation of a novel strategy to improve secondary prevention of CVD will lead to innovative strategies for broader adoption by health systems throughout the US. We will accomplish our objectives and test our central hypothesis with the following specific aims:  Our primary Aim is: To determine if a web-based CVRS managed by clinical pharmacists will be implemented within diverse primary care offices. We postulate that adherence to guidelines for secondary prevention of CVD will be significantly greater in patients from clinics randomized to the centralized CVRS group compared to the control group.  This study is expected to produce the following outcomes: guideline adherence will be 40% at baseline and increase to at least 60% in the intervention group at 12 months. We expect guideline adherence will deteriorate after the intervention is discontinued but will remain significantly higher than the control group."
"9645778","PROJECT SUMMARY (See instructions): The Basic Science Core (BSC; Core D) will enhance basic and laboratory-based HIV/AIDS research by CFAR members, by providing access to cutting-edge instrumentation and technologies, and the necessary support, education and training to enable efficient use of these resources. The services provided by Core D will create added value by addressing resource gaps on campus, and by providing CFAR SWG members with access to enhanced services for chemical biology and drug development. Over the funding period of our D-CFAR, Core D has been highly successful in leveraging new equipment valued at over $2M (a 18:1 ROI), and in helping to create a new strategic partnership between UR and Temple University's Moulder Center for Drug Discovery Research. The Core has also developed a highly proactive, user-oriented, approach that has allowed it to serve almost half (42%) of the total DCFAR membership. Building on this solid foundation, five Aims are proposed. Aim 1 will provide cutting-edge tools and standardized reagents for virology, immunology, and molecular biology of HIV-1, including recombinant Tat for our CNS Reservoirs/Aging SWG, and a new FPLC resource for our RNA Biology SWG. Aim 2 will provide expertise and resources for chemical and structural biology, including full-service medicinal chemistry resources and a new pilot program with the Moulder Center, of value to both SWGs. Aim 3 will provide access to next-generation flow cytometry, including imaging- and mass- cytometry. Finally, Aim 4 will provide training and education to promote the use of new tools, and Aim 5 will integrate Core D services with other Cores and institutional resources - thus ensuring comprehensive attention to investigator needs."
"9658153","PROGRAM SUMMARY Crohn's disease (CD) is a debilitating condition with no known cure. The precise cause(s) of CD remain undefined. Increasing evidence suggests that CD may be initiated by a dysregulated innate immune response against unknown antigens in a genetically-susceptible host. The major strengths of this competitive renewal are the unique mouse models of CD-like ileitis, which have been extensively investigated by our group, and the highly synergistic nature of the program. During the last funding period, this Program Project Grant (PPG) has made important discoveries and provided evidence of a key role for innate immunity and NOD2 signaling in the pathogenesis of CD-like experimental ileitis. The objective of this competitive renewal application is to continue our efforts to define the role of innate immunity in CD by using a multidisciplinary approach that takes advantage of the complementary and synergistic expertise of the three PIs and their collaborators, as well as the scientific cores that provide unique services that are otherwise unavailable to PPG investigators. The Program Project will continue to be directed by Dr. Fabio Cominelli and will consist of three projects and three cores. Project 1, headed by Dr. Fabio Cominelli, will extend his focus on NOD1 and RIP2 signaling, and investigate the hypothesis that the interaction(s) between NOD receptors, intestinal dysbiosis and IL-1 play a key role in the pathogenesis of CD-like ileitis. Project 2, headed by Dr. Derek Abbott, will test the hypothesis that aberrant ubiquitination patterns influence the pathogenesis of IBD using CRISPR technologies, retroviral reconstitution experiments, and cutting edge mass spectrometry methodologies. Project 3, headed by Dr. Theresa Pizarro, will study the role of IL-33 and ILCs, and their interactions with the gut microbiome in the pathogenesis of CD-like ileitis. These projects are supported by an Administrative Core, which provides administrative support, monitors scientific progress, and coordinates the enrichment program. The Mouse Congenics Core will centralize production and breeding of mice with experimental CD and the development of congenic substrains for the individual projects. The Germ- free and Gut Microbiome Core will provide germ-free mice, as well as sequencing- and culture-based analysis of the gut microbiota to the individual projects. The long-term goal of this Program Project is to understand key pathogenic mechanisms of innate immunity in experimental CD, which can be immediately translated to the human condition, to aid development of a cure for at least a subgroup of patients with this devastating disease."
"9443637","?    DESCRIPTION (provided by applicant): A variety of cellular processes are commonly subverted to encourage the proliferation of cancer cells, one of which is the unfolded protein response (UPR) that occurs in the endoplasmic reticulum (ER). In normal cells, improperly folded or glycosylated proteins will occasionally accumulate in the ER due to a variety of causes that are common in the tumor milieu (examples include altered glucose levels, redox state, calcium levels, and chemical stressors). The cell activates the UPR to prevent accumulation of unfolded proteins, which eventually leads to proteotoxicity and cell death. Importantly, heightened expression of BiP, an essential chaperone protein in the Endoplasmic Reticulum, is a critical factor for this survival mechanism in a variety of cancers. We have recently discovered a new form of BiP regulation, AMPylation by the protein FicD. We observe that FicD adds an adenosine monophosphate (AMP) molecule to a threonine near the ATP binding site of BiP during normal growth conditions. This modification rapidly disappears under multiple ER stress-inducing conditions. We hypothesize that this reversible modification inhibits the chaperone activity of a portion of cellular BiP, and this inhibition is relieved to increase the amount of acive chaperone during ER stress and promote cell survival. Our plan is to characterize the effect of FicD-mediated AMPylation on BiP and determine if the deAMPylating enzyme is a viable inhibition target. We want to understand the basic machinery and mechanisms involved in this signaling system. These studies will have great impact on the understanding of how this system is corrupted in  cells  with  disrupted  protein  homeostasis  (proteostasis),  such  as  cancer,  diabetes,  prtein  processing disorders and aging."
"9546011","Abstract Maternal aging has dramatic effects on the oocyte quality and competence, and it is well known that mitochondrial function plays important roles in oocyte health. Post-transcriptional gene regulation within the oocyte is also essential for its normal development and function. In somatic cells, mitochondria are key effectors of post-transcriptional gene regulation, where RNA sensors located on the mitochondria react in response to double stranded RNA (dsRNA) to invoke the mitochondrial RNA defense pathway. The role of the mitochondrial defense pathway, which includes RNA-editing and RNA sensing is unknown in the oocyte, even though the oocyte has an abundance of dsRNA within it. Here we provide preliminary data demonstrating an abundance of RNA edits in mouse and human oocytes, the expression of `adenosine deaminase acting on RNA' (ADAR), as well as downstream components of the RNA sensing pathway in mouse and human oocytes. Most importantly, we show that inhibition of ADAR RNA editing in oocytes results in increased accumulation of reactive oxygen species (ROS), thus implicating RNA editing as a regulator of mitochondrial function and possibly oocyte quality. Lastly, data from reproductively old mice indicate that the genes involved in RNA editing (ADAR1) and RNA sensing (p32) are decreased in oocytes, thus potentially leading to aberrant activation of mitochondrial RNA-dependent defense pathway. We propose that oocyte mitochondria are key effectors of the RNA editing and RNA sensing mechanisms within oocytes, under conditions such as aging, hyper-activity of mitochondrial RNA defense may increase ROS accumulation and ultimately impact oocyte quality. The central hypothesis we intend to test in this proposal is that the mitochondrial RNA defense pathway is a critical regulator of oocyte competence/quality. To test the central hypothesis, Specific Aim 1 will identify the specific oocyte RNA edits occurring in three species of mammalian oocytes. Specific Aim 2 will determine the role of ADAR1 and RIG-I/MAVS in the regulation of mitochondrial function in oocytes using state-of-the-art mitochondrial functional assays and assess the impact on oocyte quality/developmental potential. Specific Aim 3 will examine how advanced reproductive age impacts mitochondrial RNA sensing pathways in both mouse and human oocytes. Ultimately, this work may provide a mechanistic link (dsRNA defense pathway) that can explain the known mitochondrial dysfunction associated with oocytes from reproductively old mice and older IVF patients."
