APPLICATION_ID,ACTIVITY,ADMINISTERING_IC,APPLICATION_TYPE,ARRA_FUNDED,AWARD_NOTICE_DATE,BUDGET_START,BUDGET_END,CFDA_CODE,CORE_PROJECT_NUM,ED_INST_TYPE,FOA_NUMBER,FULL_PROJECT_NUM,FUNDING_ICs,FUNDING_MECHANISM,FY,IC_NAME,NIH_SPENDING_CATS,ORG_CITY,ORG_COUNTRY,ORG_DEPT,ORG_DISTRICT,ORG_DUNS,ORG_FIPS,ORG_IPF_CODE,ORG_NAME,ORG_STATE,ORG_ZIPCODE,PHR,PI_IDS,PI_NAMEs,PROGRAM_OFFICER_NAME,PROJECT_START,PROJECT_END,PROJECT_TERMS,PROJECT_TITLE,SERIAL_NUMBER,STUDY_SECTION,STUDY_SECTION_NAME,SUBPROJECT_ID,SUFFIX,SUPPORT_YEAR,DIRECT_COST_AMT,INDIRECT_COST_AMT,TOTAL_COST,TOTAL_COST_SUB_PROJECT
9421290,R01,AI,1,N,11/16/2017,11/16/2017,10/31/2018,855,R01AI134693,SCHOOLS OF MEDICINE,PA-16-160,1R01AI134693-01,NIAID:371250\,Non-SBIR/STTR RPGs,2018,NATIONAL INSTITUTE OF ALLERGY AND INFECTIOUS DISEASES,,BIRMINGHAM,UNITED STATES,BIOCHEMISTRY,7,63690705,US,1288803,UNIVERSITY OF ALABAMA AT BIRMINGHAM,AL,352940001,The influenza non-structural protein 1 (NS1) is a remarkably multi-functional protein capable of modulating virulence through a number of interactions with host cell proteins. The overall goal of this study is to identify the structural and molecular mechanisms that underlie these significant interactions. This proposed research is relevant to public health because its successful completion will increase our understanding of the determinants of influenza virulence and inform ongoing and future studies aimed at developing antivirals that inhibit influenza replication.,8822588; ,"PETIT, CHAD ;","HAUGUEL, TERESA M",11/16/2017,10/31/2022,Affect; Allosteric Regulation; Amino Acids; Animals; anti-influenza; Antiviral Agents; Antiviral Response; Automobile Driving; base; Binding; Cells; Cleavage And Polyadenylation Specificity Factor; Crystallization; Data; Development; Disease; Drug Design; Drug Targeting; Epidemic; experimental study; Future; Genes; Genetic; Goals; Health; Human; Immune; Immune response; Impairment; Infection; Influenza; influenza virulence; influenza virus strain; influenzavirus; inhibitor/antagonist; Innate Immune Response; innovation; Interferon-beta; Interferons; Investigation; Knowledge; Measures; millisecond; Mission; Molecular; Morbidity - disease rate; mortality; Motion; mutant; NMR Spectroscopy; novel; nucleocytoplasmic transport; pandemic disease; pathogen; Pathogenicity; Play; Production; Property; Protein Dynamics; Proteins; Public Health; Recombinants; Relaxation; Research; resistant strain; Resolution; response; RNA Recognition Motif; Role; Sampling; Signal Transduction; small molecule; Structural Models; Structure; Structure-Activity Relationship; Testing; Tretinoin; United States National Institutes of Health; Variant; Viral; Virulence; Virus Replication; ,Strain Dependent Structure and Function of the Influenza NS1 Protein,134693,VIRA,Virology - A Study Section ,,,1,250000,121250,371250,
9478515,U18,FD,1,N,8/1/2017,8/5/2017,8/31/2018,103,U18FD006200,,RFA-FD-17-005,1U18FD006200-01,FDA:334418\,OTHER RESEARCH-RELATED,2017,FOOD AND DRUG ADMINISTRATION,,JUNEAU,UNITED STATES,,0,809386857,US,10006613,ALASKA STATE DEPT/ENVIRONMTL CONSERVATN,AK,998111800,"Narrative This project serves to develop and maintain evidence-based best practices that will improve, enhance, and sustain Alaska's capacity to prevent, detect, and respond to foodborne illnesses, and will also provide FDA with the foundation to pursue regulatory action based on inspections conducted in Alaska. RFA-FD-17-005 Alaska Narrative",10460575; ,"STRYKER, KIMBERLY ;",,8/5/2017,8/31/2018,,Alaska FSS Conformance with the Manufactured Food Regulatory Program Standards,6200,ZFD1,Special Emphasis Panel ,,,1,,,334418,
9553015,R01,AI,7,N,11/15/2017,10/26/2017,4/30/2018,855,R01AI097187,UNIVERSITY-WIDE,PA-11-260,7R01AI097187-06,NIAID:387500\,Non-SBIR/STTR RPGs,2018,NATIONAL INSTITUTE OF ALLERGY AND INFECTIOUS DISEASES,,COLUMBIA,UNITED STATES,NONE,4,153890272,US,578002,UNIVERSITY OF MISSOURI-COLUMBIA,MO,652110001,"PUBLIC HEALTH RELEVANCE: Recognition of antigen causes the CD3 complex to undergo a conformational change that can enhance T cell immune activity. We will characterize the precise protein sequences that control this CD3 rearrangement, and establish the level of impact it imparts to T cell immune function. Furthermore, a new means of exogenously inducing this CD3 conformational change will be evaluated for its ability to enhance T cell immunity against tumors.",8970136; ,"GIL PAGES, DIANA ;","RAMACHANDRA, LAKSHMI",5/21/2013,4/30/2018,adaptive immunity; Adjuvant; Adopted; Amino Acid Sequence; Amino Acids; Antibodies; Antigens; arm; Basic Amino Acids; Binding Sites; Biochemical; CD3 Antigens; CD8-Positive T-Lymphocytes; Cell physiology; Chimerism; Chronic; Clonal Expansion; Communication; Complex; Comprehension; crosslink; Cytoplasmic Protein; Data; design; Disease; Elements; Event; experimental study; Fab Immunoglobulins; Immune; immune function; Immune response; Immunity; improved; In Vitro; in vivo; Infection; interest; Ligands; Lipids; Mature T-Lymphocyte; Mediating; MHC antigen; Modeling; Molecular; Molecular Biology; Molecular Conformation; Molecular Target; Mono-S; Morbidity - disease rate; Multiprotein Complexes; Mus; Mutate; novel; oligomycin sensitivity-conferring protein; Peptide/MHC Complex; Proline; protein protein interaction; public health relevance; Reagent; receptor; Recruitment Activity; Regulation; SH3 Domains; Signal Transduction; Site-Directed Mutagenesis; src-Family Kinases; Stretching; Structure; syk Family Tyrosine Kinase; T cell response; T-Cell Activation; T-Cell Development; T-Cell Receptor; T-Lymphocyte; Testing; Therapeutic; therapeutic target; Thymus Gland; Tissues; tumor; Tumor Burden; virtual; Work; ,Mechanisms and consequences of CD3 rearrangement during TCR triggering,97187,CMIB,Cellular and Molecular Immunology - B Study Section ,,,6,250000,137500,387500,
9597949,P01,HD,5,N,11/17/2017,8/1/2017,7/31/2018,,P01HD022486,,PAR-10-245,5P01HD022486-30,NICHD:54956\,Non-SBIR/STTR RPGs,2017,EUNICE KENNEDY SHRIVER NATIONAL INSTITUTE OF CHILD HEALTH & HUMAN DEVELOPMENT,,EUGENE,UNITED STATES,,4,079289626; 948117312,US,6297005,UNIVERSITY OF OREGON,OR,974035219,,1893235; ,"WESTERFIELD, MONTE ;","HENKEN, DEBORAH B",2/1/1987,7/31/2018,,A zebrafish model of phenotypic variation associated with Usher syndrome,22486,ZHD1,Special Emphasis Panel ,7696,,30,37900,17056,,54956
9597953,P01,HD,5,N,11/17/2017,8/1/2017,7/31/2018,,P01HD022486,,PAR-10-245,5P01HD022486-30,NICHD:348153\,Non-SBIR/STTR RPGs,2017,EUNICE KENNEDY SHRIVER NATIONAL INSTITUTE OF CHILD HEALTH & HUMAN DEVELOPMENT,,EUGENE,UNITED STATES,,4,079289626; 948117312,US,6297005,UNIVERSITY OF OREGON,OR,974035219,,1896061; ,"EISEN, JUDITH S;","HENKEN, DEBORAH B",2/1/1987,7/31/2018,,CORE D ZEBRAFISH FACILITY,22486,ZHD1,Special Emphasis Panel ,7700,,30,240105,108048,,348153
9113059,U01,HD,4,N,7/11/2016,7/1/2016,6/30/2017,865,U01HD076508,,RFA-HD-12-185,4U01HD076508-05,NICHD:240876\,Non-SBIR/STTR RPGs,2016,EUNICE KENNEDY SHRIVER NATIONAL INSTITUTE OF CHILD HEALTH & HUMAN DEVELOPMENT,Biotechnology; Contraception/Reproduction; Genetics; Prevention; ,BOSTON,UNITED STATES,,7,76580745,US,1464901,DANA-FARBER CANCER INST,MA,22155450,"RELEVANCE (See instrudions):  The proposed research will convincingly advance basic scientific knowledge and is poised to contribute  significantly to public health through the creation of novel male contraceptives that are potent and selective  inhibitors of the male germ cell specific protein BRDT. Our data is the first to identify a drug that functions as  a reversible contraceptive through its actions on the male germline. This research will also nucleate an  interdisciplinary team of scientific investigators with complimentary expertise in chemistry, biochemistry, cell  biology, developmental biology and fertility toward the common goal of developing a male contraceptive pill.",11195659; ,"QI, JUN ;","KAUFMAN, STEVEN",9/26/2012,6/30/2017,Antineoplastic Agents; base; Binding; Binding Proteins; Bioavailable; Biochemical; Biochemistry; Biological; Biological Assay; Biology; Bromodomain; cell motility; Cellular biology; Characteristics; Chemicals; Chemistry; Chromatin; Cleaved cell; Clinical; clinical investigation; Clinical Trials; Cloud Computing; comparative; Complex; contraceptive target; Data; Dependency; Development; Developmental Biology; DNA Modification Methylases; Dose; drug development; Epigenetic Process; Exhibits; Family; Fertility; Genes; genetic regulatory protein; Germ Cells; Goals; Hematologic Neoplasms; high throughput screening; Human; In Vitro; in vivo; inhibitor/antagonist; insight; Institutes; Investigation; Knowledge; Laboratories; Lead; Libraries; Ligands; Lysine; male; Male Contraceptive Agents; Malignant Neoplasms; Medicine; meetings; Meiosis; mimetics; miniaturize; Modeling; molecular recognition; Mus; novel; Peptides; Pharmaceutical Preparations; Pharmacologic Substance; pharmacophore; pill; Property; Proteins; prototype; Public Health; Reader; Reproductive Biology; Research; Research Personnel; research study; Research Support; reversible contraceptive; Rodent; scaffold; screening; Series; Shapes; sharing data; Site; small molecule; Sperm Count Procedure; Spermatocytes; Spermatogenesis; Spermatogenic Cell; Spermiogenesis; Structure; Surface; Technology; Testing; Therapeutic; Therapeutic Agents; therapeutic target; Time; tool; translational study; Translations; Validation; Work; ,Selective inhibition of BRDT for male contraception,76508,ZHD1,Special Emphasis Panel ,,,5,174719,66157,240876,
9393775,F31,GM,1,N,7/11/2017,8/1/2017,7/31/2018,859,F31GM125106,GRADUATE SCHOOLS,PA-16-309,1F31GM125106-01,NIGMS:36383\,"TRAINING, INDIVIDUAL",2017,NATIONAL INSTITUTE OF GENERAL MEDICAL SCIENCES,,DAVIS,UNITED STATES,MICROBIOLOGY/IMMUN/VIROLOGY,3,47120084,US,577503,UNIVERSITY OF CALIFORNIA AT DAVIS,CA,956186153,"Project Narrative  Defects in homologous recombination repair during meiosis are associated with infertility, pregnancy miscarriage, and congenital disorders. The proposed research seeks to fill a critical gap in knowledge by characterizing the intermediate DNA synthesis steps of meiotic recombination. Understanding these intermediate steps will improve our understanding of this fundamental process and how it goes awry in human disease. !",14162217; ,"OWENS, SHANNON NICOLE;","SLEDJESKI, DARREN D",8/1/2017,7/31/2019,Address; Alleles; analog; Area; Auxins; Biological Assay; Biology; Cell Culture Techniques; Cell Survival; Cells; Chemicals; Chromosome Pairing; chromosome replication; Chromosome Segregation; Chromosomes; Congenital Disorders; Copying Processes; Coupling; Critical Thinking; Cytology; Defect; Disease; DNA; DNA biosynthesis; DNA Double Strand Break; DNA Replication Factor; DNA Sequence; Event; experimental study; Genetic; Genetic Crossing Over; Genetic Recombination; Germ Cells; Haploidy; Homologous Gene; homologous recombination; Human; human disease; hydroxyurea; Immunofluorescence Immunologic; improved; in vivo; Infertility; Joints; Knowledge; Link; Maintenance; Mediating; Meiosis; Meiotic Prophase I; Meiotic Recombination; Metabolism; Molecular; Monitor; Mutation Analysis; Nature; novel; Nucleotides; Optic Chiasm; Phosphotransferases; Play; Ploidies; Pregnancy; Process; Prophase; Public Speaking; recombinational repair; repaired; Reproduction; Reproduction spores; Research; Role; S Phase; Saccharomyces cerevisiae; Saccharomycetales; segregation; Single-Stranded DNA; skills; Southern Blotting; Spontaneous abortion; System; Testing; Time; time use; tool; Training; Writing; Yeasts; ,"The Nature, Function and Mechanism of Recombination-Associated DNA Synthesis During Meiosis",125106,ZRG1,Special Emphasis Panel ,,,1,36383,,36383,
9394537,F32,AG,1,N,7/1/2017,9/1/2017,8/31/2018,866,F32AG054032,SCHOOLS OF ARTS AND SCIENCES,PA-16-307,1F32AG054032-01A1,NIA:56694\,"TRAINING, INDIVIDUAL",2017,NATIONAL INSTITUTE ON AGING,,PHILADELPHIA,UNITED STATES,PSYCHOLOGY,2,42250712,US,6463801,UNIVERSITY OF PENNSYLVANIA,PA,191046205,"Project Narrative Temporal discounting, the tendency to overvalue immediate rewards relative to delayed rewards, is associated with poor economic and health outcomes (e.g., obesity, addiction, debt). This research examines the relationship between behavioral and neural correlates of episodic memory and temporal discounting, by taking advantage of the variability in episodic memory decline observed in older adults. This work also investigates the effects of preclinical Alzheimer's disease pathology on temporal discounting, and tests a manipulation that might increase patience among adults of all ages.",14318472; ,"LEMPERT, KAROLINA M;","NIELSEN, LISBETH",9/1/2017,8/31/2020,addiction; Address; Adult; Adult Acute Lymphocytic Leukemia; Age; age related; Aging; Alzheimer's Disease; Alzheimer's Disease Core Center; Amyloid; Behavior; Behavioral; Cerebrum; Child; Cognitive; cognitive neuroscience; cohort; Consequentialism; Data Set; Databases; Decision Making; density; diet and exercise; Diffusion Magnetic Resonance Imaging; discount; discounting; Disease; Economics; Elderly; Emotions; Episodic memory; episodic memory impairment; Event; Exercise; experimental study; Fostering; functional decline; functional disability; Functional Magnetic Resonance Imaging; Future; gray matter; Health; Heterogeneity; High Prevalence; Image; Impaired cognition; Impairment; Individual; Intervention; Interview; Laboratories; Life; Literature; Magnetic Resonance Imaging; Measures; Medial; Mediating; Memory; Memory Loss; memory process; memory recall; memory retrieval; mental function; middle age; neural correlate; Neurodegenerative Disorders; neuroeconomics; neuroimaging; neuromechanism; Neurosciences Research; novel; Obesity; Outcome; Participant; Pathologic; Pathology; Patients; Pharmaceutical Preparations; Play; Population; Positioning Attribute; Positron-Emission Tomography; pre-clinical; preference; Prefrontal Cortex; prevent; Process; psychologic; Psychologist; relating to nervous system; Research; Resolution; Retirement; Retrieval; Rewards; Role; Running; Sampling; Societies; Structure; Supervision; System; Temporal Lobe; Testing; Time; Tissues; Training; Vision; white matter; Work; ,Contributions of episodic memory to intertemporal decision-making across adulthood,54032,ZRG1,Special Emphasis Panel ,,A1,1,56694,,56694,
9397918,I01,VA,1,N,11/15/2017,10/1/2017,9/30/2018,999,I01HX002334,,RFA-HX-17-001,1I01HX002334-01A1,,Non-SBIR/STTR RPGs,2018,Veterans Affairs,,PALO ALTO,UNITED STATES,,18,46017455,US,481014,VETERANS ADMIN PALO ALTO HEALTH CARE SYS,CA,943041207,"While a Medicare demonstration has shown that a program like VA Home-Based Primary Care (HBPC) is an effective and cost-saving intervention, HBPC has been limited in size and currently serves a small fraction of the Veterans who could benefit from this innovative program. This project will use VA and Medicare data to examine whether HBPC improves outcomes, keeps veterans out of nursing homes and reduces total VA spending on the cohort of Veterans who meet the equivalent Medicare Independence At Home criteria for admission. Since HBPC provides care to Veterans not meeting the Medicare criteria, and since there are many variations of the program, this project will examine the effectiveness of variants of the program in other groups of Veterans. Finally, the project will develop a tool that program managers can use to identify Veterans who could benefit from HBPC to allow effective targeting of program resources.",2234035; ,"PHIBBS, CIARAN S.;",,10/1/2017,9/30/2020,Admission activity; Affect; base; beneficiary; Caring; Clinical; cohort; comparison group; Control Groups; cost; cost effective; Cost Savings; Data; Diagnosis; Economics; Effectiveness; Eligibility Determination; Emergency Care; Enrollment; Evaluation; Expenditure; Frail Elderly; frailty; functional status; Geriatrics; Goals; Government; group intervention; Health; Health Care Costs; health service use; Healthcare; Home environment; Hospitalization; improved outcome; indexing; innovation; Institutionalization; Intervention; Leadership; Long-Term Care; Measures; Medicaid; Medicare; Medicare/Medicaid; Methods; Needs Assessment; Nursing Homes; older patient; operation; Outcome; Patients; Policies; Prevalence; Primary Health Care; programs; Provider; Qualifying; relative effectiveness; Resources; Risk; routine care; Savings; service utilization; Services; Subgroup; Testing; Time; tool; Variant; Veterans; ,Does VA Home-Based Primary Care Reduce Costs Among Veterans Eligible for Independence at Home?,2334,HSR6,Blank ,,A1,1,,,,
9468899,F31,AG,1,N,9/15/2017,9/15/2017,9/14/2018,866,F31AG057205,SCHOOLS OF ARTS AND SCIENCES,PA-16-309,1F31AG057205-01A1,NIA:35386\,"TRAINING, INDIVIDUAL",2017,NATIONAL INSTITUTE ON AGING,,ANN ARBOR,UNITED STATES,PSYCHOLOGY,12,73133571,US,1506502,UNIVERSITY OF MICHIGAN,MI,481091276,"PROECT NARRATIVE (Public Health Relevance) Tens of millions of people experience age-related deficits in sensorimotor function, even in the absence of significant disease. In previous work, we found that neural activation patterns in response to different visual stimuli or motor actions become less distinctive with age, but this issue has not been studied in the somatosensory system. In this project, we propose to investigate the neural and behavioral consequences of age-related dedifferentiation in the somatosensory system. The findings from this study could lead to the development of targeted interventions to prolong functional independence for older adults.",14804313; ,"CASSADY, KAITLIN ELIZABETH;","ST HILLAIRE-CLARKE, CORYSE",9/15/2017,9/14/2019,Adult; Affect; Age; age effect; age related; Aging; aging brain; Behavior; behavior measurement; Behavioral; behavioral impairment; Bilateral; Brain; Cutaneous; design; Detection; Development; Disease; Elderly; Etiology; Exhibits; experience; Fingers; Functional Magnetic Resonance Imaging; Goals; Hand; Impairment; improved; Individual Differences; insight; Intervention; Ipsilateral; Lead; Left; Link; Liquid substance; Manuals; Measures; mental state; Methods; Modality; Motor; neuromechanism; normal aging; novel; Participant; Pattern; Performance; Peripheral; processing speed; public health relevance; Recruitment Activity; relating to nervous system; repetitive transcranial magnetic stimulation; Reporting; Research; response; Scanning; Sensorimotor functions; sensorimotor system; somatosensory; Somatosensory Cortex; System; Tactile; Testing; Tissues; Visual; visual motor; visual stimulus; Work; young adult; ,Somatosensory Dedifferentiation in the Aging Brain,57205,ZRG1,Special Emphasis Panel ,,A1,1,35386,,35386,
9544604,R01,NS,7,N,11/14/2017,9/1/2017,2/28/2018,853,R01NS087913,SCHOOLS OF MEDICINE,PA-16-285,7R01NS087913-05,NINDS:146303\,Non-SBIR/STTR RPGs,2017,NATIONAL INSTITUTE OF NEUROLOGICAL DISORDERS AND STROKE,,LA JOLLA,UNITED STATES,INTERNAL MEDICINE/MEDICINE,49,804355790,US,577507,UNIVERSITY OF CALIFORNIA SAN DIEGO,CA,920930934,"PUBLIC HEALTH RELEVANCE: Glioblastomas are deadly cancers that are resistant to currently used therapies supporting the urgent need for new treatments. Glioblastomas, like many cancers, contain cells that share similarities with normal stem cells and display resistance to radiation and chemotherapy supporting the concept of these so called cancer stem cells as possible targets. We are investigating the role of cellular metabolism in the growth and resistance of glioblastoma cancer stem cells.",8659670; 2205309 (contact); ,"NAKANO, ICHIRO ; RICH, JEREMY N (contact);","FOUNTAIN, JANE W",9/1/2017,2/28/2019,aerobic glycolysis; Affinity; aldehyde dehydrogenases; angiogenesis; Attenuated; Blood flow; Brain; brain metabolism; cancer stem cell; cancer type; Carbon; Cell Differentiation process; Cell Maintenance; Cell Proliferation; Cell Survival; Cells; Cellular Metabolic Process; chemotherapy; Clinical; clinical practice; Clonal Evolution; conventional therapy; Energy-Generating Resources; Evolution; Failure; Genetic; Genetic Transcription; Glioblastoma; Glioma; Glucose; glucose metabolism; Glucose Transporter; glucose uptake; Glycolysis; Goals; Growth; Heterogeneity; Hypoxia; Hypoxia Inducible Factor; Impairment; Inter-tumoral heterogeneity; Isocitrate Dehydrogenase; Laboratories; Link; Maintenance; Malignant - descriptor; Malignant Neoplasms; Mediating; Mesenchymal; Mesenchymal Cell Neoplasm; Metabolic; Metabolism; Modeling; Molecular; Molecular Profiling; mRNA Differential Displays; Mutation; Nature; Neurons; Normal tissue morphology; novel strategies; Nutrient; Organ; Oxygen; Pharmacology; Phenotype; pre-clinical; Primary Brain Neoplasms; Production; Property; public health relevance; Radiation; Radiation therapy; Radiation Tolerance; Reporting; Research; Residual state; Resistance; Resources; Role; self-renewal; stem; Stem cells; Stress; targeted treatment; Testing; theories; therapeutic evaluation; therapeutic target; therapy resistant; transcription factor; Translations; tumor; tumor growth; tumor heterogeneity; tumor metabolism; tumor microenvironment; tumorigenic; Tumorigenicity; Warburg Effect; ,Metabolism Informs Intertumoral & Intratumoral Heterogeneity,87913,ZRG1,Special Emphasis Panel ,,,5,110094,36209,146303,
9551825,R01,GM,7,N,11/13/2017,9/1/2017,12/31/2017,859,R01GM104184,BIOMED ENGR/COL ENGR/ENGR STA,PA-11-260,7R01GM104184-05,NIGMS:171353\,Non-SBIR/STTR RPGs,2017,NATIONAL INSTITUTE OF GENERAL MEDICAL SCIENCES,,CLEMSON,UNITED STATES,ENGINEERING (ALL TYPES),3,42629816,US,1626401,CLEMSON UNIVERSITY,SC,296340001,"PUBLIC HEALTH RELEVANCE: Cancer cells within a tumor are typically very different from one another, and we cannot generally predict whether individual cells will be sensitive or resistant to treatment. This proposal entails a combination of experimental and mathematical modeling methods to understand how one might predict whether individual cells will proliferate or not in response to a treatment. The ability to predict stochastic fates of individual cells in response to treatment can help catalyze the improvement of current and the proposal of new cancer treatment strategies.",8242208; ,"BIRTWISTLE, MARC R;","RESAT, HALUK",2/15/2014,12/31/2018,Acinus organ component; Antineoplastic Agents; Automobile Driving; base; Biochemical; Biological Markers; cancer cell; cancer genetics; cancer therapy; Cell Culture Techniques; Cell Line; Cell Proliferation; Cells; Cessation of life; chemical kinetics; chemical reaction; Computer Simulation; Consensus; Data; Databases; design; Differential Equation; Disease model; Drug resistance; Epidermal Growth Factor; Experimental Models; experimental study; Fluorescence Resonance Energy Transfer; Genetic Drift; Genetic Heterogeneity; Goals; Growth; Heterogeneity; Hydrocortisone; imaging approach; in vivo; Individual; individual patient; inhibitor/antagonist; Insulin; Investigation; Kinetics; Libraries; Life; Link; live cell imaging; Mammalian Cell; MAPK8 gene; mathematical model; MCF10A cells; Measures; Mediating; Methods; Mining; Modeling; Molecular; Noise; Pathway interactions; Pattern; personalized therapeutic; Pharmaceutical Preparations; Phenotype; Play; Process; Proliferating; protein expression; Proteins; public health relevance; Resistance; response; Role; Signal Transduction; Stimulus; Structure; System; Techniques; Testing; theories; three dimensional cell culture; Time; Training; Treatment Efficacy; treatment response; treatment strategy; tumor; tumor progression; Variant; Work; Writing; ,Predicting the Heterogeneity of Cell-Fate Decisions,104184,BDMA,Biodata Management and Analysis Study Section ,,,5,112764,58589,171353,
