"APPLICATION_ID","ACTIVITY","ADMINISTERING_IC","APPLICATION_TYPE","ARRA_FUNDED","AWARD_NOTICE_DATE","BUDGET_START","BUDGET_END","CFDA_CODE","CORE_PROJECT_NUM","ED_INST_TYPE","FOA_NUMBER","FULL_PROJECT_NUM","FUNDING_ICs","FUNDING_MECHANISM","FY","IC_NAME","NIH_SPENDING_CATS","ORG_CITY","ORG_COUNTRY","ORG_DEPT","ORG_DISTRICT","ORG_DUNS","ORG_FIPS","ORG_IPF_CODE","ORG_NAME","ORG_STATE","ORG_ZIPCODE","PHR","PI_IDS","PI_NAMEs","PROGRAM_OFFICER_NAME","PROJECT_START","PROJECT_END","PROJECT_TERMS","PROJECT_TITLE","SERIAL_NUMBER","STUDY_SECTION","STUDY_SECTION_NAME","SUBPROJECT_ID","SUFFIX","SUPPORT_YEAR","DIRECT_COST_AMT","INDIRECT_COST_AMT","TOTAL_COST","TOTAL_COST_SUB_PROJECT"
"9393989","P30","DK","5","N","12/20/2017","12/01/2017","11/30/2018","","P30DK042086","","RFA-DK-14-012","5P30DK042086-28","NIDDK:158951\","RESEARCH CENTERS","2018","NATIONAL INSTITUTE OF DIABETES AND DIGESTIVE AND KIDNEY DISEASES","","CHICAGO","UNITED STATES","","01","005421136","US","1413601","UNIVERSITY OF CHICAGO","IL","606372612","","6262993; ","JABRI, BANA ;","","","","Address; base; Basic Science; Behavior; Biological Models; Biopsy; Biopsy Specimen; Celiac Disease; Cell Line; Cells; Chicago; Clinical; Clinical Data; Clinical Investigator; Clinical Trials; Computerized Medical Record; Consultations; cost effectiveness; Data; data acquisition; Data Analyses; Databases; Digestive System Disorders; Disease; DNA; efficacy study; Ensure; epidemiologic data; Epidemiology; Epigenetic Process; Epithelial Cells; Experimental Designs; experimental study; Flow Cytometry; Foundations; Freezing; Functional disorder; Future; gastrointestinal function; Gastrointestinal tract structure; Generations; Genetic; Goals; Human; human disease; human study; Immune; Immune system; Immunology; Institutional Review Boards; Intestines; meetings; member; microbial; Microbiology; microbiota; Monitor; Mucositis; Outcome; Pathogenesis; Patient Recruitments; patient/disease registry; Patients; Phenotype; phenotypic data; Physiology; Procedures; Process; Reagent; Recruitment Activity; Registries; repository; Research; Research Design; Research Infrastructure; Research Personnel; Resources; RNA; Sampling; Serum; Services; Source; Statistical Data Interpretation; T-Lymphocyte; Technical Expertise; therapeutic development; Tissues; Translational Research; translational study; Treatment Efficacy; Universities; virtual; Whole Blood; Work; ","Integrated Translational Research Core","042086","ZDK1","Special Emphasis Panel ","7435","","28","100602","58349","","158951"
"9393993","P30","DK","5","N","12/20/2017","12/01/2017","11/30/2018","","P30DK042086","","RFA-DK-14-012","5P30DK042086-28","NIDDK:175078\","RESEARCH CENTERS","2018","NATIONAL INSTITUTE OF DIABETES AND DIGESTIVE AND KIDNEY DISEASES","","CHICAGO","UNITED STATES","","01","005421136","US","1413601","UNIVERSITY OF CHICAGO","IL","606372612","","1858734; ","CHANG, EUGENE ;","","","","Achievement; Applications Grants; Area; Award; base; Biological; Categories; Chicago; Climate; Collaborations; Data; design; Development; Digestive System Disorders; Extramural Activities; Feasibility Studies; Fostering; Funding; Gastroenterology; Gastrointestinal tract structure; Grant; Hepatology; Homeostasis; Human Genetics; Immunology; improved; Inflammatory disease of the intestine; innovation; Interdisciplinary Study; Investigation; Investments; Laboratories; Maintenance; Marines; Medicine; Microbiology; Mucositis; multidisciplinary; National Institute of Diabetes and Digestive and Kidney Diseases; Nature; nutrition; Operative Surgical Procedures; Pathology; Pediatrics; Pilot Projects; programs; Research; Research Personnel; Research Project Grants; Research Support; Scholarship; Secure; Talents; Testing; United States National Institutes of Health; Universities; ","PilotandFeasibility-001","042086","ZDK1","Special Emphasis Panel ","5975","","28","110809","64269","","175078"
"9394004","R01","DK","5","N","12/20/2017","12/01/2017","11/30/2018","847","R01DK104814","","PAS-13-031","5R01DK104814-03","NIDDK:447045\","Non-SBIR/STTR RPGs","2018","NATIONAL INSTITUTE OF DIABETES AND DIGESTIVE AND KIDNEY DISEASES","","CINCINNATI","UNITED STATES","","01","071284913","US","615001","CINCINNATI CHILDRENS HOSP MED CTR","OH","452293039","PUBLIC HEALTH RELEVANCE: To maintain physiologic homeostasis, hematopoietic stem cells (HSCs) can undergo an asymmetric cell division whereby they segregate cell fate determinants into different daughter cells, generating multi-lineages of blood cells. Our current work will provide mechanistic insights into the relationship between HSC polarity and division symmetry, and implicate a central signal regulator, Cdc42, in coordinating these two important biological processes. Such understanding of polarity and cell fate of HSCs may lead to translational applications benefiting future stem cell therapy.","1898249; ","ZHENG, YI ;","BISHOP, TERRY ROGERS","12/15/2015","11/30/2019","Actins; Actomyosin; Affect; Aging; Aging-Related Process; Biological Assay; Biological Process; Biology; Blood; Blood Cells; Bone Marrow; Bone Marrow Transplantation; cdc42 GTP-Binding Protein; Cell division; Cell Lineage; Cell Maintenance; Cell Nucleus; Cell Polarity; Cell Transplants; Cells; Chemicals; chemotherapy; Clinical; CSNK1A1 gene; Cues; Data; daughter cell; epigenetic marker; Equilibrium; Future; Genetic; genetic regulatory protein; Guanosine Triphosphate; Hematological Disease; Hematopoiesis; hematopoietic stem cell fate; Hematopoietic stem cells; Histones; Homeostasis; Immunofluorescence Immunologic; In Vitro; in vivo; Individual; inhibitor/antagonist; insight; Lead; Life; Link; loss of function; Lysine; Malignant Neoplasms; MAPK14 gene; MAPK8 gene; Mediating; Methodology; Microtubules; Modeling; Molecular; mouse model; Mus; Natural regeneration; Nature; novel; novel marker; Outcome; Pancytopenia; PARD6A gene; Pathway interactions; polarized cell; prevent; Process; Proteins; public health relevance; Recovery; regenerative; Reporter; Reporting; Resolution; rho GTP-Binding Proteins; Role; self-renewal; Series; Signal Pathway; Signal Transduction; stem cell division; stem cell fate; stem cell therapy; Stem cell transplant; Stem cells; System; Terminology; Testing; Therapeutic; Time; Tissues; tool; Triad Acrylic Resin; Tubulin; Ursidae Family; Work; ","Cdc42, hematopoietic stem cell polarity, and cell fate","104814","ZRG1","Special Emphasis Panel ","","","03","286568","160477","447045",""
"9404357","P30","CA","5","N","12/19/2017","12/01/2017","11/30/2018","","P30CA023108","","PAR-13-386","5P30CA023108-39","NCI:238847\","RESEARCH CENTERS","2018","NATIONAL CANCER INSTITUTE","","HANOVER","UNITED STATES","","02","041027822","US","2021601","DARTMOUTH COLLEGE","NH","037551421","","1914006; ","TOSTESON, TOR D;","","","","anticancer research; Area; Award; Bioinformatics Shared Resource; Biometry; Biostatistics Shared Resource; Biotechnology; Cancer Center; Cancer Center Support Grant; Clinical; clinical epidemiology; Clinical Protocols; Clinical Research; Clinical Sciences; Clinical Trials; comparative effectiveness; Computer software; Computer Systems; Cost Effectiveness Analysis; Data; Data Analyses; data management; Data Science; Decision Modeling; design; Development; Diagnostic tests; Educational Activities; effectiveness research; epidemiology study; experience; Faculty; Funding; Future; Genetic; Genomics; Goals; high dimensionality; Image; Informatics; Leadership; Malignant Neoplasms; Manuscripts; Measurement; meetings; member; Methodology; Methods; Monitor; NCI Center for Cancer Research; Norris Cotton Cancer Center; novel; Play; programs; protocol development; Publications; Randomized; Recruitment Activity; Research; Research Activity; Research Design; Research Personnel; Research Proposals; Resource Informatics; Resource Sharing; Resources; Role; Safety; Sample Size; Schedule; software systems; sound; Statistical Methods; Statistical Study; tool; Translational Research; ","Biostatistics (BSR)","023108","NCI","Subcommittee I - Transistion to Independence ","5354","","39","147035","91812","","238847"
"9404359","P30","CA","5","N","12/19/2017","12/01/2017","11/30/2018","","P30CA023108","","PAR-13-386","5P30CA023108-39","NCI:153309\","RESEARCH CENTERS","2018","NATIONAL CANCER INSTITUTE","","HANOVER","UNITED STATES","","02","041027822","US","2021601","DARTMOUTH COLLEGE","NH","037551421","","1865073; ","TOMLINSON, CRAIG R;","","","","Address; base; Budgets; Cancer Center Support Grant; cancer epidemiology; cancer imaging; Cancer Immunology Science; cancer immunotherapy; Cell Separation; Cells; Communication; Communities; Consultations; Data; Data Analyses; data management; Dideoxy Chain Termination DNA Sequencing; DNA; DNA Sequence Alteration; Doctor of Philosophy; Educational workshop; Equipment and supply inventories; exome; experience; Experimental Designs; Future; Generations; genome sequencing; Genomics; Genomics Shared Resource; Genotype; good laboratory practice; improved; instrumentation; Ions; Laboratories; Learning; Lebanon; Libraries; Malignant Neoplasms; meetings; Methods; Methylation; Molecular; Molecular Biology; Molecular Biology Shared Resource; Mutation; nano-string; next generation sequencing; Norris Cotton Cancer Center; Nucleic Acids; Plasma; Procedures; programs; Radiobiology; Research; Research Personnel; Resource Sharing; RNA; Services; Specialist; symposium; targeted sequencing; Technology; technology/technique; Therapeutic; tool; Transcript; tumor; whole genome; ","Genomics and Molecular Biology","023108","NCI","Subcommittee I - Transistion to Independence ","5356","","39","94562","58747","","153309"
"9404362","P30","CA","5","N","12/19/2017","12/01/2017","11/30/2018","","P30CA023108","","PAR-13-386","5P30CA023108-39","NCI:107237\","RESEARCH CENTERS","2018","NATIONAL CANCER INSTITUTE","","HANOVER","UNITED STATES","","02","041027822","US","2021601","DARTMOUTH COLLEGE","NH","037551421","","6789931; ","LEWIS, LIONEL DAVID;","","","","biobank; Biological; Biological Assay; Cancer Center Support Grant; cancer epidemiology; Cancer Immunology Science; cancer immunotherapy; Cells; Clinical; Clinical Chemoprevention; Clinical Oncology; Clinical Pharmacology; Clinical Research; Concentration measurement; Consultations; cost; Data Analyses; design; Detection; Development; DNA; Drug Combinations; Drug Kinetics; Epidemiology; epidemiology study; Faculty; Fluorescence; High Pressure Liquid Chromatography; in vivo; Investigation; Investigational Drugs; Investigational New Drug Application; liquid chromatography mass spectrometry; Liquid substance; Malignant Neoplasms; member; Methodology; model design; Modernization; Molecular; Norris Cotton Cancer Center; novel; oncology; operation; Performance; Peripheral Blood Mononuclear Cell; Pharmaceutical Preparations; Pharmaceutical Services; Pharmacists; pharmacodynamic model; Pharmacodynamics; Pharmacology; Pharmacology Shared Resource; Pharmacy facility; Phase; Plasma; pre-clinical; Pre-Clinical Model; programs; Protocols documentation; Research; Research Assistant; Research Design; Research Methodology; Research Personnel; Saliva; Sampling; Services; Site; Testing; Therapeutic; Tissues; Tumor Tissue; Urine; Viola; ","Clinical Pharmacology (CP)","023108","NCI","Subcommittee I - Transistion to Independence ","5359","","39","66300","40937","","107237"
"9468289","F30","AG","1","N","09/15/2017","12/01/2017","11/30/2018","866","F30AG058317","SCHOOLS OF MEDICINE","PA-16-305","1F30AG058317-01","NIA:49044\","TRAINING, INDIVIDUAL","2017","NATIONAL INSTITUTE ON AGING","","PHILADELPHIA","UNITED STATES","NONE","02","042250712","US","6463801","UNIVERSITY OF PENNSYLVANIA","PA","191046205","Project Narrative We aim to understand the pathogenesis of a novel neurodegenerative disease in a family harboring a previously undescribed mutation. This mutation is associated with cytoplasmic vacuolization of neocortical neurons and Alzheimer?s disease-like tau protein aggregation. This proposal would provide insight on the mechanism of pathogenesis of a novel disease, illustrate how this mutation is uniquely causing tau pathology, and potentially provide additional therapeutic targets for Alzheimer?s disease.","14267619; ","DARWICH, NABIL ;","YANG, AUSTIN JYAN-YU","12/01/2017","11/30/2020","alpha helix; Alzheimer's Disease; Amyotrophic Lateral Sclerosis; analog; ATP phosphohydrolase; ATPase Domain; Binding; Biochemical; Biological Assay; Chromatin; cofactor; Computer Simulation; Disease; DNA-Binding Proteins; Dominant-Negative Mutation; Endoplasmic Reticulum; Exhibits; experimental study; Family; Fluorescence Polarization; Frontotemporal Dementia; gain of function; Genes; Goals; Hydrolysis; Image; In Vitro; Inclusion Bodies; Inherited; insight; Label; Lead; Light; Literature; loss of function; loss of function mutation; member; Membrane Fusion; Missense Mutation; Molecular; multicatalytic endopeptidase complex; mutant; Mutation; Myopathy; N-terminal; neocortical; Neurodegenerative Disorders; Neurons; neuropathology; novel; Osteitis Deformans; Pathogenesis; Pathogenicity; Pathologic; Pathology; Pattern; proband; Property; protein aggregation; Protein Family; protein structure; Proteins; proteostasis; Recombinants; Research; response; Roentgen Rays; Sedimentation process; stressor; Structure; System; tau Proteins; Tauopathies; Techniques; Testing; therapeutic target; trafficking; Transact; Tryptophan; Ubiquitin; Urea; Vacuole; valosin-containing protein; ","Characterization of a Novel Mutation Associated with Vacuolar Tauopathy","058317","ZRG1","Special Emphasis Panel ","","","01","49044","","49044",""
"9469257","F32","AI","1","N","12/21/2017","06/21/2017","","855","F32AI131520","GRADUATE SCHOOLS","PA-16-307","1F32AI131520-01A1","NIAID:57066\","TRAINING, INDIVIDUAL","2018","NATIONAL INSTITUTE OF ALLERGY AND INFECTIOUS DISEASES","","SAN FRANCISCO","UNITED STATES","MICROBIOLOGY/IMMUN/VIROLOGY","12","094878337","US","577508","UNIVERSITY OF CALIFORNIA, SAN FRANCISCO","CA","941186215","PROJECT NARRATIVE Candida albicans is simultaneously the leading fungal pathogen of humans causing a multitude of disease states as well as a ubiquitous commensal of multiple host tissues. This project will determine mechanisms by which this organism thrives as both a benign commensal and pathogen in multiple host environmental niches. These studies will provide a deeper understanding of C. albicans infection processes as well as point to new strategies for therapeutic development.","10202478; ","POWERS, MICHAEL ;","LOVE, DONA","06/21/2017","","Adopted; Adult; Alpha Cell; Animal Model; Animals; Antibiotics; Antifungal Agents; Benign; Blood Circulation; Body Weight decreased; Candida albicans; Candidiasis; Cell Shape; Cell surface; cell type; Cells; Cellular Morphology; Cellulitis; Cessation of life; Clinical; Colony-forming units; comparative; Complex; Cues; cytokine; Data; deletion library; diabetic; Disease; Environment; Epithelial; Esophageal; Esophagitis; Esophagus; Evaluation; Exhibits; fitness; Fungal Drug Resistance; fungus; gastrointestinal; Gastrointestinal tract structure; Genes; Genetic; Genetic Screening; Genetic Transcription; Genitourinary system; Glucocorticoids; Goals; Gray unit of radiation dose; High-Throughput Nucleotide Sequencing; histological image; Histology; HIV; Human; Imagery; Immunocompromised Host; Immunologic Deficiency Syndromes; implantable device; In Vitro; in vivo; in vivo Model; Individual; Infection; Infectious Agent; Injection of therapeutic agent; Injury; innovation; interest; Invaded; Knock-out; Knowledge; Libraries; Maintenance; Measures; Mediating; Mediator of activation protein; Microbe; microbial; microbiome; microscopic imaging; Minimum Inhibitory Concentration measurement; Modeling; Molecular; Monitor; Morphology; mouse model; Mus; mutant; Mycoses; Nature; Neonatal; Newborn Infant; novel therapeutic intervention; Operative Surgical Procedures; Oral; Oral cavity; Organ; Organism; Oropharyngeal; oropharyngeal thrush; pathogen; Pathogenesis; Pathogenicity; Patients; Pattern; Phase; Phenotype; Play; Predisposition; Process; Proliferating; Publishing; Reporting; reproductive; Research; response; Risk; Role; Scanning Electron Microscopy; Sepsis; Septicemia; Skin; Skin Tissue; soft tissue; Symbiosis; Systemic disease; Tail; Testing; therapeutic development; Time; Tissues; Tongue; transcriptome; Validation; Veins; Virulence; Yeasts; ","Understanding C. albicans commensalism and virulence in multiple host environmental niches","131520","ZRG1","Special Emphasis Panel ","","A1","01","57066","","57066",""
"9472969","R44","AI","2","N","12/20/2017","12/20/2017","11/30/2018","855","R44AI109925","","PA-16-302","2R44AI109925-03","NIAID:834285\","SBIR-STTR RPGs","2018","NATIONAL INSTITUTE OF ALLERGY AND INFECTIOUS DISEASES","","MADISON","UNITED STATES","","02","827404208","US","10019525","FLUGEN, INC.","WI","537111084","PROJECT NARRATIVE Seasonal influenza viruses infect 5-20% of the population resulting in between 3,000 and 50,000 deaths and up to 200,000 hospitalizations per year in the US alone. A significant proportion of this morbidity and mortality is caused by influenza B viruses. However, current vaccines are only around 60% effective in normal healthy people, have very low efficacy in vulnerable populations such as the elderly, and provide poor cross-reactive protection against newly emerging strains. There is an urgent need for a highly effective and safe vaccine for influenza B, which we propose can be met by FluGen's new BM2SR vaccine platform.","9553030 (contact); 11291824; ","BILSEL, PAMUK  (contact); SARAWAR, SALLY ;","HAUGUEL, TERESA M","06/15/2014","11/30/2019","aged; Antibody Response; Attenuated; Attenuated Live Virus Vaccine; Award; B-Lymphocytes; base; Categories; CD8B1 gene; Cell Culture Techniques; Cessation of life; Clinical Trials; co-infection; cross reactivity; Data; Development; Disease; efficacy evaluation; Elderly; Ferrets; Flu virus; Grant; Hospitalization; Human; Immunity; immunogenicity; in vivo; Individual; Infection; Influenza; Influenza A virus; Influenza B Virus; influenza epidemic; Influenza virus vaccine; influenzavirus; Mediating; Modeling; Morbidity - disease rate; mortality; mouse model; multiple myeloma M Protein; Mus; Mutation; National Institute of Allergy and Infectious Disease; novel; NP protein; Outcome Study; pandemic influenza; pathogen; Phase; phase 1 study; Phenotype; Population; pre-clinical; programs; protective effect; Proteins; Reporting; Resistance; response; Safety; seasonal influenza; seropositive; Staining method; Stains; stem; T cell response; T-Lymphocyte; Testing; Vaccination; vaccine safety; Vaccines; Viral Antigens; Virulence; Virus; Virus Diseases; Vulnerable Populations; ","Development of a novel highly effective influenza vaccine","109925","ZRG1","Special Emphasis Panel ","","","03","","","834285",""
"9501861","R21","AI","1","N","12/15/2017","12/18/2017","11/30/2018","855","R21AI137118","SCHOOLS OF MEDICINE","PA-16-161","1R21AI137118-01","NIAID:202500\","Non-SBIR/STTR RPGs","2018","NATIONAL INSTITUTE OF ALLERGY AND INFECTIOUS DISEASES","","HANOVER","UNITED STATES","MICROBIOLOGY/IMMUN/VIROLOGY","02","041027822","US","2021601","DARTMOUTH COLLEGE","NH","037551421","Project narrative. This exploratory research project will develop new genetic models to selectively control gene expression in the latent stage of Toxoplasma gondii. These new tools will solve a major gap in the field that has hindered the development of new treatments to treat patients infected by Toxoplasma to reduce damage to the brain and central nervous system of affected individuals.","1891659; ","BZIK, DAVID J;","JOY, DEIRDRE A","12/18/2017","11/30/2019","Acquired Immunodeficiency Syndrome; Acute; Affect; Biological; Biological Process; Biology; Brain; burden of illness; Central Nervous System Diseases; Clinical; Clinical Treatment; Communities; Cyst; Defect; Development; Disabled Persons; Disease; Drug Targeting; Essential Genes; Exhibits; Gene Expression; gene function; Gene Targeting; Genes; Genetic; Genetic Models; HIV Seropositivity; In Vitro; in vivo; Individual; Infection; interest; Intervention; Knowledge; latent infection; Mus; mutant; Neuraxis; Neurocognitive; Neurologic Deficit; Parasites; Patients; prevent; reactivation from latency; Reporting; Research; Research Personnel; Research Project Grants; Risk; Role; System; tool; Toxoplasma; Toxoplasma gondii; Toxoplasmosis; ","Genetic models for latent Toxoplasma gondii infection","137118","ZRG1","Special Emphasis Panel ","","","01","125000","77500","202500",""
"9535701","P30","CA","5","N","12/22/2017","12/01/2017","11/30/2018","","P30CA016520","","PAR-13-386","5P30CA016520-42","NCI:195681\","RESEARCH CENTERS","2018","NATIONAL CANCER INSTITUTE","","PHILADELPHIA","UNITED STATES","","02","042250712","US","6463801","UNIVERSITY OF PENNSYLVANIA","PA","191046205","Not applicable to the CCSG","1932859; ","LIEBHABER, STEPHEN AARON;","MARINO, MICHAEL A","","","Animals; anticancer research; blastocyst; Budgets; Cancer Center; Cancer Center Support Grant; Complement; conditioning; Consultations; Core Facility; Cosmids; CRISPR/Cas technology; Cryopreservation; Derivation procedure; Development; DNA; Embryo; embryonic stem cell; endonuclease; Equipment; experience; Experimental Designs; Fertilization in Vitro; Fingers; Funding; Gene Activation; Gene Expression; Gene Targeting; Generations; Genes; Genetic Medicine; Genetic Recombination; Genetics and Medicine; genome editing; Genomics; Harvest; Herpes zoster disease; improved; Individual; Injection of therapeutic agent; Intracytoplasmic Sperm Injections; Knock-out; Lasers; Leadership; Maintenance; member; Microinjections; Monitor; Mus; Oocytes; Peer Review; professor; programs; Reporting; Research Infrastructure; Research Personnel; Resource Sharing; RNA; Services; Site-Directed Mutagenesis; sperm cell; Technology; Training; Transgenic Mice; Transgenic Organisms; ","Transgenic and Chimeric Mouse Facility","016520","NCI","Subcommittee I - Transistion to Independence ","7995","","42","96505","99176","","195681"
"9535717","P30","CA","5","N","12/22/2017","12/01/2017","11/30/2018","","P30CA016520","","PAR-13-386","5P30CA016520-42","NCI:125952\","RESEARCH CENTERS","2018","NATIONAL CANCER INSTITUTE","","PHILADELPHIA","UNITED STATES","","02","042250712","US","6463801","UNIVERSITY OF PENNSYLVANIA","PA","191046205","Not applicable to the CCSG","6705271; ","ROBERTSON, ERLE S.;","MARINO, MICHAEL A","","","Acquired Immunodeficiency Syndrome; Affinity; AIDS related cancer; Area; Cancer Center Support Grant; Cancer Control; Cell Cycle; Clinical Investigator; Direct Costs; DNA; Doctor of Philosophy; Etiology; experience; Fostering; Funding; gammaherpesvirus; gene therapy; Grant; Herpesviridae; HIV/HCV; Human; Human Herpesvirus 4; Human Herpesvirus 8; Human Papillomavirus; imaging program; immortalized cell; Immunobiology; interest; Leadership; Malignant Neoplasms; Mediating; meetings; member; Merkel Cells; metaplastic cell transformation; Molecular Biology; Oncogenes; Oncogenic Viruses; Paper; Pathogenesis; Peer Review; Polyomavirus; Positioning Attribute; programs; Proteins; Publishing; Radiobiology; receptor function; Recruitment Activity; Research; Research Activity; Research Personnel; Retreatment; Retroviridae; Retrovirology; Role; Schools; Structure; Therapeutic; translational medicine; Translational Research; treatment strategy; tumor; Tumor Biology; tumorigenesis; vaccine development; Vaccines; Viral; Viral Physiology; Viral Vector; virology; Virus; Virus Receptors; ","Tumor Virology Research Program","016520","NCI","Subcommittee I - Transistion to Independence ","4003","","42","26776","99176","","125952"
"9535728","P30","CA","5","N","12/22/2017","12/01/2017","11/30/2018","","P30CA016520","","PAR-13-386","5P30CA016520-42","NCI:151413\","RESEARCH CENTERS","2018","NATIONAL CANCER INSTITUTE","","PHILADELPHIA","UNITED STATES","","02","042250712","US","6463801","UNIVERSITY OF PENNSYLVANIA","PA","191046205","Not applicable to the CCSG","1890313; ","BRODEUR, GARRETT M;","MARINO, MICHAEL A","","","Acute; Adolescent; Adverse effects; anticancer research; Basic Science; Behavioral; Biological; Cancer Center; Cancer Center Support Grant; Cancer Control; cancer genomics; cancer therapy; Cellular biology; Child; Clinical; Clinical Pharmacology; Clinical Research; Collaborations; Conduct Clinical Trials; conventional therapy; design; diagnostic biomarker; drug development; Drug Kinetics; Epidemiology; experience; Funding; Genetic; Goals; Grant; Immunotherapy; improved; improved outcome; Institution; International; Lead; Malignant Childhood Neoplasm; Malignant Neoplasms; medical schools; member; Methods; Mission; neoplasm immunotherapy; novel diagnostics; oncology; oncology program; Outcome Measure; Pathogenesis; Pediatric Oncologist; Pediatric Oncology; Pediatric Research; Pediatrics; Peer Review; Pharmacoepidemiology; professor; programs; psychosocial; Publications; Research; Research Personnel; Research Project Grants; Signal Transduction; survivorship; targeted treatment; Testing; therapeutic target; Time; Toxic effect; Translating; Translational Research; Tumor Antigens; tumor immunology; ","Pediatric Oncology Research Program","016520","NCI","Subcommittee I - Transistion to Independence ","8009","","42","52238","99175","","151413"
