"APPLICATION_ID","ACTIVITY","ADMINISTERING_IC","APPLICATION_TYPE","ARRA_FUNDED","AWARD_NOTICE_DATE","BUDGET_START","BUDGET_END","CFDA_CODE","CORE_PROJECT_NUM","ED_INST_TYPE","FOA_NUMBER","FULL_PROJECT_NUM","FUNDING_ICs","FUNDING_MECHANISM","FY","IC_NAME","NIH_SPENDING_CATS","ORG_CITY","ORG_COUNTRY","ORG_DEPT","ORG_DISTRICT","ORG_DUNS","ORG_FIPS","ORG_IPF_CODE","ORG_NAME","ORG_STATE","ORG_ZIPCODE","PHR","PI_IDS","PI_NAMEs","PROGRAM_OFFICER_NAME","PROJECT_START","PROJECT_END","PROJECT_TERMS","PROJECT_TITLE","SERIAL_NUMBER","STUDY_SECTION","STUDY_SECTION_NAME","SUBPROJECT_ID","SUFFIX","SUPPORT_YEAR","DIRECT_COST_AMT","INDIRECT_COST_AMT","TOTAL_COST","TOTAL_COST_SUB_PROJECT"
"9524069","R01","AI","1","N","12/20/2017","12/20/2017","11/30/2018","855","R01AI131723","BIOMED ENGR/COL ENGR/ENGR STA","PA-16-160","1R01AI131723-01A1","NIAID:443836\","Non-SBIR/STTR RPGs","2018","NATIONAL INSTITUTE OF ALLERGY AND INFECTIOUS DISEASES","","CHARLOTTESVILLE","UNITED STATES","ENGINEERING (ALL TYPES)","05","065391526","US","1526402","UNIVERSITY OF VIRGINIA","VA","229044195","PROJECT NARRATIVE The lymph node functions as the ?brain? of the immune system: cells and molecules are intricately arranged inside and are constantly communicating with their neighbors. The organization of the lymph node is essential to responding to vaccines, fighting tumors, and preventing chronic inflammation and autoimmunity, but there are no systems that let researchers stimulate interesting regions of the intact lymph node on demand. The goal of this research is to create a new experimental model of immunity, using microfluidic culture and stimulation of lymph node tissue samples from mice and humans, so that local events can be used to inform the development of new immunotherapies.","11178331; ","POMPANO, REBECCA R;","MALLIA, CONRAD M","12/20/2017","11/30/2022","Acute; adaptive immunity; Affect; Alzheimer's Disease; Animals; Anti-inflammatory; Anti-Inflammatory Agents; Antigens; Autoimmunity; behavioral response; Biodistribution; Biological Models; Biological Preservation; Biological Process; Biomedical Research; Brain; Buffers; Caliber; Cell Communication; Cell Culture Techniques; cell motility; Cells; Chemistry; Chronic; Clinical; Coupled; cytokine; design; Development; Devices; Disease; Drug Targeting; Event; Experimental Models; experimental study; extracellular; fighting; Gases; Goals; Hour; Human; human tissue; Hybrids; Immune response; Immune system; Immunity; Immunology; Immunotherapy; improved; In Vitro; in vivo; in vivo Model; Infection; Inflammation; Inflammation Mediators; Inflammatory; inflammatory marker; Inflammatory Response; innovation; interest; Label; Lateral; Liquid substance; Location; Lymph Node Tissue; lymph nodes; macromolecule; Malignant Neoplasms; Manuals; Measures; Membrane; Metabolic; Methods; Microfluidics; middle age; Modeling; Movement; Multiple Sclerosis; Mus; nanoparticle; novel; novel therapeutics; Physiologic pulse; Population; prevent; Production; Publishing; Research; Research Personnel; Resolution; response; Response to stimulus physiology; Rest; Rheumatoid Arthritis; Role; Signal Transduction; Signaling Protein; Slice; Stimulus; Stream; Suspensions; System; Systems Analysis; Technology; Testing; therapy design; Time; Tissue Microarray; Tissue Sample; Tissue Slice Technology; Tissues; TNF gene; TNFRSF1A gene; Tonsil; tool; tumor; tumor necrosis factor-alpha inhibitor; Vaccines; Work; young adult; ","Modeling immunity with a hybrid lymph node tissue-chip","131723","EBIT","Enabling Bioanalytical and Imaging Technologies Study Section ","","A1","01","284656","159180","443836",""
"9535716","P30","CA","5","N","12/22/2017","12/01/2017","11/30/2018","","P30CA016520","","PAR-13-386","5P30CA016520-42","NCI:125952\","RESEARCH CENTERS","2018","NATIONAL CANCER INSTITUTE","","PHILADELPHIA","UNITED STATES","","02","042250712","US","6463801","UNIVERSITY OF PENNSYLVANIA","PA","191046205","Not applicable to the CCSG","2052769; ","VONDERHEIDE, ROBERT H.;","MARINO, MICHAEL A","","","Animal Model; Basic Science; Biology; Cancer Center Support Grant; cancer immunotherapy; Clinical; Clinical Trials; Collaborations; design; Development; Direct Costs; Doctor of Philosophy; experience; Funding; Grant; Human; Immune; Immunobiology; Immunologic Surveillance; Immunology; Immunotherapy; In Vitro; interdisciplinary approach; interest; Journals; Leukocytes; Malignant - descriptor; Malignant Neoplasms; meetings; member; Molecular Biology; neoplasm immunotherapy; novel; Pear; Peer Review; Pilot Projects; programs; Publications; Publishing; Recruitment Activity; Research; Research Personnel; Research Project Grants; Resource Sharing; Resources; Retreatment; Schools; System; Time; Training Programs; Translating; Translational Research; tumor; tumor immunology; ","Immunobiology Research Program","016520","NCI","Subcommittee I - Transistion to Independence ","8002","","42","26776","99176","","125952"
"9535723","P30","CA","5","N","12/22/2017","12/01/2017","11/30/2018","","P30CA016520","","PAR-13-386","5P30CA016520-42","NCI:125951\","RESEARCH CENTERS","2018","NATIONAL CANCER INSTITUTE","","PHILADELPHIA","UNITED STATES","","02","042250712","US","6463801","UNIVERSITY OF PENNSYLVANIA","PA","191046205","Not applicable to the CCSG","1913900; ","STADTMAUER, EDWARD A;","MARINO, MICHAEL A","","","Area; B-Lymphocytes; base; Biochemical Process; Biostatistics Core; Bone Marrow Transplantation; Cancer Center; Cancer Center Support Grant; Cancer Control; CCR5 gene; Cell physiology; Cell Separation; Cell Transplantation; Cells; Cellular biology; chimeric antigen receptor; Chromatin Loop; Clinical; Clinical Data; Clinical Protocols; Clinical Research; Clinical Trials; Collaborations; Cutaneous; Cytokine Signaling; data management; Developmental Biology; Direct Costs; epigenetic regulation; Flow Cytometry; Funding; Genes; Genetic; Genetic Processes; Genetic Transcription; Globin; Graft-vs-Host Disease; Grant; Group Meetings; Hematologic Neoplasms; Hematopoiesis; Hematopoietic; Hematopoietic stem cells; Human; Image; Immune; Immunobiology; Immunology; innovation; International; JAK2 gene; Laboratories; leukemia; lymphoid neoplasm; Malignant - descriptor; Malignant Neoplasms; medical schools; Medicine; melanoma; member; Molecular; Myeloproliferative disease; novel therapeutics; Pathology; Patients; Pediatric Oncology; Pediatrics; Peer Review; programs; Proteins; Publications; Publishing; Radiobiology; Reporting; Research; Research Personnel; Resources; Retreatment; Scientist; Signal Transduction; T cell therapy; Therapeutic; Tissues; Transcriptional Regulation; Translating; Translational Regulation; Vaccine Production; working group; ","Hematologic Malignancies Research Program","016520","NCI","Subcommittee I - Transistion to Independence ","8007","","42","26776","99175","","125951"
"9551830","R01","HL","7","N","12/20/2017","12/20/2017","04/30/2018","837","R01HL102121","SCHOOLS OF MEDICINE","PA-16-285","7R01HL102121-07","NHLBI:261459\","Non-SBIR/STTR RPGs","2017","NATIONAL HEART, LUNG, AND BLOOD INSTITUTE","","CHAPEL HILL","UNITED STATES","SURGERY","04","608195277","US","578206","UNIV OF NORTH CAROLINA CHAPEL HILL","NC","275990001","PUBLIC HEALTH RELEVANCE:  Outcomes from this study will identify critical components in the MT1-MMP regulatory pathway which are capable of interrupting aneurysm formation and progression. These studies will provide foundational evidence for mechanistic changes that occur during aneurysm development, focusing on both post-transcriptional and posttranslational mechanisms that may reveal potential therapeutic targets.","7019641; ","IKONOMIDIS, JOHN S;","TOLUNAY, ESER","04/01/2010","04/30/2020","","Transmembrane Proteolytic Induction and Thoracic Aneurysms","102121","ZRG1","Special Emphasis Panel ","","","07","168141","93318","261459",""
"9574350","R01","CA","7","N","12/22/2017","10/03/2017","03/31/2018","395","R01CA167079","SCHOOLS OF ARTS AND SCIENCES","PA-16-285","7R01CA167079-06","NCI:71899\","Non-SBIR/STTR RPGs","2016","NATIONAL CANCER INSTITUTE","","NOTRE DAME","UNITED STATES","CHEMISTRY","02","824910376","US","6169301","UNIVERSITY OF NOTRE DAME","IN","465565708","Narrative The development of cancer chemotherapeutics that target multiple pathways simultaneously represent an emerging paradigm in medicinal chemistry/drug design. Utilizing the techniques described in this application, inhibitors of the Hsp90-mediated protein folding process will be rationally developed with the aim of producing compounds that effectively block prostate cancer progression and growth and may be suitable for subsequent clinical evaluation.","1890588; ","BLAGG, BRIAN S J;","FU, YALI","10/03/2017","03/31/2018","","Development of Hsp90 inhibitors for the treatment of cancer","167079","DMP","Drug Discovery and Molecular Pharmacology Study Section ","","","06","47993","23906","71899",""
"9591851","R01","MH","7","N","12/21/2017","12/13/2017","01/31/2018","242","R01MH105330","SCHOOLS OF MEDICINE","PA-11-014","7R01MH105330-04","NIMH:271297\","Non-SBIR/STTR RPGs","2018","NATIONAL INSTITUTE OF MENTAL HEALTH","","RIVERSIDE","UNITED STATES","NONE","41","627797426","US","577506","UNIVERSITY OF CALIFORNIA RIVERSIDE","CA","925210001","PUBLIC HEALTH RELEVANCE: HIV infection, AIDS and HIV-associated disorders, including dementia, remain a substantial public health concern and the proposed research aims at improving our understanding of the disease process and mediating the development of treatments. Characterization of critical cellular signaling mechanisms and inflammatory mediators that contribute to HIV-1 induced neurodegeneration and inflammation may provide the basis for future therapeutic strategies. The scientific long-term objectives are to find future therapeutic targets and thus new potential treatments for HIV-associated brain injury.","7019491; ","KAUL, MARCUS ;","RAO, VASUDEV","12/13/2017","01/31/2020","Ablation; Acquired Immunodeficiency Syndrome; Affect; Allergic rhinitis; Anabolism; Animals; Apoptosis; Astrocytes; astrogliosis; base; Behavioral; behavioral impairment; biological systems; Brain; Brain Injuries; CASP3 gene; CCR5 gene; Cellular Stress; Clinical; Cognition; CXCR4 gene; cysteinyl leukotriene receptor; cysteinyl-leukotriene; Dementia; Development; Disease; DNA; Dyes; env Gene Products; Event; experimental study; extracellular signal-regulated kinase 3; Extrinsic asthma; Follow-Up Studies; Future; Genetic; glial activation; Gliosis; Glycoproteins; HIV; HIV Envelope Protein gp120; HIV Infections; HIV therapy; HIV-1; HIV-associated neurocognitive disorder; Human; immune activation; Impairment; improved; In Vitro; in vitro Model; in vivo; in vivo Model; Individual; Infection; Inflammation; Inflammation Mediators; Inflammatory; inhibitor/antagonist; Injury; knock-down; Knock-out; Laboratories; Leukotriene A4; Leukotriene Production; Link; lipid mediator; Lipids; macrophage; Macrophage Activation; MAPK1 gene; MAPK14 gene; MAPK8 gene; Mass Spectrum Analysis; Mediating; Medical Research; Memory; Methodology; Microglia; Microscopy; mitogen-activated protein kinase p38; Molecular; montelukast; mouse model; Nerve Degeneration; Neuraxis; neurogenesis; neuron apoptosis; neuron loss; Neuronal Injury; neuronal survival; Neurons; neuroprotection; neurotoxic; neurotoxicity; novel; Nuclear; Pathologic; Pathway interactions; Performance; Pharmacology; Phenotype; prevent; Process; Public Health; public health relevance; receptor; Research; Research Institute; Rodent; Role; Shotguns; Signal Pathway; Signal Transduction; Small Interfering RNA; Staining method; Stains; Synapses; Techniques; Testing; Therapeutic; therapeutic target; therapy development; Toxic effect; Toxin; Transgenic Mice; uptake; Virus; Work; ","Cysteinyl Leukotrienes in HIV Brain Injury","105330","NAED","NeuroAIDS and other End-Organ Diseases Study Section ","","","04","110165","161132","271297",""
"9607132","P30","CA","3","N","12/20/2017","12/01/2016","03/31/2018","397","P30CA033572","","PAR-11-005","3P30CA033572-34S3","NCI:865000\","RESEARCH CENTERS","2018","NATIONAL CANCER INSTITUTE","","DUARTE","UNITED STATES","","32","027176833","US","3058203","BECKMAN RESEARCH INSTITUTE/CITY OF HOPE","CA","910103012","RELEVANCE (See instructions);  Organizational capabilities under the authority of the Cancer Center Director are key for appropriate leadership, evaluation and planning. This goal enhances the Cancer Center's dedication to developing innovative new disease-fighting strategies in the battle against cancer.","1873920; ","ROSEN, STEVEN T.;","CIOLINO, HENRY P","08/01/1997","03/31/2018","animal imaging; Area; authority; Basic Science; Bioinformatics; Biometry; Cancer Center; Cancer Center Support Grant; Cancer Control; cancer research center director; cancer therapy; Categories; Cities; City of Hope Comprehensive Cancer Center; Clinical; Clinical Data; Clinical Investigator; Clinical Protocols; Clinical Research; Creativeness; Cytometry; data management; Dedications; Development; Diagnostic tests; Disease; drug discovery; Environment; Evaluation; Faculty; Faculty Recruitment; fighting; functional genomics; Funding; Genomics; Goals; Hematologic Neoplasms; Immunotherapeutic agent; Individual; infrastructure development; innovation; Institution; Instruction; Intervention; Leadership; Malignant Neoplasms; Medical center; member; Mission; molecular oncology; Pathology; Peer Review; Pharmacology; Population Research; Population Sciences; programs; Recruitment Activity; Request for Applications; Research; Research Infrastructure; Research Institute; Research Personnel; Resource Sharing; Resources; Risk; Scientist; Solid; Source; structural biology; Structure; Surveys; Technology; Therapeutic; Translations; ","Cancer Center Support Grant","033572","NCI","Subcommittee I - Transistion to Independence ","","S3","34","500000","365000","865000",""
"9607135","P30","CA","3","N","12/20/2017","12/01/2016","03/31/2018","","P30CA033572","","PAR-11-005","3P30CA033572-34S3","NCI:43572\","RESEARCH CENTERS","2018","NATIONAL CANCER INSTITUTE","","DUARTE","UNITED STATES","","32","027176833","US","3058203","BECKMAN RESEARCH INSTITUTE/CITY OF HOPE","CA","910103012","RELEVANCE (See instructions): The overall goal of the Analytical Pharmacology Core Facility is to assist with the design and conduct of pharmacology studies and encourage collaborative research between basic scientists and clinicians utilizing state-of-the-art equipment and analytical software. This goal promotes the Cancer Center's mission of developing innovative new disease-fighting strategies in the battle against cancer.","10340226; ","FRIEDMAN, MICHAEL A;","CIOLINO, HENRY P","","","analytical method; assay development; Biological; Biological Markers; Cancer Center; Cancer Center Support Grant; Categories; Cell Separation; Clinical; Collaborations; Complex; Computer software; Consultations; Core Facility; Correlative Study; Data; data acquisition; Data Analyses; design; Detection; Development; Disease; Drug Kinetics; Equipment; falls; fighting; flexibility; Fluorescence; Gases; Goals; High Pressure Liquid Chromatography; Human Resources; innovation; Instruction; instrument; Investigation; liquid chromatography mass spectrometry; Malignant Neoplasms; Manuscripts; Mass Fragmentography; mass spectrometer; Metals; method development; Methods; Mission; Modeling; Mononuclear; Natural graphite; Pharmaceutical Preparations; Pharmacology; Pharmacology Study; pre-clinical; Preparation; Process; Protocols documentation; Reporting; Research; Research Design; Research Project Grants; Running; Sampling; Schedule; Scientist; Services; Solvents; System; Tissue Sample; Ultrafiltration; Validation; Water; Writing; ","Analytical Pharmacology","033572","NCI","Subcommittee I - Transistion to Independence ","7398","S3","34","25186","18386","","43572"
"9607143","P30","CA","3","N","12/20/2017","12/01/2016","03/31/2018","","P30CA033572","","PAR-11-005","3P30CA033572-34S3","NCI:82571\","RESEARCH CENTERS","2018","NATIONAL CANCER INSTITUTE","","DUARTE","UNITED STATES","","32","027176833","US","3058203","BECKMAN RESEARCH INSTITUTE/CITY OF HOPE","CA","910103012","RELEVANCE (See instructions): The overall goal of the Clinical Protocol and Data Management core facility is to provide centralized infrastructure and support for effective, efficient conduct of clinical research including protocol document management, electronic data capture, standardized training and education, study tracking, patient safety decision support tools, quality assurance and monitoring and reporting. This goal enhances the Cancer Center's dedication to developing innovative new disease-fighting strategies in the battle against cancer.","10340226; ","FRIEDMAN, MICHAEL A;","CIOLINO, HENRY P","","","Architecture; Biometry; Biostatistics Core; Calendar; Cancer Center; Cancer Center Support Grant; Case Report Form; Cities; Clinical; Clinical Data; Clinical Protocols; Clinical Research; Clinical Trials; cohort; Core Facility; Correlative Study; Custom; Data; Data Collection; data management; Data Quality; Databases; decision research; Dedications; design; Development; Disease; Doctor of Medicine; Doctor of Philosophy; Education; electronic data; Ensure; Faculty; fighting; Goals; Good Clinical Practice; Guidelines; Health Services Accessibility; Informatics; Information Management; Information Sciences; innovation; Instruction; International; Laboratories; Logical Observation Identifiers Names and Codes; Malignant Neoplasms; Management Information Systems; member; Metadata; Methodology; Monitor; Observational Study; open source; operation; Outcomes Research; patient safety; Patients; Policies; Process; protocol development; Protocols documentation; quality assurance; Recruitment Activity; Reporting; Research; Research Infrastructure; Research Personnel; research study; Research Support; Resource Informatics; Resources; Safety; Sampling Studies; Services; Standardization; support tools; System; Systematized Nomenclature of Medicine; Tissue Sample; Tissues; Training; Training and Education; Translating; Translational Research; Vocabulary; Work; ","Clinical Protocol and Data Management","033572","NCI","Subcommittee I - Transistion to Independence ","7406","S3","34","47729","34842","","82571"
"9616530","R01","ES","3","N","12/19/2017","11/01/2017","10/31/2018","113","R01ES024872","SCHOOLS OF MEDICINE","RFA-ES-13-014","3R01ES024872-04S1","NIEHS:110428\","Non-SBIR/STTR RPGs","2018","NATIONAL INSTITUTE OF ENVIRONMENTAL HEALTH SCIENCES","","PITTSBURGH","UNITED STATES","GENETICS","14","004514360","US","2059802","UNIVERSITY OF PITTSBURGH AT PITTSBURGH","PA","152132303","PUBLIC HEALTH RELEVANCE: Cancer is a leading cause of death in the United States, which can arise, in part, from the accumulation of heritable somatic mutations combined with exposure to environmental toxicants. When DNA is not accurately repaired, genomic instability can result which is a hallmark of tumors. The work described here addresses how the Shu complex repairs DNA damage caused by environmental toxicants and how mis-regulation of this process can lead to increased risk to cancer development.","6863009; ","BERNSTEIN, KARA A;","SHAUGHNESSY, DANIEL","01/01/2015","10/31/2019","Address; Alkylating Agents; Alkylation; Alpha Cell; Architecture; base; Binding; Biochemical; Biological Assay; cancer risk; Cause of Death; chromatin immunoprecipitation; Clustered Regularly Interspaced Short Palindromic Repeats; Complex; Crystallization; Data; Development; DNA; DNA Alkylation; DNA Binding; DNA Damage; DNA Double Strand Break; DNA lesion; DNA Repair; DNA Repair Gene; DNA Repair Pathway; DNA replication fork; DNA Structure; DNA-Protein Interaction; Double Strand Break Repair; Environment; Eukaryota; Exposure to; Genes; Genetic; Genetic Polymorphism; Genetic Recombination; Genomic Instability; helicase; Heritability; Homologous Gene; homologous recombination; Human; Human Cell Line; human disease; Hypersensitivity; Individual; Industrialization; insight; Investigation; Lead; Lesion; Link; Malignant Neoplasms; Maps; Mediating; member; Methyl Methanesulfonate; Modeling; mutant; Mutation; neoplastic cell; Nucleotides; Outcome; Pathway interactions; Play; Point Mutation; prevent; Process; protein complex; protein protein interaction; Proteins; public health relevance; Rad51 recombinase; Recruitment Activity; Regulation; Repair Complex; repaired; Research Personnel; Risk; Role; Saccharomycetales; Scheme; Somatic Mutation; Source; Stress; Structural Protein; Structure; Testing; Time; Toxic Environmental Substances; transcription activator-like effector nucleases; tumor; tumorigenesis; United States; Vitronectin; Work; yeast two hybrid system; Yeasts; ","Replication fork dynamics and repair by Rad51 paralogues after DNA alkylation","024872","ZES1","Special Emphasis Panel ","","S1","04","70863","39565","110428",""
"9001380","R13","NS","4","N","02/19/2016","03/01/2016","07/31/2016","853","R13NS083275","","PA-12-212","4R13NS083275-04","NIA:5000\NINDS:10000\","OTHER RESEARCH-RELATED","2016","NATIONAL INSTITUTE OF NEUROLOGICAL DISORDERS AND STROKE","Aging; Brain Disorders; Mental Health; Neurosciences; ","SAN FRANCISCO","UNITED STATES","","12","613338789","US","2464601","NORTHERN CALIFORNIA INSTITUTE/RES/EDU","CA","941211545","The purpose of this R13 conference grant application is to seek partial funding support for the annual meeting of the Entertainment Software and Cognitive Neurotherapeutics Society, ESCoNS, a non-profit organization. ESCoNS was founded and held its first highly successful meeting on September 19-20, 2011 at the UCSF Mission Bay Conference Center in San Francisco, CA. It attracted 221 attendees: cognitive and clinical scientists, clinicians, officials from the National Institute of Health and the Department of Defense, leaders of the videogame industry and the scientific media. In 21 talks given by world-leading scientists, two panel discussions, and over 50 scientific poster presentations, the consensus emerged that we now have the knowledge base to combine the neuroscience of brain plasticity and cognitive training with entertainment and interactive software technology to target brain dysfunction in a number of human illnesses, creating an innovative field of 'cognitive neurotherapeutics.' The purpose of ESCoNS 2 (and of ongoing ESCoNS meetings) is to leverage the expertise of scientific and software specialists for the design of these new approaches to cognitive training, as well as to surmount barriers in collaborative efforts and intervention implementation. Specific Aim 1: Speakers from the scientific community will address emerging knowledge on mechanisms of experience-dependent neuroplasticity and its alterations in neuropsychiatric disease, neurodegenerative disease, and normal aging; specialists in interactive and entertainment software from both academia and industry will share their knowledge of their craft and its potential applications to address impaired neural system functioning. The overall objective is to create a powerful and highly productive two-way communication between these groups - experts who do not normally have a venue for professional interaction. Specific Aim 2: As a secondary aim, the ESCoNS Organizing Committee will make a targeted effort to include women and underrepresented minorities in this emerging collaboration, through widespread invitations to junior participants and attendees, including undergraduate and graduate students who will be the next generation to carry this field forward.","1893336; ","VINOGRADOV, SOPHIA ;","CHEN, DAOFEN","03/01/2013","07/31/2016","Academia; Address; Aging; Applications Grants; Arts; Brain; brain dysfunction; California; Clinical; Cognitive; Cognitive Science; cognitive training; Collaborations; Communication; Communities; Computer software; computerized; Consensus; Department of Defense; design; Development; Ensure; Event; experience; Faculty; Family; Foundations; Functional disorder; Funding; Goals; graduate student; Grant; Heart; Human; Industry; industry partner; innovation; interest; Intervention; Knowledge; knowledge base; Laboratories; Los Angeles; meetings; member; Mental disorders; Mission; nervous system disorder; Neurodegenerative Disorders; Neurology; Neuronal Plasticity; neuropsychiatric disorder; Neurosciences; next generation; Nonprofit Organizations; normal aging; novel strategies; Oral; Participant; posters; professor; programs; Psychiatry; Public Policy; relating to nervous system; Research; Research Personnel; Rosa; San Francisco; Schools; Science; Scientist; Seeds; Series; social; Societies; software development; Specialist; student participation; symposium; System; Technology; Therapeutic; tool; Translating; undergraduate student; Underrepresented Minority; United States National Institutes of Health; Universities; Woman; ","Entertainment Software and Neurotherapeutics Society (ESCoNS) Conferences","083275","NSD","National Institute of Neurological Disorders and Stroke Initial Review Group ","","","04","15000","0","15000",""
