"APPLICATION_ID","ACTIVITY","ADMINISTERING_IC","APPLICATION_TYPE","ARRA_FUNDED","AWARD_NOTICE_DATE","BUDGET_START","BUDGET_END","CFDA_CODE","CORE_PROJECT_NUM","ED_INST_TYPE","FOA_NUMBER","FULL_PROJECT_NUM","FUNDING_ICs","FUNDING_MECHANISM","FY","IC_NAME","NIH_SPENDING_CATS","ORG_CITY","ORG_COUNTRY","ORG_DEPT","ORG_DISTRICT","ORG_DUNS","ORG_FIPS","ORG_IPF_CODE","ORG_NAME","ORG_STATE","ORG_ZIPCODE","PHR","PI_IDS","PI_NAMEs","PROGRAM_OFFICER_NAME","PROJECT_START","PROJECT_END","PROJECT_TERMS","PROJECT_TITLE","SERIAL_NUMBER","STUDY_SECTION","STUDY_SECTION_NAME","SUBPROJECT_ID","SUFFIX","SUPPORT_YEAR","DIRECT_COST_AMT","INDIRECT_COST_AMT","TOTAL_COST","TOTAL_COST_SUB_PROJECT"
"9549516","ZIA","CL","1","N","","","","","ZIACL090007","","","1ZIACL090007-11","","INTRAMURAL RESEARCH","2017","CLINICAL CENTER","","","","","","","","","CLINICAL CENTER","","","","9414709; ","FRANK, JOSEPH ;","","","","Adverse event; Apoptotic; Area; Behavioral; Brain; Cell Survival; Cells; Characteristics; Cities; Clinic; Clinical; Clinical Trials; Complex; congenital heart disorder; Cryopreserved Cell; Cyclic GMP; Cytosine deaminase; Development; Electron Microscopy; Excision; Experimental Models; FDA approved; Ferumoxytol; Genetic Engineering; Glioblastoma; Goals; Growth; Heparin; Hour; human stem cells; Hypoxia; Implant; implantation; improved; in vivo; Incubated; Injection of therapeutic agent; Iron; iron oxide; Label; lateral ventricle; Liver; Magnetic Resonance Imaging; Magnetism; Mammalian Cell; Metabolic; Methods; migration; Modeling; Monitor; Mus; nanoparticle; Neoplasm Metastasis; nerve stem cell; neurogenesis; Neurologic Deficit; neurotoxicity; olfactory bulb; Operative Surgical Procedures; Patients; Pattern; Perinatal; Pharmaceutical Preparations; Phenotype; pre-clinical; Protamines; Rattus; Recurrence; Reporting; research clinical testing; Residual Tumors; restoration; Safety; scale up; Serum-Free Culture Media; Spleen; Stem cells; subventricular zone; Surface; systemic toxicity; T-Lymphocyte; Techniques; therapeutic candidate; therapeutic target; Tissues; Toxic effect; translational study; Transmission Electron Microscopy; United States National Institutes of Health; Vision; ","Pre-clinical evaluation of Magnetically labeled Cells for Cellular MRI","090007","","","","","11","","","0",""
"9552565","ZIA","CL","1","N","","","","","ZIACL010356","","","1ZIACL010356-02","","INTRAMURAL RESEARCH","2017","CLINICAL CENTER","","","","","","","","","CLINICAL CENTER","","","","12471593; ","FRANK, KAREN ;","","","","Bacteria; carbapenemase; Clinical; Collection; Data Analyses; Databases; Disease Outbreaks; efficacy testing; Environment; epidemiology study; Genomics; Goals; Hospitals; Human; Infection Control; insight; Institution; Investigation; Klebsiella pneumonia bacterium; Measures; microbiome; Morbidity - disease rate; mortality; multi-drug resistant pathogen; Nosocomial Infections; Organism; Patients; Population; Resistance; Role; screening; Source; ","Environmental Surveillance for Bacteria","010356","","","","","02","","","0",""
"9557285","ZIA","CL","1","N","","","","","ZIACL060068","","","1ZIACL060068-10","","INTRAMURAL RESEARCH","2017","CLINICAL CENTER","","","","","","","","","CLINICAL CENTER","","","","9692799; ","CHAN, LEIGHTON ;","","","","Aerobic; Aerobic Exercise; Algorithms; American; arm; base; Behavioral; Cardiac Output; Cardiology; cardiorespiratory fitness; Cell Respiration; Chronic Obstructive Airway Disease; Clinical Research; Clinical Trials; college; Congestive Heart Failure; Consensus; Control Groups; Data; Data Analyses; Drops; Education; Effectiveness; Energy Metabolism; Enrollment; evidence based guidelines; Exercise; exercise rehabilitation; Exercise stress test; exercise training; exhaustion; Fatigue; Gases; health related quality of life; healthy volunteer; Heart Rate; improved; indexing; International; Interstitial Lung Diseases; Level of Evidence; Lung; Measurement; Measures; Medical; Metabolic; Modality; Moods; Muscle; Outcome; Oxygen; Oxygen Consumption; Patient Education; Patient Self-Report; Patients; Pattern; Performance; Phase II Clinical Trials; Physical activity; Physical Performance; Physicians; Physiological; Protocols documentation; psychosocial; Publishing; Pulmonary Hypertension; pulmonary rehabilitation; Qualifying; Quality of life; Questionnaires; Randomized; randomized trial; Readiness; Recommendation; Recruitment Activity; Regimen; Rehabilitation therapy; Reporting; Research; response; Rest; Safety; Sample Size; screening; sedentary; Severities; Study Subject; Supervision; symposium; Symptoms; Test Result; Testing; Time; Training; Training and Education; Training Programs; treadmill; Treadmill Tests; trend; Update; Volition; Walking; Work; ","Response to Aerobic Exercise in Patients with Pulmonary Hypertension","060068","","","","","10","","","0",""
"9557286","ZIA","CL","1","N","","","","","ZIACL060079","","","1ZIACL060079-08","","INTRAMURAL RESEARCH","2017","CLINICAL CENTER","","","","","","","","","CLINICAL CENTER","","","","9692799; ","CHAN, LEIGHTON ;","","","","Acute; Address; Affect; Age; Amendment; base; Behavior; biobank; Blast Cell; Blood; Case Study; Cells; Clinical; clinical imaging; clinical phenotype; Cognitive; cohort; Common Data Element; Communication; Communities; Control Groups; Data; Data Set; Databases; demographics; diagnostic biomarker; Diagnostic Imaging; Discourse analysis; Educational Background; Enrollment; Eye; Future; Gender; Generations; Grant; healthy volunteer; Image; imaging biomarker; inclusion criteria; Individual; Injury; Language; Magnetic Resonance Imaging; Measures; Natural History; novel diagnostics; Outcome; Outcome Measure; outcome prediction; Pathology; patient population; Patient Recruitments; Patients; Phenotype; Population; Population Control; Positron-Emission Tomography; Prospective cohort study; Protocols documentation; Recruitment Activity; Research; Research Personnel; Resources; Saliva; Sampling; Scanning; Series; Serum; Severities; social cognition; study population; Taxonomy; TBI Patients; Techniques; Testing; Time; Traumatic Brain Injury; Video Recording; ","Long Term Clinical Correlates of TBI: Imaging, Biomarkers, Clinical Phenotyping","060079","","","","","08","","","0",""
"9562828","ZIA","CL","1","N","","","","","ZIACL090018","","","1ZIACL090018-08","","INTRAMURAL RESEARCH","2017","CLINICAL CENTER","","","","","","","","","CLINICAL CENTER","","","","10712531; ","MOLLURA, DANIEL ;","","","","Age; Algorithmic Software; Algorithms; Benefits and Risks; Biological Neural Networks; Bronchiectasis; Categories; Clinical; communicable disease diagnosis; Communicable Diseases; computer aided detection; Computer Assisted; computerized; Consent; Consent Forms; Data; Databases; Diagnosis; Diagnostic; Diagnostic Imaging; Diagnostic radiologic examination; Discipline of Nuclear Medicine; Disease; disease diagnosis; Documentation; Early Diagnosis; effective therapy; Ethnic Origin; falls; Gender; graph theory; Human Subject Research; Image; Image Analysis; imaging study; Imaging Techniques; improved; Infection; Lead; Magnetic Resonance Imaging; Mammography; Measurement; Medical Records; Methodology; Methods; Morbidity - disease rate; mortality; Outcome Study; pathogen; patient population; Patients; Pattern; Play; Prevalence; prognostic value; Protocols documentation; Public Health; quantitative imaging; Race; radiological imaging; Radiology Specialty; Recruitment Activity; Research; response; Retrospective Studies; Risk; Role; Severities; software development; Specificity; Subjects Selections; System; Techniques; Tuberculosis; Ultrasonography; Visual; X-Ray Computed Tomography; ","Computer-Aided Detection for Infectious Disease Imaging","090018","","","","","08","","","0",""
"9562831","ZIA","CL","1","N","","","","","ZIACL090054","","","1ZIACL090054-01","","INTRAMURAL RESEARCH","2017","CLINICAL CENTER","","","","","","","","","CLINICAL CENTER","","","","9692744; ","QUEZADO, ZENAIDE ;","","","","Acute; Acute Pain; Adjuvant; Adjuvant Analgesic; Adolescent; Adolescent obesity; Adult; Adverse effects; Afferent Neurons; Agonist; Analgesics; Anesthetics; Animals; bariatric surgery; base; cancer pain; central sensitization; Child; Childhood; Chronic; chronic pain; Clinical; clinical Diagnosis; Clinical Research; Complex Regional Pain Syndromes; Consensus; Data; design; Development; Dexmedetomidine; Dose; efficacy testing; experimental study; Expert Opinion; functional disability; Goals; Hospitals; Human; Hyperalgesia; improved; inflammatory neuropathic pain; Infusion procedures; Inpatients; Ketamine; Laboratories; Location; Measurement; Modeling; Mood Disorders; mouse model; N-Methyl-D-Aspartate Receptors; Nitric Oxide; Nociception; novel; novel strategies; novel therapeutic intervention; Opioid; Opioid Receptor; opioid use; Outpatients; Pain; Pain intensity; Pain management; painful neuropathy; Patients; pediatric patients; Perioperative; Pharmacological Treatment; Phenotype; Play; Postoperative Period; postsynaptic; pre-clinical; Pre-Clinical Model; programs; Property; Randomized Clinical Trials; Receptor Activation; Role; safety and feasibility; Sampling; sedative; Sickle Cell; Sickle Cell Anemia; Syndrome; Tonsillectomy; Visceral pain; Work; ","Development of novel strategies for the treatment of pain in children","090054","","","","","01","","","0",""
"9565336","ZIA","CL","1","N","","","","","ZIACL060017","","","1ZIACL060017-27","","INTRAMURAL RESEARCH","2017","CLINICAL CENTER","","","","","","","","","CLINICAL CENTER","","","","10687219; ","DAMIANO, DIANE ;","","","","Activities of Daily Living; Adult; Affect; Age; age related; Ankle; arm; Attention; Body Weight; Brachial plexus structure; Cerebral Palsy; Characteristics; comparative; comparison group; Complex; Data; Data Analyses; Databases; Development; Devices; disability; Disease; Dystonia; Equilibrium; Exhibits; foot; Gait; Goals; Gold; healthy volunteer; Human; Impairment; improved; Individual; insight; Intervention; Laboratories; Leg; Limb structure; Link; Lower Extremity; Methodology; Motion; Motor; Motor Skills; Movement; movement analysis; Movement Disorders; muscle strength; Nature; neuromusculoskeletal; Orthotic Devices; Paper; Paralysed; Patients; Pattern; Persons; Physical assessment; prevent; Process; Protocols documentation; Publishing; Recovery of Function; Rehabilitation therapy; Research; Shoes; Spastic; spasticity; Specialist; Support System; System; Testing; Training; treadmill; Upper Extremity; Walking; ","A Rigid Body Database On Human Movement","060017","","","","","27","","","0",""
"9572254","ZIA","CL","1","N","","","","","ZIACL040011","","","1ZIACL040011-10","","INTRAMURAL RESEARCH","2017","CLINICAL CENTER","","","","","","","","","CLINICAL CENTER","","","","9692774; ","WOOD, BRADFORD ;","","","","Ablation; Address; Adopted; Adoption; Adverse effects; Anatomy; Angioplasty; anti-cancer therapeutic; anticancer treatment; Area; Atherosclerosis; Attention; Automation; base; Beds; bench to bedside; Biopsy; Brain Aneurysms; Bronchoscopy; cancer therapy; Caring; Catheters; Cellular Phone; Checkpoint therapy; Chemoembolization; Clinic; Clinical; Clinical Research; Clinical Treatment; Clinical Trials; clinically relevant; Computer software; cone-beam computed tomography; cost; cost effective; Data; design; Development; Device or Instrument Development; Devices; Diagnosis; Disease; Dose; Drug Combinations; Drug Delivery Systems; drug discovery; Drug Targeting; Electromagnetics; empowered; Endoscopes; Endoscopy; Engineering; Feedback; Fluoroscopy; Focused Ultrasound Therapy; Future; Goals; Grant; Human; Image; image guided; image guided intervention; image guided therapy; Imagery; Imaging Device; imaging modality; Immune checkpoint inhibitor; improved; improved outcome; In Vitro; in vivo; Institutes; instrumentation; interest; Intervention; Interventional radiology; Intramural Research Program; Laboratories; Laboratory Research; Lasers; Legal patent; Liposomes; Liver; Localized Disease; Magnetic Resonance Imaging; Malignant neoplasm of prostate; Malignant Neoplasms; Medical; Medical Device; Medicine; Metabolic; Methods; microwave electromagnetic radiation; Miniaturization; minimally invasive; Mission; Modality; Modeling; Molecular; molecular targeted therapies; Monitor; Morphology; multi-component intervention; multidisciplinary; Multimodal Imaging; multimodality; Navigation System; Needles; new technology; Normal tissue morphology; novel; novel therapeutics; oncology; Operating Rooms; Operative Surgical Procedures; Optics; Paper; Patients; personalized therapeutic; Pharmaceutical Preparations; Pharmacologic Substance; Pharmacology; Phase; Positioning Attribute; Positron-Emission Tomography; pre-clinical; Pre-Clinical Model; preclinical study; Preparation; Privatization; Procedures; Process; programs; Property; Prostate; Prostate Ablation; prostate biopsy; prototype; radiofrequency; Radiofrequency Interstitial Ablation; radiological imaging; Research; Research Personnel; Research Project Grants; Resolution; Resources; Robot; Robotics; Rotation; Route; Sampling; scalpel; Schedule; Science; Solid Neoplasm; Source; Stents; System; Systemic disease; targeted treatment; Techniques; Technology; Temperature; temporal measurement; Testing; Therapeutic; Therapeutic Agents; Therapeutic Embolization; Therapeutic Intervention; Thermal Ablation Therapy; Time; Tissues; tool; tool development; Toxic effect; Training Programs; Translating; Translational Research; Translations; treatment planning; tumor; tumor ablation; Ultrasonography; United States National Institutes of Health; Uterine Fibroids; validation studies; vector; Vendor; Vision; Work; ","Navigation tools for Image Guided Minimally invasive Therapies","040011","","","","","10","","","0",""
"9549435","ZIA","CL","1","N","","","","","ZIACL000785","","","1ZIACL000785-10","","INTRAMURAL RESEARCH","2017","CLINICAL CENTER","","","","","","","","","CLINICAL CENTER","","","","15186921; ","COHEN-BERGER, ANN ;","","","","Address; Adult; Analgesics; Analysis of Variance; animal-assisted therapy; Animals; Attention; Attitude; base; beta-Endorphin; cancer palliative treatment; Cancer Patient; Chronic Disease; Clinical; Complement; Consult; Data; demographics; design; Dimensions; Distress; Effectiveness; Emotional; Environment; experience; Family; Goals; Hour; Hydrocortisone; improved; Individual; Indwelling Catheter; interest; Intervention; Literature; Measurable; Measures; Medical; Movement; oncology; Ownership; Pain; Pain intensity; Pain management; Palliative Care; Participant; Patients; Persons; pet animal; Pharmaceutical Preparations; Physiological; primary outcome; programs; psychologic; psychological distress; psychosocial; Quality of life; Randomized; Recreation; Research; response; Salivary; secondary outcome; Sensory; Serum; Services; social skills; statistics; Stress; Surveys; Symptoms; Tactile; Terminally Ill; Time; Time Study; United States National Institutes of Health; Work; ","Animal Assisted Therapy on Distress in Oncology Patients Treated for Pain","000785","","","","","10","","","0",""
"9549442","ZIA","CL","1","N","","","","","ZIACL001179","","","1ZIACL001179-16","","INTRAMURAL RESEARCH","2017","CLINICAL CENTER","","","","","","","","","CLINICAL CENTER","","","","9414635; ","SOLOMON, MICHAEL ;","","","","Accounting; Acute; allograft rejection; allotransplant; analytical tool; Animals; Bacteria; Biopsy; bisulfite; Blood; Cardiac; Caring; Cessation of life; Clinical; Collaborations; Cyclosporins; Data; design; DNA; Dose; Energy Metabolism; Epigenetic Process; epigenetic profiling; Escherichia coli; Formalin; Future; Gene Expression; Genes; Genomics; Goals; Harvest; Heart; heart allograft; Heart Transplantation; Histopathology; Human; improved outcome; In Situ Hybridization; indexing; Infection; Inflammation; Inflammatory; Inflammatory Response; Laboratories; Liver; Lung; Lung Transplantation; Metabolic; Methods; Methylation; Microarray Analysis; Modeling; Monitor; Morbidity - disease rate; mortality; National Heart, Lung, and Blood Institute; Operative Surgical Procedures; Paraffin; Pathogenesis; Peripheral Blood Mononuclear Cell; Pilot Projects; Pneumonia; Process; Proteomics; Protocols documentation; Randomized; Rattus; Reporting; Reverse Transcriptase Polymerase Chain Reaction; Saline; Schedule; Source; Spleen; subcutaneous; Symptoms; Techniques; Technology; Thymus Gland; Time; Tissues; tool; Transplant Recipients; Transplantation; Transplanted tissue; Western Blotting; ","Differentiation Of Acute Rejection From Infection In Rat Heart Transplant Model","001179","","","","","16","","","0",""
"9549482","ZIA","CL","1","N","","","","","ZIACL009005","","","1ZIACL009005-11","","INTRAMURAL RESEARCH","2017","CLINICAL CENTER","","","","","","","","","CLINICAL CENTER","","","","2432508; ","SUFFREDINI, ANTHONY F.;","","","","Acute; Adrenal Cortex Hormones; Adult Respiratory Distress Syndrome; American; Anti-inflammatory; Anti-Inflammatory Agents; Antibodies; Antibody titer measurement; Archives; ATP phosphohydrolase; Autoantibodies; Autoantigens; base; Biological Assay; Biological Markers; Blood Cells; Blood specimen; Bronchoalveolar Lavage; candidate marker; Carboxy-Lyases; Caring; Categories; chemokine; Chest; Clinical; Clinical Trials; Coagulation Process; Collaborations; Complication; cytokine; Diffuse; Enrollment; Etiology; Fever; Functional disorder; Goals; Growth Factor; Healthcare; Hemostatic Agents; high risk; Hypotension; Immunoassay; Infection; Inflammation; Inflammatory Response; Injury; insight; Interleukin-6; International; Ischemia; Lead; Life; Lung; lung injury; Measures; Mediating; Mediator of activation protein; Methods; Methylprednisolone; microbial; MicroRNAs; Morbidity - disease rate; mortality; Organ; Outcome; pathogen; Pathogenesis; Patient risk; Patients; Plasma; Play; Pneumonia; Potassium Channel; procalcitonin; prospective; Protein Array; Protein C; Proteins; Pulmonary aspiration of gastric contents; Pulmonary Inflammation; Research; Respiratory Failure; response; Role; Rosa; Sampling; Sepsis; septic; Septic Shock; Shock; Site; Societies; Stomach; symposium; Syndrome; Tachycardia; Technology; Tennessee; Time; Time Study; Tissues; TNF gene; treatment as usual; Universities; Vascular Endothelial Growth Factors; Vasodilation; Viscera; White Blood Cell Count procedure; Work; ","Biomarkers in Patients with Sepsis or Acute Respiratory Distress Syndrome","009005","","","","","11","","","0",""
"9549546","ZIA","CL","1","N","","","","","ZIACL090044","","","1ZIACL090044-01","","INTRAMURAL RESEARCH","2017","CLINICAL CENTER","","","","","","","","","CLINICAL CENTER","","","","15187036; ","SEAM, NITIN ;","","","","Agreement; base; Bronchoscopy; Critical Care; Data; Databases; Education; Educational process of instructing; Effectiveness; Environmental air flow; Fellowship; Fellowship Program; Funding; Goals; Hospitals; improved; Income; Knowledge; Learning; Lung; Maryland; Mechanical ventilation; Paper; Participant; patient safety; Patients; performance tests; Persons; Pre-Post Tests; Procedures; Process; programs; Publishing; Research Activity; respiratory; simulation; Statistical Data Interpretation; Surveys; Testing; Time; Training; Training Programs; United States National Institutes of Health; Universities; Ventilator; Washington; ","Master Level Learning","090044","","","","","01","","","0",""
"9549557","ZIA","CL","1","N","","","","","ZIACL090050","","","1ZIACL090050-01","","INTRAMURAL RESEARCH","2017","CLINICAL CENTER","","","","","","","","","CLINICAL CENTER","","","","9692738; ","EICHACKER, PETER ;","","","","Adult; Blood capillaries; capillary; Cardiopulmonary; Cardiovascular system; Caring; Complex; cost; crystalloid; Evaluation; Government; hemodynamics; Hospital Costs; Hospital Mortality; Hospitals; Hour; Hypotension; improved; Institutes; Institution; Intervention; Leg; Length of Stay; Liquid substance; Literature; Measurement; Measures; Meta-Analysis; mortality; Organ failure; Patients; Performance; Perfusion; Peripheral; Physiologic pulse; Provider; Publishing; Reporting; Resources; Resuscitation; Sepsis; Septic Shock; Skin; systematic review; Tissues; Ultrasonography; United States Centers for Medicare and Medicaid Services; Vasoconstrictor Agents; ","A Critical Review of the Government Mandated Cardiovascular Resuscitation  Interventions for Sepsis (SEP-1)","090050","","","","","01","","","0",""
"9549559","ZIA","CL","1","N","","","","","ZIACL090051","","","1ZIACL090051-01","","INTRAMURAL RESEARCH","2017","CLINICAL CENTER","","","","","","","","","CLINICAL CENTER","","","","8212291; ","SOLOMON, STEVEN ;","","","","Acute; Adverse effects; Affect; Animal Model; antimicrobial; Bacterial Infections; Blood Circulation; Blood Component Removal; Bone Marrow; Calcium; Canis familiaris; Cardiopulmonary; Cells; Clinical; clinical practice; Collection; Dexamethasone; Dose; Ensure; Escherichia coli; Functional disorder; Goals; granulocyte; Granulocyte Colony-Stimulating Factor; Hetastarch; Hour; Human; Immune response; Immune system; Immunocompetent; Impairment; improved; Infection; Innate Immune Response; Mediator of activation protein; Modeling; Morbidity - disease rate; mortality; Neutropenia; neutrophil; Organ; Outcome; outcome forecast; Patients; Pharmaceutical Preparations; Play; Pneumonia; Procedures; Production; prophylactic; Protocols documentation; Recording of previous events; Recruitment Activity; response; Role; Sepsis; septic; Septic Shock; Site; Staphylococcus aureus; Survivors; Therapeutic; Transfusion; Treatment Efficacy; Work; ","Effects of Adjunctive Therapy with Early Transfusion of Granulocytes in a Canine Model of S. aureus Pneumonia","090051","","","","","01","","","0",""
"9550686","ZIF","CL","1","N","","","","","ZIFCL000001","","","1ZIFCL000001-11","","INTRAMURAL RESEARCH","2017","CLINICAL CENTER","","","","","","","","","CLINICAL CENTER","","","","; ",",  ;","","","","","CC CCMF allocation","000001","","","","","11","","","0",""
"9552556","ZIA","CL","1","N","","","","","ZIACL001153","","","1ZIACL001153-07","","INTRAMURAL RESEARCH","2017","CLINICAL CENTER","","","","","","","","","CLINICAL CENTER","","","","9692658; ","AMES, NANCY ;","","","","18 year old; Adult; Alternative Therapies; Anxiety; Attention; Awareness; Caring; Complementary therapies; Consent; design; Eligibility Determination; experience; group intervention; Health; Hour; interest; Music; Operative Surgical Procedures; Opioid; opioid use; Pain; Participant; Patient-Controlled Analgesia; Patients; Postoperative Period; Protocols documentation; Publications; Randomized Controlled Trials; Research; Schedule; standard care; Time; treatment group; Wholistic Therapies; ","THE EFFECT OF MUSIC LISTENING ON THE AMOUNT OF OPIOIDS USED","001153","","","","","07","","","0",""
"9555568","ZIA","CL","1","N","","","","","ZIACL010303","","","1ZIACL010303-17","","INTRAMURAL RESEARCH","2017","CLINICAL CENTER","","","","","","","","","CLINICAL CENTER","","","","9603766; ","REMALEY, ALAN THOMAS;","","","","Algorithms; Biological Assay; Biological Markers; cardiovascular risk factor; Cardiovascular system; Cholesterol; Collaborations; Cooperative Research and Development Agreement; Coronary Arteriosclerosis; Development; Devices; diagnostic accuracy; Effectiveness; Hereditary Disease; High Density Lipoproteins; improved; Investigation; Lipoproteins; Liver diseases; Manufacturer Name; Measures; Metabolism; Methods; particle; Patients; Performance; Publications; Publishing; Research Personnel; Risk Assessment; Risk Estimate; Risk Marker; Testing; United States National Institutes of Health; ","Development and Investigation of  Assays For Cardiovascular Risk Assessment","010303","","","","","17","","","0",""
"9557289","ZIA","CL","1","N","","","","","ZIACL080014","","","1ZIACL080014-10","","INTRAMURAL RESEARCH","2017","CLINICAL CENTER","","","","","","","","","CLINICAL CENTER","","","","9692817; ","LOZIER, JAY ;","","","","Abnormal Platelet; acquired factor; Address; African American; Agonist; Alpha Granule; antibody inhibitor; Blood; Blood coagulation; Blood Coagulation Disorders; Blood Coagulation Factor; Blood Platelet Disorders; Blood Platelets; cell injury; Cell Line; Coagulation Factor Gene; Coagulation Process; Code; Cytokine Gene; Cytoplasmic Granules; Defect; Development; Diagnosis; Disease; DNA; DNA Sequence Determination; Electron Microscopy; Elements; Endothelial Cells; Enzymes; Etiology; Evaluation; Factor VIII; Family; Fibrin fragment D; Fibrin split products; Fibrinogen; Functional disorder; General Population; Genes; Genetic Polymorphism; Genetic study; genome sequencing; Haplotypes; Hemophilia A; Hemorrhage; Hemostatic function; Hereditary Disease; HIV; HIV Infections; IL2 gene; Inherited; inhibitor/antagonist; insight; Interleukin-1; Interleukin-10; Interleukin-12; Interleukin-2; Intervention; Intramural N.I.H. Research Support; Journals; Malignant Neoplasms; Measures; Medical; Minority; Morbidity - disease rate; mortality; National Heart, Lung, and Blood Institute; National Human Genome Research Institute; neutralizing antibody; novel; Pathologic; Patients; Plasma; Platelet aggregation; Platelet Function Tests; Play; Population; programs; Proteins; Protocols documentation; Publishing; Reporting; repository; Research Personnel; Research Subjects; Risk; Role; Sampling; Secondary to; Sickle Cell Anemia; Stem cell transplant; Syndrome; Testing; Thrombasthenia; Thrombomodulin; Thrombosis; United States National Institutes of Health; Variant; volunteer; von Willebrand Factor; ","Endothelial, Platelet, & Coagulation Factor Abnormalities in Abnormal Hemostasis","080014","","","","","10","","","0",""
